[I 2026-06-20 19:50:31,863] Trial 4 finished with value: 0.729906628841659 and parameters: {'C': 0.006026889128682512}. Best is trial 2 with value: 0.9146405656403624.
C:\Users\Britod\.conda\envs\nlp\Lib\site-packages\sklearn\svm\_classes.py:32: FutureWarning: The default value of `dual` will change from `True` to `'auto'` in 1.5. Set the value of `dual` explicitly to suppress the warning.
  warnings.warn(
C:\Users\Britod\.conda\envs\nlp\Lib\site-packages\sklearn\svm\_classes.py:32: FutureWarning: The default value of `dual` will change from `True` to `'auto'` in 1.5. Set the value of `dual` explicitly to suppress the warning.
  warnings.warn(
C:\Users\Britod\.conda\envs\nlp\Lib\site-packages\sklearn\svm\_classes.py:32: FutureWarning: The default value of `dual` will change from `True` to `'auto'` in 1.5. Set the value of `dual` explicitly to suppress the warning.
  warnings.warn(
C:\Users\Britod\.conda\envs\nlp\Lib\site-packages\sklearn\svm\_classes.py:32: FutureWarning: The default value of `dual` will change from `True` to `'auto'` in 1.5. Set the value of `dual` explicitly to suppress the warning.
  warnings.warn(
C:\Users\Britod\.conda\envs\nlp\Lib\site-packages\sklearn\svm\_classes.py:32: FutureWarning: The default value of `dual` will change from `True` to `'auto'` in 1.5. Set the value of `dual` explicitly to suppress the warning.
  warnings.warn(
C:\Users\Britod\.conda\envs\nlp\Lib\site-packages\sklearn\svm\_classes.py:32: FutureWarning: The default value of `dual` will change from `True` to `'auto'` in 1.5. Set the value of `dual` explicitly to suppress the warning.
  warnings.warn(
C:\Users\Britod\.conda\envs\nlp\Lib\site-packages\sklearn\svm\_classes.py:32: FutureWarning: The default value of `dual` will change from `True` to `'auto'` in 1.5. Set the value of `dual` explicitly to suppress the warning.
  warnings.warn(
C:\Users\Britod\.conda\envs\nlp\Lib\site-packages\sklearn\svm\_classes.py:32: FutureWarning: The default value of `dual` will change from `True` to `'auto'` in 1.5. Set the value of `dual` explicitly to suppress the warning.
  warnings.warn(
C:\Users\Britod\.conda\envs\nlp\Lib\site-packages\sklearn\svm\_classes.py:32: FutureWarning: The default value of `dual` will change from `True` to `'auto'` in 1.5. Set the value of `dual` explicitly to suppress the warning.
  warnings.warn(
C:\Users\Britod\.conda\envs\nlp\Lib\site-packages\sklearn\svm\_classes.py:32: FutureWarning: The default value of `dual` will change from `True` to `'auto'` in 1.5. Set the value of `dual` explicitly to suppress the warning.
  warnings.warn(
C:\Users\Britod\.conda\envs\nlp\Lib\site-packages\sklearn\svm\_classes.py:32: FutureWarning: The default value of `dual` will change from `True` to `'auto'` in 1.5. Set the value of `dual` explicitly to suppress the warning.
  warnings.warn(
C:\Users\Britod\.conda\envs\nlp\Lib\site-packages\sklearn\svm\_classes.py:32: FutureWarning: The default value of `dual` will change from `True` to `'auto'` in 1.5. Set the value of `dual` explicitly to suppress the warning.
  warnings.warn(
2026-06-20 19:50:33 | INFO | SVM | trial   5 | params={'C': 0.0060252157362038605} | train_F1=0.7597 | val_CV_F1=0.7299
[I 2026-06-20 19:50:33,931] Trial 5 finished with value: 0.729906628841659 and parameters: {'C': 0.0060252157362038605}. Best is trial 2 with value: 0.9146405656403624.
C:\Users\Britod\.conda\envs\nlp\Lib\site-packages\sklearn\svm\_classes.py:32: FutureWarning: The default value of `dual` will change from `True` to `'auto'` in 1.5. Set the value of `dual` explicitly to suppress the warning.
  warnings.warn(
C:\Users\Britod\.conda\envs\nlp\Lib\site-packages\sklearn\svm\_classes.py:32: FutureWarning: The default value of `dual` will change from `True` to `'auto'` in 1.5. Set the value of `dual` explicitly to suppress the warning.
  warnings.warn(
C:\Users\Britod\.conda\envs\nlp\Lib\site-packages\sklearn\svm\_classes.py:32: FutureWarning: The default value of `dual` will change from `True` to `'auto'` in 1.5. Set the value of `dual` explicitly to suppress the warning.
  warnings.warn(
C:\Users\Britod\.conda\envs\nlp\Lib\site-packages\sklearn\svm\_classes.py:32: FutureWarning: The default value of `dual` will change from `True` to `'auto'` in 1.5. Set the value of `dual` explicitly to suppress the warning.
  warnings.warn(
C:\Users\Britod\.conda\envs\nlp\Lib\site-packages\sklearn\svm\_classes.py:32: FutureWarning: The default value of `dual` will change from `True` to `'auto'` in 1.5. Set the value of `dual` explicitly to suppress the warning.
  warnings.warn(
C:\Users\Britod\.conda\envs\nlp\Lib\site-packages\sklearn\svm\_classes.py:32: FutureWarning: The default value of `dual` will change from `True` to `'auto'` in 1.5. Set the value of `dual` explicitly to suppress the warning.
  warnings.warn(
C:\Users\Britod\.conda\envs\nlp\Lib\site-packages\sklearn\svm\_classes.py:32: FutureWarning: The default value of `dual` will change from `True` to `'auto'` in 1.5. Set the value of `dual` explicitly to suppress the warning.
  warnings.warn(
C:\Users\Britod\.conda\envs\nlp\Lib\site-packages\sklearn\svm\_classes.py:32: FutureWarning: The default value of `dual` will change from `True` to `'auto'` in 1.5. Set the value of `dual` explicitly to suppress the warning.
  warnings.warn(
C:\Users\Britod\.conda\envs\nlp\Lib\site-packages\sklearn\svm\_classes.py:32: FutureWarning: The default value of `dual` will change from `True` to `'auto'` in 1.5. Set the value of `dual` explicitly to suppress the warning.
  warnings.warn(
C:\Users\Britod\.conda\envs\nlp\Lib\site-packages\sklearn\svm\_classes.py:32: FutureWarning: The default value of `dual` will change from `True` to `'auto'` in 1.5. Set the value of `dual` explicitly to suppress the warning.
  warnings.warn(
C:\Users\Britod\.conda\envs\nlp\Lib\site-packages\sklearn\svm\_classes.py:32: FutureWarning: The default value of `dual` will change from `True` to `'auto'` in 1.5. Set the value of `dual` explicitly to suppress the warning.
  warnings.warn(
C:\Users\Britod\.conda\envs\nlp\Lib\site-packages\sklearn\svm\_classes.py:32: FutureWarning: The default value of `dual` will change from `True` to `'auto'` in 1.5. Set the value of `dual` explicitly to suppress the warning.
  warnings.warn(
2026-06-20 19:50:35 | INFO | SVM | trial   6 | params={'C': 0.0019517224641449498} | train_F1=0.7259 | val_CV_F1=0.7070
[I 2026-06-20 19:50:35,672] Trial 6 finished with value: 0.7069714254787277 and parameters: {'C': 0.0019517224641449498}. Best is trial 2 with value: 0.9146405656403624.
C:\Users\Britod\.conda\envs\nlp\Lib\site-packages\sklearn\svm\_classes.py:32: FutureWarning: The default value of `dual` will change from `True` to `'auto'` in 1.5. Set the value of `dual` explicitly to suppress the warning.
  warnings.warn(
C:\Users\Britod\.conda\envs\nlp\Lib\site-packages\sklearn\svm\_classes.py:32: FutureWarning: The default value of `dual` will change from `True` to `'auto'` in 1.5. Set the value of `dual` explicitly to suppress the warning.
  warnings.warn(
C:\Users\Britod\.conda\envs\nlp\Lib\site-packages\sklearn\svm\_classes.py:32: FutureWarning: The default value of `dual` will change from `True` to `'auto'` in 1.5. Set the value of `dual` explicitly to suppress the warning.
  warnings.warn(
C:\Users\Britod\.conda\envs\nlp\Lib\site-packages\sklearn\svm\_classes.py:32: FutureWarning: The default value of `dual` will change from `True` to `'auto'` in 1.5. Set the value of `dual` explicitly to suppress the warning.
  warnings.warn(
C:\Users\Britod\.conda\envs\nlp\Lib\site-packages\sklearn\svm\_classes.py:32: FutureWarning: The default value of `dual` will change from `True` to `'auto'` in 1.5. Set the value of `dual` explicitly to suppress the warning.
  warnings.warn(
C:\Users\Britod\.conda\envs\nlp\Lib\site-packages\sklearn\svm\_classes.py:32: FutureWarning: The default value of `dual` will change from `True` to `'auto'` in 1.5. Set the value of `dual` explicitly to suppress the warning.
  warnings.warn(
C:\Users\Britod\.conda\envs\nlp\Lib\site-packages\sklearn\svm\_classes.py:32: FutureWarning: The default value of `dual` will change from `True` to `'auto'` in 1.5. Set the value of `dual` explicitly to suppress the warning.
  warnings.warn(
C:\Users\Britod\.conda\envs\nlp\Lib\site-packages\sklearn\svm\_classes.py:32: FutureWarning: The default value of `dual` will change from `True` to `'auto'` in 1.5. Set the value of `dual` explicitly to suppress the warning.
  warnings.warn(
C:\Users\Britod\.conda\envs\nlp\Lib\site-packages\sklearn\svm\_classes.py:32: FutureWarning: The default value of `dual` will change from `True` to `'auto'` in 1.5. Set the value of `dual` explicitly to suppress the warning.
  warnings.warn(
C:\Users\Britod\.conda\envs\nlp\Lib\site-packages\sklearn\svm\_classes.py:32: FutureWarning: The default value of `dual` will change from `True` to `'auto'` in 1.5. Set the value of `dual` explicitly to suppress the warning.
  warnings.warn(
C:\Users\Britod\.conda\envs\nlp\Lib\site-packages\sklearn\svm\_classes.py:32: FutureWarning: The default value of `dual` will change from `True` to `'auto'` in 1.5. Set the value of `dual` explicitly to suppress the warning.
  warnings.warn(
C:\Users\Britod\.conda\envs\nlp\Lib\site-packages\sklearn\svm\_classes.py:32: FutureWarning: The default value of `dual` will change from `True` to `'auto'` in 1.5. Set the value of `dual` explicitly to suppress the warning.
  warnings.warn(
2026-06-20 19:51:19 | INFO | SVM | trial   7 | params={'C': 21.42302175774105} | train_F1=0.9974 | val_CV_F1=0.9132
[I 2026-06-20 19:51:19,521] Trial 7 finished with value: 0.913235592148555 and parameters: {'C': 21.42302175774105}. Best is trial 2 with value: 0.9146405656403624.
C:\Users\Britod\.conda\envs\nlp\Lib\site-packages\sklearn\svm\_classes.py:32: FutureWarning: The default value of `dual` will change from `True` to `'auto'` in 1.5. Set the value of `dual` explicitly to suppress the warning.
  warnings.warn(
C:\Users\Britod\.conda\envs\nlp\Lib\site-packages\sklearn\svm\_classes.py:32: FutureWarning: The default value of `dual` will change from `True` to `'auto'` in 1.5. Set the value of `dual` explicitly to suppress the warning.
  warnings.warn(
C:\Users\Britod\.conda\envs\nlp\Lib\site-packages\sklearn\svm\_classes.py:32: FutureWarning: The default value of `dual` will change from `True` to `'auto'` in 1.5. Set the value of `dual` explicitly to suppress the warning.
  warnings.warn(
C:\Users\Britod\.conda\envs\nlp\Lib\site-packages\sklearn\svm\_classes.py:32: FutureWarning: The default value of `dual` will change from `True` to `'auto'` in 1.5. Set the value of `dual` explicitly to suppress the warning.
  warnings.warn(
C:\Users\Britod\.conda\envs\nlp\Lib\site-packages\sklearn\svm\_classes.py:32: FutureWarning: The default value of `dual` will change from `True` to `'auto'` in 1.5. Set the value of `dual` explicitly to suppress the warning.
  warnings.warn(
C:\Users\Britod\.conda\envs\nlp\Lib\site-packages\sklearn\svm\_classes.py:32: FutureWarning: The default value of `dual` will change from `True` to `'auto'` in 1.5. Set the value of `dual` explicitly to suppress the warning.
  warnings.warn(
C:\Users\Britod\.conda\envs\nlp\Lib\site-packages\sklearn\svm\_classes.py:32: FutureWarning: The default value of `dual` will change from `True` to `'auto'` in 1.5. Set the value of `dual` explicitly to suppress the warning.
  warnings.warn(
C:\Users\Britod\.conda\envs\nlp\Lib\site-packages\sklearn\svm\_classes.py:32: FutureWarning: The default value of `dual` will change from `True` to `'auto'` in 1.5. Set the value of `dual` explicitly to suppress the warning.
  warnings.warn(
C:\Users\Britod\.conda\envs\nlp\Lib\site-packages\sklearn\svm\_classes.py:32: FutureWarning: The default value of `dual` will change from `True` to `'auto'` in 1.5. Set the value of `dual` explicitly to suppress the warning.
  warnings.warn(
C:\Users\Britod\.conda\envs\nlp\Lib\site-packages\sklearn\svm\_classes.py:32: FutureWarning: The default value of `dual` will change from `True` to `'auto'` in 1.5. Set the value of `dual` explicitly to suppress the warning.
  warnings.warn(
C:\Users\Britod\.conda\envs\nlp\Lib\site-packages\sklearn\svm\_classes.py:32: FutureWarning: The default value of `dual` will change from `True` to `'auto'` in 1.5. Set the value of `dual` explicitly to suppress the warning.
  warnings.warn(
C:\Users\Britod\.conda\envs\nlp\Lib\site-packages\sklearn\svm\_classes.py:32: FutureWarning: The default value of `dual` will change from `True` to `'auto'` in 1.5. Set the value of `dual` explicitly to suppress the warning.
  warnings.warn(
2026-06-20 19:51:23 | INFO | SVM | trial   8 | params={'C': 1.0129197956845732} | train_F1=0.9669 | val_CV_F1=0.8978
[I 2026-06-20 19:51:23,732] Trial 8 finished with value: 0.8977787188986771 and parameters: {'C': 1.0129197956845732}. Best is trial 2 with value: 0.9146405656403624.
C:\Users\Britod\.conda\envs\nlp\Lib\site-packages\sklearn\svm\_classes.py:32: FutureWarning: The default value of `dual` will change from `True` to `'auto'` in 1.5. Set the value of `dual` explicitly to suppress the warning.
  warnings.warn(
C:\Users\Britod\.conda\envs\nlp\Lib\site-packages\sklearn\svm\_classes.py:32: FutureWarning: The default value of `dual` will change from `True` to `'auto'` in 1.5. Set the value of `dual` explicitly to suppress the warning.
  warnings.warn(
C:\Users\Britod\.conda\envs\nlp\Lib\site-packages\sklearn\svm\_classes.py:32: FutureWarning: The default value of `dual` will change from `True` to `'auto'` in 1.5. Set the value of `dual` explicitly to suppress the warning.
  warnings.warn(
C:\Users\Britod\.conda\envs\nlp\Lib\site-packages\sklearn\svm\_classes.py:32: FutureWarning: The default value of `dual` will change from `True` to `'auto'` in 1.5. Set the value of `dual` explicitly to suppress the warning.
  warnings.warn(
C:\Users\Britod\.conda\envs\nlp\Lib\site-packages\sklearn\svm\_classes.py:32: FutureWarning: The default value of `dual` will change from `True` to `'auto'` in 1.5. Set the value of `dual` explicitly to suppress the warning.
  warnings.warn(
C:\Users\Britod\.conda\envs\nlp\Lib\site-packages\sklearn\svm\_classes.py:32: FutureWarning: The default value of `dual` will change from `True` to `'auto'` in 1.5. Set the value of `dual` explicitly to suppress the warning.
  warnings.warn(
C:\Users\Britod\.conda\envs\nlp\Lib\site-packages\sklearn\svm\_classes.py:32: FutureWarning: The default value of `dual` will change from `True` to `'auto'` in 1.5. Set the value of `dual` explicitly to suppress the warning.
  warnings.warn(
C:\Users\Britod\.conda\envs\nlp\Lib\site-packages\sklearn\svm\_classes.py:32: FutureWarning: The default value of `dual` will change from `True` to `'auto'` in 1.5. Set the value of `dual` explicitly to suppress the warning.
  warnings.warn(
C:\Users\Britod\.conda\envs\nlp\Lib\site-packages\sklearn\svm\_classes.py:32: FutureWarning: The default value of `dual` will change from `True` to `'auto'` in 1.5. Set the value of `dual` explicitly to suppress the warning.
  warnings.warn(
C:\Users\Britod\.conda\envs\nlp\Lib\site-packages\sklearn\svm\_classes.py:32: FutureWarning: The default value of `dual` will change from `True` to `'auto'` in 1.5. Set the value of `dual` explicitly to suppress the warning.
  warnings.warn(
C:\Users\Britod\.conda\envs\nlp\Lib\site-packages\sklearn\svm\_classes.py:32: FutureWarning: The default value of `dual` will change from `True` to `'auto'` in 1.5. Set the value of `dual` explicitly to suppress the warning.
  warnings.warn(
C:\Users\Britod\.conda\envs\nlp\Lib\site-packages\sklearn\svm\_classes.py:32: FutureWarning: The default value of `dual` will change from `True` to `'auto'` in 1.5. Set the value of `dual` explicitly to suppress the warning.
  warnings.warn(
2026-06-20 19:51:32 | INFO | SVM | trial   9 | params={'C': 3.4702669886504163} | train_F1=0.9879 | val_CV_F1=0.9134
[I 2026-06-20 19:51:32,229] Trial 9 finished with value: 0.9134294238129552 and parameters: {'C': 3.4702669886504163}. Best is trial 2 with value: 0.9146405656403624.
2026-06-20 19:51:32 | INFO | SVM BEST | params={'C': 4.5705630998014515} | val_CV_F1=0.9146
2026-06-20 19:51:32 | INFO | SVM: training final model with best params={'C': 4.5705630998014515}
C:\Users\Britod\.conda\envs\nlp\Lib\site-packages\sklearn\svm\_classes.py:32: FutureWarning: The default value of `dual` will change from `True` to `'auto'` in 1.5. Set the value of `dual` explicitly to suppress the warning.
  warnings.warn(
C:\Users\Britod\.conda\envs\nlp\Lib\site-packages\sklearn\svm\_classes.py:32: FutureWarning: The default value of `dual` will change from `True` to `'auto'` in 1.5. Set the value of `dual` explicitly to suppress the warning.
  warnings.warn(
C:\Users\Britod\.conda\envs\nlp\Lib\site-packages\sklearn\svm\_classes.py:32: FutureWarning: The default value of `dual` will change from `True` to `'auto'` in 1.5. Set the value of `dual` explicitly to suppress the warning.
  warnings.warn(
2026-06-20 19:51:38 | INFO | SVM | TRAIN | macro_F1=0.9907
2026-06-20 19:51:38 | INFO | SVM | TRAIN | classification report:
              precision    recall  f1-score   support

     Level 0       0.99      0.99      0.99      4688
     Level 1       0.99      0.98      0.98      4688
     Level 2       0.99      0.99      0.99      4688
     Level 3       1.00      1.00      1.00      4688

    accuracy                           0.99     18752
   macro avg       0.99      0.99      0.99     18752
weighted avg       0.99      0.99      0.99     18752

2026-06-20 19:51:38 | INFO | SVM | TEST | macro_F1=0.7031
2026-06-20 19:51:38 | INFO | SVM | TEST | classification report:
              precision    recall  f1-score   support

     Level 0       0.82      0.88      0.85      1172
     Level 1       0.80      0.72      0.75      1026
     Level 2       0.49      0.52      0.51       341
     Level 3       0.75      0.66      0.70        95

    accuracy                           0.76      2634
   macro avg       0.71      0.70      0.70      2634
weighted avg       0.76      0.76      0.76      2634

2026-06-20 19:51:38 | INFO | SVM SUMMARY | best_params={'C': 4.5705630998014515}
2026-06-20 19:51:38 | INFO | Models saved to D:\projects\nlp-swear_words_detector\saved_models/
2026-06-20 19:51:38 | INFO | ============================================================
2026-06-20 19:51:38 | INFO | Complete. Log: D:\projects\nlp-swear_words_detector\logs\classical_random_oversample.log
===== DONE  train_random_oversample.py rc=0 19:51:38 =====
===== START train_smote.py 19:51:38 =====
2026-06-20 19:51:41 | INFO | ============================================================
2026-06-20 19:51:41 | INFO | Strategy: SMOTE on TF-IDF features
Regenerating BERT input:   0%|          | 0/13169 [00:00<?, ?it/s]Regenerating BERT input:  45%|####4     | 5894/13169 [00:00<00:00, 58641.42it/s]Regenerating BERT input:  90%|########9 | 11833/13169 [00:00<00:00, 58919.25it/s]Regenerating BERT input: 100%|##########| 13169/13169 [00:00<00:00, 58796.19it/s]
2026-06-20 19:51:41 | INFO | Data loaded | train=10,535 | val=1,317 | test=1,317
2026-06-20 19:52:36 | INFO | SMOTE applied | total=18,752
2026-06-20 19:53:27 | INFO | SMOTE applied | total=18,752
2026-06-20 19:53:27 | INFO | ============================================================
2026-06-20 19:53:27 | INFO | LR: training start
2026-06-20 19:53:27 | INFO | LR: starting hyperparameter tuning (10 trials)
[I 2026-06-20 19:53:27,215] A new study created in memory with name: no-name-c3531816-e966-49af-bb27-4fae0af7b0f6
2026-06-20 19:53:32 | INFO | LR | trial   0 | params={'C': 0.0745934328572655, 'solver': 'lbfgs'} | train_F1=0.8095 | val_CV_F1=0.7772
[I 2026-06-20 19:53:32,979] Trial 0 finished with value: 0.7771963042082953 and parameters: {'C': 0.0745934328572655, 'solver': 'lbfgs'}. Best is trial 0 with value: 0.7771963042082953.
2026-06-20 19:53:44 | INFO | LR | trial   1 | params={'C': 0.9846738873614566, 'solver': 'lbfgs'} | train_F1=0.9151 | val_CV_F1=0.8613
[I 2026-06-20 19:53:44,278] Trial 1 finished with value: 0.8613430769544984 and parameters: {'C': 0.9846738873614566, 'solver': 'lbfgs'}. Best is trial 1 with value: 0.8613430769544984.
2026-06-20 19:53:46 | INFO | LR | trial   2 | params={'C': 0.0019517224641449498, 'solver': 'lbfgs'} | train_F1=0.6685 | val_CV_F1=0.6559
[I 2026-06-20 19:53:46,192] Trial 2 finished with value: 0.6559260678583825 and parameters: {'C': 0.0019517224641449498, 'solver': 'lbfgs'}. Best is trial 1 with value: 0.8613430769544984.
2026-06-20 19:54:09 | INFO | LR | trial   3 | params={'C': 3.4702669886504163, 'solver': 'saga'} | train_F1=0.9534 | val_CV_F1=0.8859
[I 2026-06-20 19:54:09,784] Trial 3 finished with value: 0.8858571591936255 and parameters: {'C': 3.4702669886504163, 'solver': 'saga'}. Best is trial 3 with value: 0.8858571591936255.
2026-06-20 19:54:35 | INFO | LR | trial   4 | params={'C': 14.528246637516036, 'solver': 'lbfgs'} | train_F1=0.9853 | val_CV_F1=0.8980
[I 2026-06-20 19:54:35,088] Trial 4 finished with value: 0.8979644921659969 and parameters: {'C': 14.528246637516036, 'solver': 'lbfgs'}. Best is trial 4 with value: 0.8979644921659969.
2026-06-20 19:54:38 | INFO | LR | trial   5 | params={'C': 0.008260808399079604, 'solver': 'saga'} | train_F1=0.7144 | val_CV_F1=0.6919
[I 2026-06-20 19:54:38,982] Trial 5 finished with value: 0.6918838410388467 and parameters: {'C': 0.008260808399079604, 'solver': 'saga'}. Best is trial 4 with value: 0.8979644921659969.
2026-06-20 19:54:42 | INFO | LR | trial   6 | params={'C': 0.14445251022763064, 'solver': 'saga'} | train_F1=0.8408 | val_CV_F1=0.8050
