===== START train_no_resample.py 19:42:34 =====
2026-06-20 19:42:37 | INFO | ============================================================
2026-06-20 19:42:37 | INFO | Strategy: no resampling
Regenerating BERT input:   0%|          | 0/13169 [00:00<?, ?it/s]Regenerating BERT input:  44%|####4     | 5805/13169 [00:00<00:00, 57758.80it/s]Regenerating BERT input:  89%|########9 | 11749/13169 [00:00<00:00, 58570.31it/s]Regenerating BERT input: 100%|##########| 13169/13169 [00:00<00:00, 58393.22it/s]
2026-06-20 19:42:38 | INFO | Data loaded | train=10,535 | val=1,317 | test=1,317
2026-06-20 19:42:41 | INFO | ============================================================
2026-06-20 19:42:41 | INFO | LR: training start
2026-06-20 19:42:41 | INFO | LR: starting hyperparameter tuning (10 trials)
[I 2026-06-20 19:42:41,338] A new study created in memory with name: no-name-a143e59a-3548-424a-bc96-51388e949e0a
2026-06-20 19:42:45 | INFO | LR | trial   0 | params={'C': 0.0745934328572655, 'solver': 'lbfgs'} | train_F1=0.7092 | val_CV_F1=0.6512
[I 2026-06-20 19:42:45,199] Trial 0 finished with value: 0.6512059052798939 and parameters: {'C': 0.0745934328572655, 'solver': 'lbfgs'}. Best is trial 0 with value: 0.6512059052798939.
2026-06-20 19:42:51 | INFO | LR | trial   1 | params={'C': 0.9846738873614566, 'solver': 'lbfgs'} | train_F1=0.8353 | val_CV_F1=0.7135
[I 2026-06-20 19:42:51,711] Trial 1 finished with value: 0.7134694177594832 and parameters: {'C': 0.9846738873614566, 'solver': 'lbfgs'}. Best is trial 1 with value: 0.7134694177594832.
2026-06-20 19:42:53 | INFO | LR | trial   2 | params={'C': 0.0019517224641449498, 'solver': 'lbfgs'} | train_F1=0.5733 | val_CV_F1=0.5507
[I 2026-06-20 19:42:53,251] Trial 2 finished with value: 0.5507262346025196 and parameters: {'C': 0.0019517224641449498, 'solver': 'lbfgs'}. Best is trial 1 with value: 0.7134694177594832.
C:\Users\Britod\.conda\envs\nlp\Lib\site-packages\sklearn\linear_model\_sag.py:350: ConvergenceWarning: The max_iter was reached which means the coef_ did not converge
  warnings.warn(
C:\Users\Britod\.conda\envs\nlp\Lib\site-packages\sklearn\linear_model\_sag.py:350: ConvergenceWarning: The max_iter was reached which means the coef_ did not converge
  warnings.warn(
C:\Users\Britod\.conda\envs\nlp\Lib\site-packages\sklearn\linear_model\_sag.py:350: ConvergenceWarning: The max_iter was reached which means the coef_ did not converge
  warnings.warn(
C:\Users\Britod\.conda\envs\nlp\Lib\site-packages\sklearn\linear_model\_sag.py:350: ConvergenceWarning: The max_iter was reached which means the coef_ did not converge
  warnings.warn(
2026-06-20 19:44:03 | INFO | LR | trial   3 | params={'C': 3.4702669886504163, 'solver': 'saga'} | train_F1=0.8191 | val_CV_F1=0.6482
[I 2026-06-20 19:44:03,092] Trial 3 finished with value: 0.6482363611194928 and parameters: {'C': 3.4702669886504163, 'solver': 'saga'}. Best is trial 1 with value: 0.7134694177594832.
2026-06-20 19:44:19 | INFO | LR | trial   4 | params={'C': 14.528246637516036, 'solver': 'lbfgs'} | train_F1=0.9557 | val_CV_F1=0.7118
[I 2026-06-20 19:44:19,030] Trial 4 finished with value: 0.7118099492223675 and parameters: {'C': 14.528246637516036, 'solver': 'lbfgs'}. Best is trial 1 with value: 0.7134694177594832.
2026-06-20 19:44:22 | INFO | LR | trial   5 | params={'C': 0.008260808399079604, 'solver': 'saga'} | train_F1=0.6045 | val_CV_F1=0.5729
[I 2026-06-20 19:44:22,448] Trial 5 finished with value: 0.5729423329119161 and parameters: {'C': 0.008260808399079604, 'solver': 'saga'}. Best is trial 1 with value: 0.7134694177594832.
C:\Users\Britod\.conda\envs\nlp\Lib\site-packages\sklearn\linear_model\_sag.py:350: ConvergenceWarning: The max_iter was reached which means the coef_ did not converge
  warnings.warn(
C:\Users\Britod\.conda\envs\nlp\Lib\site-packages\sklearn\linear_model\_sag.py:350: ConvergenceWarning: The max_iter was reached which means the coef_ did not converge
  warnings.warn(
C:\Users\Britod\.conda\envs\nlp\Lib\site-packages\sklearn\linear_model\_sag.py:350: ConvergenceWarning: The max_iter was reached which means the coef_ did not converge
  warnings.warn(
C:\Users\Britod\.conda\envs\nlp\Lib\site-packages\sklearn\linear_model\_sag.py:350: ConvergenceWarning: The max_iter was reached which means the coef_ did not converge
  warnings.warn(
2026-06-20 19:45:36 | INFO | LR | trial   6 | params={'C': 0.14445251022763064, 'solver': 'saga'} | train_F1=0.7302 | val_CV_F1=0.6316
[I 2026-06-20 19:45:36,575] Trial 6 finished with value: 0.6316021831079189 and parameters: {'C': 0.14445251022763064, 'solver': 'saga'}. Best is trial 1 with value: 0.7134694177594832.
2026-06-20 19:45:39 | INFO | LR | trial   7 | params={'C': 0.004982752357076452, 'solver': 'saga'} | train_F1=0.5877 | val_CV_F1=0.5620
[I 2026-06-20 19:45:39,048] Trial 7 finished with value: 0.5619888251670807 and parameters: {'C': 0.004982752357076452, 'solver': 'saga'}. Best is trial 1 with value: 0.7134694177594832.
2026-06-20 19:45:42 | INFO | LR | trial   8 | params={'C': 0.19069966103000435, 'solver': 'lbfgs'} | train_F1=0.7557 | val_CV_F1=0.6846
[I 2026-06-20 19:45:42,370] Trial 8 finished with value: 0.6845738308061616 and parameters: {'C': 0.19069966103000435, 'solver': 'lbfgs'}. Best is trial 1 with value: 0.7134694177594832.
2026-06-20 19:45:46 | INFO | LR | trial   9 | params={'C': 0.37253938395788866, 'solver': 'lbfgs'} | train_F1=0.7893 | val_CV_F1=0.7019
[I 2026-06-20 19:45:46,835] Trial 9 finished with value: 0.7019451133869121 and parameters: {'C': 0.37253938395788866, 'solver': 'lbfgs'}. Best is trial 1 with value: 0.7134694177594832.
2026-06-20 19:45:46 | INFO | LR BEST | params={'C': 0.9846738873614566, 'solver': 'lbfgs'} | val_CV_F1=0.7135
2026-06-20 19:45:46 | INFO | LR: training final model with best params={'C': 0.9846738873614566, 'solver': 'lbfgs'}
2026-06-20 19:45:49 | INFO | LR | TRAIN | macro_F1=0.8353
2026-06-20 19:45:49 | INFO | LR | TRAIN | classification report:
              precision    recall  f1-score   support

     Level 0       0.91      0.89      0.90      4688
     Level 1       0.89      0.81      0.85      4105
     Level 2       0.68      0.85      0.76      1364
     Level 3       0.72      0.99      0.84       378

    accuracy                           0.86     10535
   macro avg       0.80      0.88      0.84     10535
weighted avg       0.87      0.86      0.86     10535

2026-06-20 19:45:49 | INFO | LR | TEST | macro_F1=0.7352
2026-06-20 19:45:49 | INFO | LR | TEST | classification report:
              precision    recall  f1-score   support

     Level 0       0.87      0.84      0.85       586
     Level 1       0.80      0.75      0.77       513
     Level 2       0.52      0.64      0.57       171
     Level 3       0.64      0.89      0.74        47

    accuracy                           0.78      1317
   macro avg       0.71      0.78      0.74      1317
weighted avg       0.79      0.78      0.78      1317

2026-06-20 19:45:49 | INFO | LR SUMMARY | best_params={'C': 0.9846738873614566, 'solver': 'lbfgs'}
2026-06-20 19:45:49 | INFO | ============================================================
2026-06-20 19:45:49 | INFO | NB: training start
2026-06-20 19:45:49 | INFO | NB: starting hyperparameter tuning (10 trials)
[I 2026-06-20 19:45:49,901] A new study created in memory with name: no-name-685687ed-dff3-45f8-977b-d9b7bc1c0d47
2026-06-20 19:45:50 | INFO | NB | trial   0 | params={'alpha': 0.03148911647956861, 'norm': True} | train_F1=0.5524 | val_CV_F1=0.4939
[I 2026-06-20 19:45:50,294] Trial 0 finished with value: 0.49389626955280114 and parameters: {'alpha': 0.03148911647956861, 'norm': True}. Best is trial 0 with value: 0.49389626955280114.
2026-06-20 19:45:50 | INFO | NB | trial   1 | params={'alpha': 0.24810409748678125, 'norm': True} | train_F1=0.6952 | val_CV_F1=0.5733
[I 2026-06-20 19:45:50,676] Trial 1 finished with value: 0.5733107400179466 and parameters: {'alpha': 0.24810409748678125, 'norm': True}. Best is trial 1 with value: 0.5733107400179466.
2026-06-20 19:45:51 | INFO | NB | trial   2 | params={'alpha': 0.0017073967431528124, 'norm': True} | train_F1=0.4506 | val_CV_F1=0.3322
[I 2026-06-20 19:45:51,057] Trial 2 finished with value: 0.33216418127003194 and parameters: {'alpha': 0.0017073967431528124, 'norm': True}. Best is trial 1 with value: 0.5733107400179466.
2026-06-20 19:45:51 | INFO | NB | trial   3 | params={'alpha': 0.679657809075816, 'norm': False} | train_F1=0.6993 | val_CV_F1=0.6046
[I 2026-06-20 19:45:51,442] Trial 3 finished with value: 0.604643383417847 and parameters: {'alpha': 0.679657809075816, 'norm': False}. Best is trial 3 with value: 0.604643383417847.
2026-06-20 19:45:51 | INFO | NB | trial   4 | params={'alpha': 2.1368329072358767, 'norm': True} | train_F1=0.4233 | val_CV_F1=0.3865
[I 2026-06-20 19:45:51,831] Trial 4 finished with value: 0.3864545546921279 and parameters: {'alpha': 2.1368329072358767, 'norm': True}. Best is trial 3 with value: 0.604643383417847.
2026-06-20 19:45:52 | INFO | NB | trial   5 | params={'alpha': 0.00541524411940254, 'norm': False} | train_F1=0.7800 | val_CV_F1=0.6339
[I 2026-06-20 19:45:52,219] Trial 5 finished with value: 0.6338814722205423 and parameters: {'alpha': 0.00541524411940254, 'norm': False}. Best is trial 5 with value: 0.6338814722205423.
2026-06-20 19:45:52 | INFO | NB | trial   6 | params={'alpha': 0.05342937261279776, 'norm': False} | train_F1=0.7687 | val_CV_F1=0.6544
[I 2026-06-20 19:45:52,596] Trial 6 finished with value: 0.65442765449851 and parameters: {'alpha': 0.05342937261279776, 'norm': False}. Best is trial 6 with value: 0.65442765449851.
2026-06-20 19:45:52 | INFO | NB | trial   7 | params={'alpha': 0.003613894271216527, 'norm': False} | train_F1=0.7816 | val_CV_F1=0.6318
[I 2026-06-20 19:45:52,977] Trial 7 finished with value: 0.6317582056569261 and parameters: {'alpha': 0.003613894271216527, 'norm': False}. Best is trial 6 with value: 0.65442765449851.
2026-06-20 19:45:53 | INFO | NB | trial   8 | params={'alpha': 0.06672367170464207, 'norm': True} | train_F1=0.6582 | val_CV_F1=0.6033
[I 2026-06-20 19:45:53,359] Trial 8 finished with value: 0.6032767099066431 and parameters: {'alpha': 0.06672367170464207, 'norm': True}. Best is trial 6 with value: 0.65442765449851.
2026-06-20 19:45:53 | INFO | NB | trial   9 | params={'alpha': 0.11400863701127326, 'norm': True} | train_F1=0.7210 | val_CV_F1=0.6269
[I 2026-06-20 19:45:53,743] Trial 9 finished with value: 0.6268759847471114 and parameters: {'alpha': 0.11400863701127326, 'norm': True}. Best is trial 6 with value: 0.65442765449851.
2026-06-20 19:45:53 | INFO | NB BEST | params={'alpha': 0.05342937261279776, 'norm': False} | val_CV_F1=0.6544
2026-06-20 19:45:53 | INFO | NB: training final model with best params={'alpha': 0.05342937261279776, 'norm': False}
2026-06-20 19:45:53 | INFO | NB | TRAIN | macro_F1=0.7687
2026-06-20 19:45:53 | INFO | NB | TRAIN | classification report:
              precision    recall  f1-score   support

     Level 0       0.88      0.88      0.88      4688
     Level 1       0.80      0.86      0.83      4105
     Level 2       0.73      0.56      0.63      1364
     Level 3       0.71      0.75      0.73       378

    accuracy                           0.83     10535
   macro avg       0.78      0.76      0.77     10535
weighted avg       0.82      0.83      0.82     10535

2026-06-20 19:45:53 | INFO | NB | TEST | macro_F1=0.6448
2026-06-20 19:45:53 | INFO | NB | TEST | classification report:
              precision    recall  f1-score   support

     Level 0       0.82      0.82      0.82       586
     Level 1       0.71      0.79      0.75       513
     Level 2       0.52      0.33      0.41       171
     Level 3       0.61      0.60      0.60        47

    accuracy                           0.74      1317
   macro avg       0.66      0.64      0.64      1317
weighted avg       0.73      0.74      0.73      1317

2026-06-20 19:45:53 | INFO | NB SUMMARY | best_params={'alpha': 0.05342937261279776, 'norm': False}
2026-06-20 19:45:53 | INFO | ============================================================
2026-06-20 19:45:53 | INFO | SVM: training start
2026-06-20 19:45:53 | INFO | SVM: starting hyperparameter tuning (10 trials)
[I 2026-06-20 19:45:53,782] A new study created in memory with name: no-name-2a2d0c5e-bd46-4be1-b22d-8da4585fbb9c
C:\Users\Britod\.conda\envs\nlp\Lib\site-packages\sklearn\svm\_classes.py:32: FutureWarning: The default value of `dual` will change from `True` to `'auto'` in 1.5. Set the value of `dual` explicitly to suppress the warning.
  warnings.warn(
C:\Users\Britod\.conda\envs\nlp\Lib\site-packages\sklearn\svm\_classes.py:32: FutureWarning: The default value of `dual` will change from `True` to `'auto'` in 1.5. Set the value of `dual` explicitly to suppress the warning.
  warnings.warn(
C:\Users\Britod\.conda\envs\nlp\Lib\site-packages\sklearn\svm\_classes.py:32: FutureWarning: The default value of `dual` will change from `True` to `'auto'` in 1.5. Set the value of `dual` explicitly to suppress the warning.
  warnings.warn(
C:\Users\Britod\.conda\envs\nlp\Lib\site-packages\sklearn\svm\_classes.py:32: FutureWarning: The default value of `dual` will change from `True` to `'auto'` in 1.5. Set the value of `dual` explicitly to suppress the warning.
  warnings.warn(
C:\Users\Britod\.conda\envs\nlp\Lib\site-packages\sklearn\svm\_classes.py:32: FutureWarning: The default value of `dual` will change from `True` to `'auto'` in 1.5. Set the value of `dual` explicitly to suppress the warning.
  warnings.warn(
C:\Users\Britod\.conda\envs\nlp\Lib\site-packages\sklearn\svm\_classes.py:32: FutureWarning: The default value of `dual` will change from `True` to `'auto'` in 1.5. Set the value of `dual` explicitly to suppress the warning.
  warnings.warn(
C:\Users\Britod\.conda\envs\nlp\Lib\site-packages\sklearn\svm\_classes.py:32: FutureWarning: The default value of `dual` will change from `True` to `'auto'` in 1.5. Set the value of `dual` explicitly to suppress the warning.
  warnings.warn(
C:\Users\Britod\.conda\envs\nlp\Lib\site-packages\sklearn\svm\_classes.py:32: FutureWarning: The default value of `dual` will change from `True` to `'auto'` in 1.5. Set the value of `dual` explicitly to suppress the warning.
  warnings.warn(
C:\Users\Britod\.conda\envs\nlp\Lib\site-packages\sklearn\svm\_classes.py:32: FutureWarning: The default value of `dual` will change from `True` to `'auto'` in 1.5. Set the value of `dual` explicitly to suppress the warning.
  warnings.warn(
C:\Users\Britod\.conda\envs\nlp\Lib\site-packages\sklearn\svm\_classes.py:32: FutureWarning: The default value of `dual` will change from `True` to `'auto'` in 1.5. Set the value of `dual` explicitly to suppress the warning.
  warnings.warn(
C:\Users\Britod\.conda\envs\nlp\Lib\site-packages\sklearn\svm\_classes.py:32: FutureWarning: The default value of `dual` will change from `True` to `'auto'` in 1.5. Set the value of `dual` explicitly to suppress the warning.
  warnings.warn(
C:\Users\Britod\.conda\envs\nlp\Lib\site-packages\sklearn\svm\_classes.py:32: FutureWarning: The default value of `dual` will change from `True` to `'auto'` in 1.5. Set the value of `dual` explicitly to suppress the warning.
  warnings.warn(
2026-06-20 19:45:55 | INFO | SVM | trial   0 | params={'C': 0.0745934328572655} | train_F1=0.7700 | val_CV_F1=0.6883
[I 2026-06-20 19:45:55,167] Trial 0 finished with value: 0.6882894224204691 and parameters: {'C': 0.0745934328572655}. Best is trial 0 with value: 0.6882894224204691.
C:\Users\Britod\.conda\envs\nlp\Lib\site-packages\sklearn\svm\_classes.py:32: FutureWarning: The default value of `dual` will change from `True` to `'auto'` in 1.5. Set the value of `dual` explicitly to suppress the warning.
  warnings.warn(
C:\Users\Britod\.conda\envs\nlp\Lib\site-packages\sklearn\svm\_classes.py:32: FutureWarning: The default value of `dual` will change from `True` to `'auto'` in 1.5. Set the value of `dual` explicitly to suppress the warning.
  warnings.warn(
C:\Users\Britod\.conda\envs\nlp\Lib\site-packages\sklearn\svm\_classes.py:32: FutureWarning: The default value of `dual` will change from `True` to `'auto'` in 1.5. Set the value of `dual` explicitly to suppress the warning.
  warnings.warn(
C:\Users\Britod\.conda\envs\nlp\Lib\site-packages\sklearn\svm\_base.py:1242: ConvergenceWarning: Liblinear failed to converge, increase the number of iterations.
  warnings.warn(
C:\Users\Britod\.conda\envs\nlp\Lib\site-packages\sklearn\svm\_classes.py:32: FutureWarning: The default value of `dual` will change from `True` to `'auto'` in 1.5. Set the value of `dual` explicitly to suppress the warning.
  warnings.warn(
C:\Users\Britod\.conda\envs\nlp\Lib\site-packages\sklearn\svm\_base.py:1242: ConvergenceWarning: Liblinear failed to converge, increase the number of iterations.
  warnings.warn(
C:\Users\Britod\.conda\envs\nlp\Lib\site-packages\sklearn\svm\_classes.py:32: FutureWarning: The default value of `dual` will change from `True` to `'auto'` in 1.5. Set the value of `dual` explicitly to suppress the warning.
  warnings.warn(
C:\Users\Britod\.conda\envs\nlp\Lib\site-packages\sklearn\svm\_base.py:1242: ConvergenceWarning: Liblinear failed to converge, increase the number of iterations.
  warnings.warn(
C:\Users\Britod\.conda\envs\nlp\Lib\site-packages\sklearn\svm\_classes.py:32: FutureWarning: The default value of `dual` will change from `True` to `'auto'` in 1.5. Set the value of `dual` explicitly to suppress the warning.
  warnings.warn(
C:\Users\Britod\.conda\envs\nlp\Lib\site-packages\sklearn\svm\_base.py:1242: ConvergenceWarning: Liblinear failed to converge, increase the number of iterations.
  warnings.warn(
C:\Users\Britod\.conda\envs\nlp\Lib\site-packages\sklearn\svm\_base.py:1242: ConvergenceWarning: Liblinear failed to converge, increase the number of iterations.
  warnings.warn(
C:\Users\Britod\.conda\envs\nlp\Lib\site-packages\sklearn\svm\_classes.py:32: FutureWarning: The default value of `dual` will change from `True` to `'auto'` in 1.5. Set the value of `dual` explicitly to suppress the warning.
  warnings.warn(
C:\Users\Britod\.conda\envs\nlp\Lib\site-packages\sklearn\svm\_classes.py:32: FutureWarning: The default value of `dual` will change from `True` to `'auto'` in 1.5. Set the value of `dual` explicitly to suppress the warning.
  warnings.warn(
C:\Users\Britod\.conda\envs\nlp\Lib\site-packages\sklearn\svm\_base.py:1242: ConvergenceWarning: Liblinear failed to converge, increase the number of iterations.
  warnings.warn(
C:\Users\Britod\.conda\envs\nlp\Lib\site-packages\sklearn\svm\_classes.py:32: FutureWarning: The default value of `dual` will change from `True` to `'auto'` in 1.5. Set the value of `dual` explicitly to suppress the warning.
  warnings.warn(
C:\Users\Britod\.conda\envs\nlp\Lib\site-packages\sklearn\svm\_base.py:1242: ConvergenceWarning: Liblinear failed to converge, increase the number of iterations.
  warnings.warn(
C:\Users\Britod\.conda\envs\nlp\Lib\site-packages\sklearn\svm\_base.py:1242: ConvergenceWarning: Liblinear failed to converge, increase the number of iterations.
  warnings.warn(
C:\Users\Britod\.conda\envs\nlp\Lib\site-packages\sklearn\svm\_base.py:1242: ConvergenceWarning: Liblinear failed to converge, increase the number of iterations.
  warnings.warn(
C:\Users\Britod\.conda\envs\nlp\Lib\site-packages\sklearn\svm\_classes.py:32: FutureWarning: The default value of `dual` will change from `True` to `'auto'` in 1.5. Set the value of `dual` explicitly to suppress the warning.
  warnings.warn(
C:\Users\Britod\.conda\envs\nlp\Lib\site-packages\sklearn\svm\_base.py:1242: ConvergenceWarning: Liblinear failed to converge, increase the number of iterations.
  warnings.warn(
C:\Users\Britod\.conda\envs\nlp\Lib\site-packages\sklearn\svm\_classes.py:32: FutureWarning: The default value of `dual` will change from `True` to `'auto'` in 1.5. Set the value of `dual` explicitly to suppress the warning.
  warnings.warn(
C:\Users\Britod\.conda\envs\nlp\Lib\site-packages\sklearn\svm\_base.py:1242: ConvergenceWarning: Liblinear failed to converge, increase the number of iterations.
  warnings.warn(
C:\Users\Britod\.conda\envs\nlp\Lib\site-packages\sklearn\svm\_classes.py:32: FutureWarning: The default value of `dual` will change from `True` to `'auto'` in 1.5. Set the value of `dual` explicitly to suppress the warning.
  warnings.warn(
C:\Users\Britod\.conda\envs\nlp\Lib\site-packages\sklearn\svm\_base.py:1242: ConvergenceWarning: Liblinear failed to converge, increase the number of iterations.
  warnings.warn(
2026-06-20 19:46:27 | INFO | SVM | trial   1 | params={'C': 56.69849511478853} | train_F1=0.9367 | val_CV_F1=0.6747
