[I 2026-06-20 19:54:42,570] Trial 6 finished with value: 0.8049745936078861 and parameters: {'C': 0.14445251022763064, 'solver': 'saga'}. Best is trial 4 with value: 0.8979644921659969.
2026-06-20 19:54:46 | INFO | LR | trial   7 | params={'C': 0.004982752357076452, 'solver': 'saga'} | train_F1=0.6969 | val_CV_F1=0.6752
[I 2026-06-20 19:54:46,006] Trial 7 finished with value: 0.6751723424665611 and parameters: {'C': 0.004982752357076452, 'solver': 'saga'}. Best is trial 4 with value: 0.8979644921659969.
2026-06-20 19:54:52 | INFO | LR | trial   8 | params={'C': 0.19069966103000435, 'solver': 'lbfgs'} | train_F1=0.8504 | val_CV_F1=0.8161
[I 2026-06-20 19:54:52,064] Trial 8 finished with value: 0.8160711004470699 and parameters: {'C': 0.19069966103000435, 'solver': 'lbfgs'}. Best is trial 4 with value: 0.8979644921659969.
2026-06-20 19:54:59 | INFO | LR | trial   9 | params={'C': 0.37253938395788866, 'solver': 'lbfgs'} | train_F1=0.8762 | val_CV_F1=0.8364
[I 2026-06-20 19:54:59,889] Trial 9 finished with value: 0.8363826625035417 and parameters: {'C': 0.37253938395788866, 'solver': 'lbfgs'}. Best is trial 4 with value: 0.8979644921659969.
2026-06-20 19:54:59 | INFO | LR BEST | params={'C': 14.528246637516036, 'solver': 'lbfgs'} | val_CV_F1=0.8980
2026-06-20 19:54:59 | INFO | LR: training final model with best params={'C': 14.528246637516036, 'solver': 'lbfgs'}
2026-06-20 19:55:14 | INFO | LR | TRAIN | macro_F1=0.9853
2026-06-20 19:55:14 | INFO | LR | TRAIN | classification report:
              precision    recall  f1-score   support

     Level 0       0.99      0.98      0.98      4688
     Level 1       0.98      0.97      0.97      4688
     Level 2       0.98      0.99      0.99      4688
     Level 3       1.00      1.00      1.00      4688

    accuracy                           0.99     18752
   macro avg       0.99      0.99      0.99     18752
weighted avg       0.99      0.99      0.99     18752

2026-06-20 19:55:14 | INFO | LR | TEST | macro_F1=0.7395
2026-06-20 19:55:14 | INFO | LR | TEST | classification report:
              precision    recall  f1-score   support

     Level 0       0.86      0.86      0.86       586
     Level 1       0.78      0.77      0.78       513
     Level 2       0.53      0.57      0.55       171
     Level 3       0.78      0.77      0.77        47

    accuracy                           0.78      1317
   macro avg       0.74      0.74      0.74      1317
weighted avg       0.78      0.78      0.78      1317

2026-06-20 19:55:14 | INFO | LR SUMMARY | best_params={'C': 14.528246637516036, 'solver': 'lbfgs'}
2026-06-20 19:55:14 | INFO | ============================================================
2026-06-20 19:55:14 | INFO | NB: training start
2026-06-20 19:55:14 | INFO | NB: starting hyperparameter tuning (10 trials)
[I 2026-06-20 19:55:14,851] A new study created in memory with name: no-name-f884876b-4542-4d9d-9a95-084dcfcb88c5
2026-06-20 19:55:15 | INFO | NB | trial   0 | params={'alpha': 0.03148911647956861, 'norm': True} | train_F1=0.5358 | val_CV_F1=0.5133
[I 2026-06-20 19:55:15,301] Trial 0 finished with value: 0.5132658818169294 and parameters: {'alpha': 0.03148911647956861, 'norm': True}. Best is trial 0 with value: 0.5132658818169294.
2026-06-20 19:55:15 | INFO | NB | trial   1 | params={'alpha': 0.24810409748678125, 'norm': True} | train_F1=0.6546 | val_CV_F1=0.6416
[I 2026-06-20 19:55:15,753] Trial 1 finished with value: 0.6415838027569354 and parameters: {'alpha': 0.24810409748678125, 'norm': True}. Best is trial 1 with value: 0.6415838027569354.
2026-06-20 19:55:16 | INFO | NB | trial   2 | params={'alpha': 0.0017073967431528124, 'norm': True} | train_F1=0.4702 | val_CV_F1=0.4305
[I 2026-06-20 19:55:16,198] Trial 2 finished with value: 0.43051544690460064 and parameters: {'alpha': 0.0017073967431528124, 'norm': True}. Best is trial 1 with value: 0.6415838027569354.
2026-06-20 19:55:16 | INFO | NB | trial   3 | params={'alpha': 0.679657809075816, 'norm': False} | train_F1=0.7948 | val_CV_F1=0.7621
[I 2026-06-20 19:55:16,641] Trial 3 finished with value: 0.7621389488430254 and parameters: {'alpha': 0.679657809075816, 'norm': False}. Best is trial 3 with value: 0.7621389488430254.
2026-06-20 19:55:17 | INFO | NB | trial   4 | params={'alpha': 2.1368329072358767, 'norm': True} | train_F1=0.7397 | val_CV_F1=0.7172
[I 2026-06-20 19:55:17,077] Trial 4 finished with value: 0.7172283905598048 and parameters: {'alpha': 2.1368329072358767, 'norm': True}. Best is trial 3 with value: 0.7621389488430254.
2026-06-20 19:55:17 | INFO | NB | trial   5 | params={'alpha': 0.00541524411940254, 'norm': False} | train_F1=0.8353 | val_CV_F1=0.7822
[I 2026-06-20 19:55:17,511] Trial 5 finished with value: 0.7822331306377794 and parameters: {'alpha': 0.00541524411940254, 'norm': False}. Best is trial 5 with value: 0.7822331306377794.
2026-06-20 19:55:17 | INFO | NB | trial   6 | params={'alpha': 0.05342937261279776, 'norm': False} | train_F1=0.8249 | val_CV_F1=0.7805
[I 2026-06-20 19:55:17,945] Trial 6 finished with value: 0.780510047673042 and parameters: {'alpha': 0.05342937261279776, 'norm': False}. Best is trial 5 with value: 0.7822331306377794.
2026-06-20 19:55:18 | INFO | NB | trial   7 | params={'alpha': 0.003613894271216527, 'norm': False} | train_F1=0.8366 | val_CV_F1=0.7826
[I 2026-06-20 19:55:18,381] Trial 7 finished with value: 0.7826193523537853 and parameters: {'alpha': 0.003613894271216527, 'norm': False}. Best is trial 7 with value: 0.7826193523537853.
2026-06-20 19:55:18 | INFO | NB | trial   8 | params={'alpha': 0.06672367170464207, 'norm': True} | train_F1=0.5722 | val_CV_F1=0.5545
[I 2026-06-20 19:55:18,825] Trial 8 finished with value: 0.5545270082976412 and parameters: {'alpha': 0.06672367170464207, 'norm': True}. Best is trial 7 with value: 0.7826193523537853.
2026-06-20 19:55:19 | INFO | NB | trial   9 | params={'alpha': 0.11400863701127326, 'norm': True} | train_F1=0.6032 | val_CV_F1=0.5880
[I 2026-06-20 19:55:19,270] Trial 9 finished with value: 0.5880202506179842 and parameters: {'alpha': 0.11400863701127326, 'norm': True}. Best is trial 7 with value: 0.7826193523537853.
2026-06-20 19:55:19 | INFO | NB BEST | params={'alpha': 0.003613894271216527, 'norm': False} | val_CV_F1=0.7826
2026-06-20 19:55:19 | INFO | NB: training final model with best params={'alpha': 0.003613894271216527, 'norm': False}
2026-06-20 19:55:19 | INFO | NB | TRAIN | macro_F1=0.8366
2026-06-20 19:55:19 | INFO | NB | TRAIN | classification report:
              precision    recall  f1-score   support

     Level 0       0.87      0.88      0.88      4688
     Level 1       0.84      0.78      0.81      4688
     Level 2       0.87      0.72      0.79      4688
     Level 3       0.79      0.98      0.88      4688

    accuracy                           0.84     18752
   macro avg       0.84      0.84      0.84     18752
weighted avg       0.84      0.84      0.84     18752

2026-06-20 19:55:19 | INFO | NB | TEST | macro_F1=0.6031
2026-06-20 19:55:19 | INFO | NB | TEST | classification report:
              precision    recall  f1-score   support

     Level 0       0.76      0.82      0.79       586
     Level 1       0.75      0.62      0.68       513
     Level 2       0.51      0.42      0.46       171
     Level 3       0.34      0.87      0.49        47

    accuracy                           0.69      1317
   macro avg       0.59      0.68      0.60      1317
weighted avg       0.71      0.69      0.69      1317

2026-06-20 19:55:19 | INFO | NB SUMMARY | best_params={'alpha': 0.003613894271216527, 'norm': False}
2026-06-20 19:55:19 | INFO | ============================================================
2026-06-20 19:55:19 | INFO | SVM: training start
2026-06-20 19:55:19 | INFO | SVM: starting hyperparameter tuning (10 trials)
[I 2026-06-20 19:55:19,329] A new study created in memory with name: no-name-d0525f14-cee6-48a6-8873-6ac81399bd13
C:\Users\Britod\.conda\envs\nlp\Lib\site-packages\sklearn\svm\_classes.py:32: FutureWarning: The default value of `dual` will change from `True` to `'auto'` in 1.5. Set the value of `dual` explicitly to suppress the warning.
  warnings.warn(
C:\Users\Britod\.conda\envs\nlp\Lib\site-packages\sklearn\svm\_classes.py:32: FutureWarning: The default value of `dual` will change from `True` to `'auto'` in 1.5. Set the value of `dual` explicitly to suppress the warning.
  warnings.warn(
C:\Users\Britod\.conda\envs\nlp\Lib\site-packages\sklearn\svm\_classes.py:32: FutureWarning: The default value of `dual` will change from `True` to `'auto'` in 1.5. Set the value of `dual` explicitly to suppress the warning.
  warnings.warn(
C:\Users\Britod\.conda\envs\nlp\Lib\site-packages\sklearn\svm\_classes.py:32: FutureWarning: The default value of `dual` will change from `True` to `'auto'` in 1.5. Set the value of `dual` explicitly to suppress the warning.
  warnings.warn(
C:\Users\Britod\.conda\envs\nlp\Lib\site-packages\sklearn\svm\_classes.py:32: FutureWarning: The default value of `dual` will change from `True` to `'auto'` in 1.5. Set the value of `dual` explicitly to suppress the warning.
  warnings.warn(
C:\Users\Britod\.conda\envs\nlp\Lib\site-packages\sklearn\svm\_classes.py:32: FutureWarning: The default value of `dual` will change from `True` to `'auto'` in 1.5. Set the value of `dual` explicitly to suppress the warning.
  warnings.warn(
C:\Users\Britod\.conda\envs\nlp\Lib\site-packages\sklearn\svm\_classes.py:32: FutureWarning: The default value of `dual` will change from `True` to `'auto'` in 1.5. Set the value of `dual` explicitly to suppress the warning.
  warnings.warn(
C:\Users\Britod\.conda\envs\nlp\Lib\site-packages\sklearn\svm\_classes.py:32: FutureWarning: The default value of `dual` will change from `True` to `'auto'` in 1.5. Set the value of `dual` explicitly to suppress the warning.
  warnings.warn(
C:\Users\Britod\.conda\envs\nlp\Lib\site-packages\sklearn\svm\_classes.py:32: FutureWarning: The default value of `dual` will change from `True` to `'auto'` in 1.5. Set the value of `dual` explicitly to suppress the warning.
  warnings.warn(
C:\Users\Britod\.conda\envs\nlp\Lib\site-packages\sklearn\svm\_classes.py:32: FutureWarning: The default value of `dual` will change from `True` to `'auto'` in 1.5. Set the value of `dual` explicitly to suppress the warning.
  warnings.warn(
C:\Users\Britod\.conda\envs\nlp\Lib\site-packages\sklearn\svm\_classes.py:32: FutureWarning: The default value of `dual` will change from `True` to `'auto'` in 1.5. Set the value of `dual` explicitly to suppress the warning.
  warnings.warn(
C:\Users\Britod\.conda\envs\nlp\Lib\site-packages\sklearn\svm\_classes.py:32: FutureWarning: The default value of `dual` will change from `True` to `'auto'` in 1.5. Set the value of `dual` explicitly to suppress the warning.
  warnings.warn(
2026-06-20 19:55:21 | INFO | SVM | trial   0 | params={'C': 0.0745934328572655} | train_F1=0.8709 | val_CV_F1=0.8341
[I 2026-06-20 19:55:21,777] Trial 0 finished with value: 0.834148911222865 and parameters: {'C': 0.0745934328572655}. Best is trial 0 with value: 0.834148911222865.
C:\Users\Britod\.conda\envs\nlp\Lib\site-packages\sklearn\svm\_classes.py:32: FutureWarning: The default value of `dual` will change from `True` to `'auto'` in 1.5. Set the value of `dual` explicitly to suppress the warning.
  warnings.warn(
C:\Users\Britod\.conda\envs\nlp\Lib\site-packages\sklearn\svm\_classes.py:32: FutureWarning: The default value of `dual` will change from `True` to `'auto'` in 1.5. Set the value of `dual` explicitly to suppress the warning.
  warnings.warn(
C:\Users\Britod\.conda\envs\nlp\Lib\site-packages\sklearn\svm\_classes.py:32: FutureWarning: The default value of `dual` will change from `True` to `'auto'` in 1.5. Set the value of `dual` explicitly to suppress the warning.
  warnings.warn(
C:\Users\Britod\.conda\envs\nlp\Lib\site-packages\sklearn\svm\_base.py:1242: ConvergenceWarning: Liblinear failed to converge, increase the number of iterations.
  warnings.warn(
C:\Users\Britod\.conda\envs\nlp\Lib\site-packages\sklearn\svm\_classes.py:32: FutureWarning: The default value of `dual` will change from `True` to `'auto'` in 1.5. Set the value of `dual` explicitly to suppress the warning.
  warnings.warn(
C:\Users\Britod\.conda\envs\nlp\Lib\site-packages\sklearn\svm\_base.py:1242: ConvergenceWarning: Liblinear failed to converge, increase the number of iterations.
  warnings.warn(
C:\Users\Britod\.conda\envs\nlp\Lib\site-packages\sklearn\svm\_base.py:1242: ConvergenceWarning: Liblinear failed to converge, increase the number of iterations.
  warnings.warn(
C:\Users\Britod\.conda\envs\nlp\Lib\site-packages\sklearn\svm\_classes.py:32: FutureWarning: The default value of `dual` will change from `True` to `'auto'` in 1.5. Set the value of `dual` explicitly to suppress the warning.
  warnings.warn(
C:\Users\Britod\.conda\envs\nlp\Lib\site-packages\sklearn\svm\_classes.py:32: FutureWarning: The default value of `dual` will change from `True` to `'auto'` in 1.5. Set the value of `dual` explicitly to suppress the warning.
  warnings.warn(
C:\Users\Britod\.conda\envs\nlp\Lib\site-packages\sklearn\svm\_base.py:1242: ConvergenceWarning: Liblinear failed to converge, increase the number of iterations.
  warnings.warn(
C:\Users\Britod\.conda\envs\nlp\Lib\site-packages\sklearn\svm\_classes.py:32: FutureWarning: The default value of `dual` will change from `True` to `'auto'` in 1.5. Set the value of `dual` explicitly to suppress the warning.
  warnings.warn(
C:\Users\Britod\.conda\envs\nlp\Lib\site-packages\sklearn\svm\_base.py:1242: ConvergenceWarning: Liblinear failed to converge, increase the number of iterations.
  warnings.warn(
C:\Users\Britod\.conda\envs\nlp\Lib\site-packages\sklearn\svm\_classes.py:32: FutureWarning: The default value of `dual` will change from `True` to `'auto'` in 1.5. Set the value of `dual` explicitly to suppress the warning.
  warnings.warn(
C:\Users\Britod\.conda\envs\nlp\Lib\site-packages\sklearn\svm\_base.py:1242: ConvergenceWarning: Liblinear failed to converge, increase the number of iterations.
  warnings.warn(
C:\Users\Britod\.conda\envs\nlp\Lib\site-packages\sklearn\svm\_classes.py:32: FutureWarning: The default value of `dual` will change from `True` to `'auto'` in 1.5. Set the value of `dual` explicitly to suppress the warning.
  warnings.warn(
C:\Users\Britod\.conda\envs\nlp\Lib\site-packages\sklearn\svm\_base.py:1242: ConvergenceWarning: Liblinear failed to converge, increase the number of iterations.
  warnings.warn(
C:\Users\Britod\.conda\envs\nlp\Lib\site-packages\sklearn\svm\_base.py:1242: ConvergenceWarning: Liblinear failed to converge, increase the number of iterations.
  warnings.warn(
C:\Users\Britod\.conda\envs\nlp\Lib\site-packages\sklearn\svm\_base.py:1242: ConvergenceWarning: Liblinear failed to converge, increase the number of iterations.
  warnings.warn(
C:\Users\Britod\.conda\envs\nlp\Lib\site-packages\sklearn\svm\_classes.py:32: FutureWarning: The default value of `dual` will change from `True` to `'auto'` in 1.5. Set the value of `dual` explicitly to suppress the warning.
  warnings.warn(
C:\Users\Britod\.conda\envs\nlp\Lib\site-packages\sklearn\svm\_base.py:1242: ConvergenceWarning: Liblinear failed to converge, increase the number of iterations.
  warnings.warn(
C:\Users\Britod\.conda\envs\nlp\Lib\site-packages\sklearn\svm\_classes.py:32: FutureWarning: The default value of `dual` will change from `True` to `'auto'` in 1.5. Set the value of `dual` explicitly to suppress the warning.
  warnings.warn(
C:\Users\Britod\.conda\envs\nlp\Lib\site-packages\sklearn\svm\_base.py:1242: ConvergenceWarning: Liblinear failed to converge, increase the number of iterations.
  warnings.warn(
C:\Users\Britod\.conda\envs\nlp\Lib\site-packages\sklearn\svm\_classes.py:32: FutureWarning: The default value of `dual` will change from `True` to `'auto'` in 1.5. Set the value of `dual` explicitly to suppress the warning.
  warnings.warn(
C:\Users\Britod\.conda\envs\nlp\Lib\site-packages\sklearn\svm\_base.py:1242: ConvergenceWarning: Liblinear failed to converge, increase the number of iterations.
  warnings.warn(
2026-06-20 19:56:22 | INFO | SVM | trial   1 | params={'C': 56.69849511478853} | train_F1=0.9980 | val_CV_F1=0.8995
[I 2026-06-20 19:56:22,121] Trial 1 finished with value: 0.8995421569067279 and parameters: {'C': 56.69849511478853}. Best is trial 1 with value: 0.8995421569067279.
C:\Users\Britod\.conda\envs\nlp\Lib\site-packages\sklearn\svm\_classes.py:32: FutureWarning: The default value of `dual` will change from `True` to `'auto'` in 1.5. Set the value of `dual` explicitly to suppress the warning.
  warnings.warn(
C:\Users\Britod\.conda\envs\nlp\Lib\site-packages\sklearn\svm\_classes.py:32: FutureWarning: The default value of `dual` will change from `True` to `'auto'` in 1.5. Set the value of `dual` explicitly to suppress the warning.
  warnings.warn(
C:\Users\Britod\.conda\envs\nlp\Lib\site-packages\sklearn\svm\_classes.py:32: FutureWarning: The default value of `dual` will change from `True` to `'auto'` in 1.5. Set the value of `dual` explicitly to suppress the warning.
  warnings.warn(
C:\Users\Britod\.conda\envs\nlp\Lib\site-packages\sklearn\svm\_classes.py:32: FutureWarning: The default value of `dual` will change from `True` to `'auto'` in 1.5. Set the value of `dual` explicitly to suppress the warning.
  warnings.warn(
C:\Users\Britod\.conda\envs\nlp\Lib\site-packages\sklearn\svm\_classes.py:32: FutureWarning: The default value of `dual` will change from `True` to `'auto'` in 1.5. Set the value of `dual` explicitly to suppress the warning.
  warnings.warn(
C:\Users\Britod\.conda\envs\nlp\Lib\site-packages\sklearn\svm\_classes.py:32: FutureWarning: The default value of `dual` will change from `True` to `'auto'` in 1.5. Set the value of `dual` explicitly to suppress the warning.
  warnings.warn(
C:\Users\Britod\.conda\envs\nlp\Lib\site-packages\sklearn\svm\_classes.py:32: FutureWarning: The default value of `dual` will change from `True` to `'auto'` in 1.5. Set the value of `dual` explicitly to suppress the warning.
  warnings.warn(
C:\Users\Britod\.conda\envs\nlp\Lib\site-packages\sklearn\svm\_classes.py:32: FutureWarning: The default value of `dual` will change from `True` to `'auto'` in 1.5. Set the value of `dual` explicitly to suppress the warning.
  warnings.warn(
C:\Users\Britod\.conda\envs\nlp\Lib\site-packages\sklearn\svm\_classes.py:32: FutureWarning: The default value of `dual` will change from `True` to `'auto'` in 1.5. Set the value of `dual` explicitly to suppress the warning.
  warnings.warn(
C:\Users\Britod\.conda\envs\nlp\Lib\site-packages\sklearn\svm\_classes.py:32: FutureWarning: The default value of `dual` will change from `True` to `'auto'` in 1.5. Set the value of `dual` explicitly to suppress the warning.
  warnings.warn(
C:\Users\Britod\.conda\envs\nlp\Lib\site-packages\sklearn\svm\_classes.py:32: FutureWarning: The default value of `dual` will change from `True` to `'auto'` in 1.5. Set the value of `dual` explicitly to suppress the warning.
  warnings.warn(
C:\Users\Britod\.conda\envs\nlp\Lib\site-packages\sklearn\svm\_classes.py:32: FutureWarning: The default value of `dual` will change from `True` to `'auto'` in 1.5. Set the value of `dual` explicitly to suppress the warning.
  warnings.warn(
2026-06-20 19:56:32 | INFO | SVM | trial   2 | params={'C': 4.5705630998014515} | train_F1=0.9869 | val_CV_F1=0.8995
