[I 2026-06-20 19:56:32,662] Trial 2 finished with value: 0.8995261916577516 and parameters: {'C': 4.5705630998014515}. Best is trial 1 with value: 0.8995421569067279.
C:\Users\Britod\.conda\envs\nlp\Lib\site-packages\sklearn\svm\_classes.py:32: FutureWarning: The default value of `dual` will change from `True` to `'auto'` in 1.5. Set the value of `dual` explicitly to suppress the warning.
  warnings.warn(
C:\Users\Britod\.conda\envs\nlp\Lib\site-packages\sklearn\svm\_classes.py:32: FutureWarning: The default value of `dual` will change from `True` to `'auto'` in 1.5. Set the value of `dual` explicitly to suppress the warning.
  warnings.warn(
C:\Users\Britod\.conda\envs\nlp\Lib\site-packages\sklearn\svm\_classes.py:32: FutureWarning: The default value of `dual` will change from `True` to `'auto'` in 1.5. Set the value of `dual` explicitly to suppress the warning.
  warnings.warn(
C:\Users\Britod\.conda\envs\nlp\Lib\site-packages\sklearn\svm\_classes.py:32: FutureWarning: The default value of `dual` will change from `True` to `'auto'` in 1.5. Set the value of `dual` explicitly to suppress the warning.
  warnings.warn(
C:\Users\Britod\.conda\envs\nlp\Lib\site-packages\sklearn\svm\_classes.py:32: FutureWarning: The default value of `dual` will change from `True` to `'auto'` in 1.5. Set the value of `dual` explicitly to suppress the warning.
  warnings.warn(
C:\Users\Britod\.conda\envs\nlp\Lib\site-packages\sklearn\svm\_classes.py:32: FutureWarning: The default value of `dual` will change from `True` to `'auto'` in 1.5. Set the value of `dual` explicitly to suppress the warning.
  warnings.warn(
C:\Users\Britod\.conda\envs\nlp\Lib\site-packages\sklearn\svm\_classes.py:32: FutureWarning: The default value of `dual` will change from `True` to `'auto'` in 1.5. Set the value of `dual` explicitly to suppress the warning.
  warnings.warn(
C:\Users\Britod\.conda\envs\nlp\Lib\site-packages\sklearn\svm\_classes.py:32: FutureWarning: The default value of `dual` will change from `True` to `'auto'` in 1.5. Set the value of `dual` explicitly to suppress the warning.
  warnings.warn(
C:\Users\Britod\.conda\envs\nlp\Lib\site-packages\sklearn\svm\_classes.py:32: FutureWarning: The default value of `dual` will change from `True` to `'auto'` in 1.5. Set the value of `dual` explicitly to suppress the warning.
  warnings.warn(
C:\Users\Britod\.conda\envs\nlp\Lib\site-packages\sklearn\svm\_classes.py:32: FutureWarning: The default value of `dual` will change from `True` to `'auto'` in 1.5. Set the value of `dual` explicitly to suppress the warning.
  warnings.warn(
C:\Users\Britod\.conda\envs\nlp\Lib\site-packages\sklearn\svm\_classes.py:32: FutureWarning: The default value of `dual` will change from `True` to `'auto'` in 1.5. Set the value of `dual` explicitly to suppress the warning.
  warnings.warn(
C:\Users\Britod\.conda\envs\nlp\Lib\site-packages\sklearn\svm\_classes.py:32: FutureWarning: The default value of `dual` will change from `True` to `'auto'` in 1.5. Set the value of `dual` explicitly to suppress the warning.
  warnings.warn(
2026-06-20 19:56:36 | INFO | SVM | trial   3 | params={'C': 0.9846738873614566} | train_F1=0.9549 | val_CV_F1=0.8883
[I 2026-06-20 19:56:36,923] Trial 3 finished with value: 0.8882742227372652 and parameters: {'C': 0.9846738873614566}. Best is trial 1 with value: 0.8995421569067279.
C:\Users\Britod\.conda\envs\nlp\Lib\site-packages\sklearn\svm\_classes.py:32: FutureWarning: The default value of `dual` will change from `True` to `'auto'` in 1.5. Set the value of `dual` explicitly to suppress the warning.
  warnings.warn(
C:\Users\Britod\.conda\envs\nlp\Lib\site-packages\sklearn\svm\_classes.py:32: FutureWarning: The default value of `dual` will change from `True` to `'auto'` in 1.5. Set the value of `dual` explicitly to suppress the warning.
  warnings.warn(
C:\Users\Britod\.conda\envs\nlp\Lib\site-packages\sklearn\svm\_classes.py:32: FutureWarning: The default value of `dual` will change from `True` to `'auto'` in 1.5. Set the value of `dual` explicitly to suppress the warning.
  warnings.warn(
C:\Users\Britod\.conda\envs\nlp\Lib\site-packages\sklearn\svm\_classes.py:32: FutureWarning: The default value of `dual` will change from `True` to `'auto'` in 1.5. Set the value of `dual` explicitly to suppress the warning.
  warnings.warn(
C:\Users\Britod\.conda\envs\nlp\Lib\site-packages\sklearn\svm\_classes.py:32: FutureWarning: The default value of `dual` will change from `True` to `'auto'` in 1.5. Set the value of `dual` explicitly to suppress the warning.
  warnings.warn(
C:\Users\Britod\.conda\envs\nlp\Lib\site-packages\sklearn\svm\_classes.py:32: FutureWarning: The default value of `dual` will change from `True` to `'auto'` in 1.5. Set the value of `dual` explicitly to suppress the warning.
  warnings.warn(
C:\Users\Britod\.conda\envs\nlp\Lib\site-packages\sklearn\svm\_classes.py:32: FutureWarning: The default value of `dual` will change from `True` to `'auto'` in 1.5. Set the value of `dual` explicitly to suppress the warning.
  warnings.warn(
C:\Users\Britod\.conda\envs\nlp\Lib\site-packages\sklearn\svm\_classes.py:32: FutureWarning: The default value of `dual` will change from `True` to `'auto'` in 1.5. Set the value of `dual` explicitly to suppress the warning.
  warnings.warn(
C:\Users\Britod\.conda\envs\nlp\Lib\site-packages\sklearn\svm\_classes.py:32: FutureWarning: The default value of `dual` will change from `True` to `'auto'` in 1.5. Set the value of `dual` explicitly to suppress the warning.
  warnings.warn(
C:\Users\Britod\.conda\envs\nlp\Lib\site-packages\sklearn\svm\_classes.py:32: FutureWarning: The default value of `dual` will change from `True` to `'auto'` in 1.5. Set the value of `dual` explicitly to suppress the warning.
  warnings.warn(
C:\Users\Britod\.conda\envs\nlp\Lib\site-packages\sklearn\svm\_classes.py:32: FutureWarning: The default value of `dual` will change from `True` to `'auto'` in 1.5. Set the value of `dual` explicitly to suppress the warning.
  warnings.warn(
C:\Users\Britod\.conda\envs\nlp\Lib\site-packages\sklearn\svm\_classes.py:32: FutureWarning: The default value of `dual` will change from `True` to `'auto'` in 1.5. Set the value of `dual` explicitly to suppress the warning.
  warnings.warn(
2026-06-20 19:56:39 | INFO | SVM | trial   4 | params={'C': 0.006026889128682512} | train_F1=0.7756 | val_CV_F1=0.7493
[I 2026-06-20 19:56:39,228] Trial 4 finished with value: 0.7493333135258116 and parameters: {'C': 0.006026889128682512}. Best is trial 1 with value: 0.8995421569067279.
C:\Users\Britod\.conda\envs\nlp\Lib\site-packages\sklearn\svm\_classes.py:32: FutureWarning: The default value of `dual` will change from `True` to `'auto'` in 1.5. Set the value of `dual` explicitly to suppress the warning.
  warnings.warn(
C:\Users\Britod\.conda\envs\nlp\Lib\site-packages\sklearn\svm\_classes.py:32: FutureWarning: The default value of `dual` will change from `True` to `'auto'` in 1.5. Set the value of `dual` explicitly to suppress the warning.
  warnings.warn(
C:\Users\Britod\.conda\envs\nlp\Lib\site-packages\sklearn\svm\_classes.py:32: FutureWarning: The default value of `dual` will change from `True` to `'auto'` in 1.5. Set the value of `dual` explicitly to suppress the warning.
  warnings.warn(
C:\Users\Britod\.conda\envs\nlp\Lib\site-packages\sklearn\svm\_classes.py:32: FutureWarning: The default value of `dual` will change from `True` to `'auto'` in 1.5. Set the value of `dual` explicitly to suppress the warning.
  warnings.warn(
C:\Users\Britod\.conda\envs\nlp\Lib\site-packages\sklearn\svm\_classes.py:32: FutureWarning: The default value of `dual` will change from `True` to `'auto'` in 1.5. Set the value of `dual` explicitly to suppress the warning.
  warnings.warn(
C:\Users\Britod\.conda\envs\nlp\Lib\site-packages\sklearn\svm\_classes.py:32: FutureWarning: The default value of `dual` will change from `True` to `'auto'` in 1.5. Set the value of `dual` explicitly to suppress the warning.
  warnings.warn(
C:\Users\Britod\.conda\envs\nlp\Lib\site-packages\sklearn\svm\_classes.py:32: FutureWarning: The default value of `dual` will change from `True` to `'auto'` in 1.5. Set the value of `dual` explicitly to suppress the warning.
  warnings.warn(
C:\Users\Britod\.conda\envs\nlp\Lib\site-packages\sklearn\svm\_classes.py:32: FutureWarning: The default value of `dual` will change from `True` to `'auto'` in 1.5. Set the value of `dual` explicitly to suppress the warning.
  warnings.warn(
C:\Users\Britod\.conda\envs\nlp\Lib\site-packages\sklearn\svm\_classes.py:32: FutureWarning: The default value of `dual` will change from `True` to `'auto'` in 1.5. Set the value of `dual` explicitly to suppress the warning.
  warnings.warn(
C:\Users\Britod\.conda\envs\nlp\Lib\site-packages\sklearn\svm\_classes.py:32: FutureWarning: The default value of `dual` will change from `True` to `'auto'` in 1.5. Set the value of `dual` explicitly to suppress the warning.
  warnings.warn(
C:\Users\Britod\.conda\envs\nlp\Lib\site-packages\sklearn\svm\_classes.py:32: FutureWarning: The default value of `dual` will change from `True` to `'auto'` in 1.5. Set the value of `dual` explicitly to suppress the warning.
  warnings.warn(
C:\Users\Britod\.conda\envs\nlp\Lib\site-packages\sklearn\svm\_classes.py:32: FutureWarning: The default value of `dual` will change from `True` to `'auto'` in 1.5. Set the value of `dual` explicitly to suppress the warning.
  warnings.warn(
2026-06-20 19:56:41 | INFO | SVM | trial   5 | params={'C': 0.0060252157362038605} | train_F1=0.7756 | val_CV_F1=0.7493
[I 2026-06-20 19:56:41,581] Trial 5 finished with value: 0.7493333135258116 and parameters: {'C': 0.0060252157362038605}. Best is trial 1 with value: 0.8995421569067279.
C:\Users\Britod\.conda\envs\nlp\Lib\site-packages\sklearn\svm\_classes.py:32: FutureWarning: The default value of `dual` will change from `True` to `'auto'` in 1.5. Set the value of `dual` explicitly to suppress the warning.
  warnings.warn(
C:\Users\Britod\.conda\envs\nlp\Lib\site-packages\sklearn\svm\_classes.py:32: FutureWarning: The default value of `dual` will change from `True` to `'auto'` in 1.5. Set the value of `dual` explicitly to suppress the warning.
  warnings.warn(
C:\Users\Britod\.conda\envs\nlp\Lib\site-packages\sklearn\svm\_classes.py:32: FutureWarning: The default value of `dual` will change from `True` to `'auto'` in 1.5. Set the value of `dual` explicitly to suppress the warning.
  warnings.warn(
C:\Users\Britod\.conda\envs\nlp\Lib\site-packages\sklearn\svm\_classes.py:32: FutureWarning: The default value of `dual` will change from `True` to `'auto'` in 1.5. Set the value of `dual` explicitly to suppress the warning.
  warnings.warn(
C:\Users\Britod\.conda\envs\nlp\Lib\site-packages\sklearn\svm\_classes.py:32: FutureWarning: The default value of `dual` will change from `True` to `'auto'` in 1.5. Set the value of `dual` explicitly to suppress the warning.
  warnings.warn(
C:\Users\Britod\.conda\envs\nlp\Lib\site-packages\sklearn\svm\_classes.py:32: FutureWarning: The default value of `dual` will change from `True` to `'auto'` in 1.5. Set the value of `dual` explicitly to suppress the warning.
  warnings.warn(
C:\Users\Britod\.conda\envs\nlp\Lib\site-packages\sklearn\svm\_classes.py:32: FutureWarning: The default value of `dual` will change from `True` to `'auto'` in 1.5. Set the value of `dual` explicitly to suppress the warning.
  warnings.warn(
C:\Users\Britod\.conda\envs\nlp\Lib\site-packages\sklearn\svm\_classes.py:32: FutureWarning: The default value of `dual` will change from `True` to `'auto'` in 1.5. Set the value of `dual` explicitly to suppress the warning.
  warnings.warn(
C:\Users\Britod\.conda\envs\nlp\Lib\site-packages\sklearn\svm\_classes.py:32: FutureWarning: The default value of `dual` will change from `True` to `'auto'` in 1.5. Set the value of `dual` explicitly to suppress the warning.
  warnings.warn(
C:\Users\Britod\.conda\envs\nlp\Lib\site-packages\sklearn\svm\_classes.py:32: FutureWarning: The default value of `dual` will change from `True` to `'auto'` in 1.5. Set the value of `dual` explicitly to suppress the warning.
  warnings.warn(
C:\Users\Britod\.conda\envs\nlp\Lib\site-packages\sklearn\svm\_classes.py:32: FutureWarning: The default value of `dual` will change from `True` to `'auto'` in 1.5. Set the value of `dual` explicitly to suppress the warning.
  warnings.warn(
C:\Users\Britod\.conda\envs\nlp\Lib\site-packages\sklearn\svm\_classes.py:32: FutureWarning: The default value of `dual` will change from `True` to `'auto'` in 1.5. Set the value of `dual` explicitly to suppress the warning.
  warnings.warn(
2026-06-20 19:56:43 | INFO | SVM | trial   6 | params={'C': 0.0019517224641449498} | train_F1=0.7401 | val_CV_F1=0.7206
[I 2026-06-20 19:56:43,657] Trial 6 finished with value: 0.7206273129511023 and parameters: {'C': 0.0019517224641449498}. Best is trial 1 with value: 0.8995421569067279.
C:\Users\Britod\.conda\envs\nlp\Lib\site-packages\sklearn\svm\_classes.py:32: FutureWarning: The default value of `dual` will change from `True` to `'auto'` in 1.5. Set the value of `dual` explicitly to suppress the warning.
  warnings.warn(
C:\Users\Britod\.conda\envs\nlp\Lib\site-packages\sklearn\svm\_classes.py:32: FutureWarning: The default value of `dual` will change from `True` to `'auto'` in 1.5. Set the value of `dual` explicitly to suppress the warning.
  warnings.warn(
C:\Users\Britod\.conda\envs\nlp\Lib\site-packages\sklearn\svm\_classes.py:32: FutureWarning: The default value of `dual` will change from `True` to `'auto'` in 1.5. Set the value of `dual` explicitly to suppress the warning.
  warnings.warn(
C:\Users\Britod\.conda\envs\nlp\Lib\site-packages\sklearn\svm\_classes.py:32: FutureWarning: The default value of `dual` will change from `True` to `'auto'` in 1.5. Set the value of `dual` explicitly to suppress the warning.
  warnings.warn(
C:\Users\Britod\.conda\envs\nlp\Lib\site-packages\sklearn\svm\_classes.py:32: FutureWarning: The default value of `dual` will change from `True` to `'auto'` in 1.5. Set the value of `dual` explicitly to suppress the warning.
  warnings.warn(
C:\Users\Britod\.conda\envs\nlp\Lib\site-packages\sklearn\svm\_classes.py:32: FutureWarning: The default value of `dual` will change from `True` to `'auto'` in 1.5. Set the value of `dual` explicitly to suppress the warning.
  warnings.warn(
C:\Users\Britod\.conda\envs\nlp\Lib\site-packages\sklearn\svm\_classes.py:32: FutureWarning: The default value of `dual` will change from `True` to `'auto'` in 1.5. Set the value of `dual` explicitly to suppress the warning.
  warnings.warn(
C:\Users\Britod\.conda\envs\nlp\Lib\site-packages\sklearn\svm\_classes.py:32: FutureWarning: The default value of `dual` will change from `True` to `'auto'` in 1.5. Set the value of `dual` explicitly to suppress the warning.
  warnings.warn(
C:\Users\Britod\.conda\envs\nlp\Lib\site-packages\sklearn\svm\_classes.py:32: FutureWarning: The default value of `dual` will change from `True` to `'auto'` in 1.5. Set the value of `dual` explicitly to suppress the warning.
  warnings.warn(
C:\Users\Britod\.conda\envs\nlp\Lib\site-packages\sklearn\svm\_classes.py:32: FutureWarning: The default value of `dual` will change from `True` to `'auto'` in 1.5. Set the value of `dual` explicitly to suppress the warning.
  warnings.warn(
C:\Users\Britod\.conda\envs\nlp\Lib\site-packages\sklearn\svm\_classes.py:32: FutureWarning: The default value of `dual` will change from `True` to `'auto'` in 1.5. Set the value of `dual` explicitly to suppress the warning.
  warnings.warn(
C:\Users\Britod\.conda\envs\nlp\Lib\site-packages\sklearn\svm\_classes.py:32: FutureWarning: The default value of `dual` will change from `True` to `'auto'` in 1.5. Set the value of `dual` explicitly to suppress the warning.
  warnings.warn(
2026-06-20 19:57:19 | INFO | SVM | trial   7 | params={'C': 21.42302175774105} | train_F1=0.9955 | val_CV_F1=0.9023
[I 2026-06-20 19:57:19,505] Trial 7 finished with value: 0.9023071282137177 and parameters: {'C': 21.42302175774105}. Best is trial 7 with value: 0.9023071282137177.
C:\Users\Britod\.conda\envs\nlp\Lib\site-packages\sklearn\svm\_classes.py:32: FutureWarning: The default value of `dual` will change from `True` to `'auto'` in 1.5. Set the value of `dual` explicitly to suppress the warning.
  warnings.warn(
C:\Users\Britod\.conda\envs\nlp\Lib\site-packages\sklearn\svm\_classes.py:32: FutureWarning: The default value of `dual` will change from `True` to `'auto'` in 1.5. Set the value of `dual` explicitly to suppress the warning.
  warnings.warn(
C:\Users\Britod\.conda\envs\nlp\Lib\site-packages\sklearn\svm\_classes.py:32: FutureWarning: The default value of `dual` will change from `True` to `'auto'` in 1.5. Set the value of `dual` explicitly to suppress the warning.
  warnings.warn(
C:\Users\Britod\.conda\envs\nlp\Lib\site-packages\sklearn\svm\_classes.py:32: FutureWarning: The default value of `dual` will change from `True` to `'auto'` in 1.5. Set the value of `dual` explicitly to suppress the warning.
  warnings.warn(
C:\Users\Britod\.conda\envs\nlp\Lib\site-packages\sklearn\svm\_classes.py:32: FutureWarning: The default value of `dual` will change from `True` to `'auto'` in 1.5. Set the value of `dual` explicitly to suppress the warning.
  warnings.warn(
C:\Users\Britod\.conda\envs\nlp\Lib\site-packages\sklearn\svm\_classes.py:32: FutureWarning: The default value of `dual` will change from `True` to `'auto'` in 1.5. Set the value of `dual` explicitly to suppress the warning.
  warnings.warn(
C:\Users\Britod\.conda\envs\nlp\Lib\site-packages\sklearn\svm\_classes.py:32: FutureWarning: The default value of `dual` will change from `True` to `'auto'` in 1.5. Set the value of `dual` explicitly to suppress the warning.
  warnings.warn(
C:\Users\Britod\.conda\envs\nlp\Lib\site-packages\sklearn\svm\_classes.py:32: FutureWarning: The default value of `dual` will change from `True` to `'auto'` in 1.5. Set the value of `dual` explicitly to suppress the warning.
  warnings.warn(
C:\Users\Britod\.conda\envs\nlp\Lib\site-packages\sklearn\svm\_classes.py:32: FutureWarning: The default value of `dual` will change from `True` to `'auto'` in 1.5. Set the value of `dual` explicitly to suppress the warning.
  warnings.warn(
C:\Users\Britod\.conda\envs\nlp\Lib\site-packages\sklearn\svm\_classes.py:32: FutureWarning: The default value of `dual` will change from `True` to `'auto'` in 1.5. Set the value of `dual` explicitly to suppress the warning.
  warnings.warn(
C:\Users\Britod\.conda\envs\nlp\Lib\site-packages\sklearn\svm\_classes.py:32: FutureWarning: The default value of `dual` will change from `True` to `'auto'` in 1.5. Set the value of `dual` explicitly to suppress the warning.
  warnings.warn(
C:\Users\Britod\.conda\envs\nlp\Lib\site-packages\sklearn\svm\_classes.py:32: FutureWarning: The default value of `dual` will change from `True` to `'auto'` in 1.5. Set the value of `dual` explicitly to suppress the warning.
  warnings.warn(
2026-06-20 19:57:23 | INFO | SVM | trial   8 | params={'C': 1.0129197956845732} | train_F1=0.9555 | val_CV_F1=0.8890
