[I 2026-06-20 19:58:20,218] Trial 6 finished with value: 0.6378978204726522 and parameters: {'C': 0.0019517224641449498}. Best is trial 3 with value: 0.7037811380460038.
C:\Users\Britod\.conda\envs\nlp\Lib\site-packages\sklearn\svm\_classes.py:32: FutureWarning: The default value of `dual` will change from `True` to `'auto'` in 1.5. Set the value of `dual` explicitly to suppress the warning.
  warnings.warn(
C:\Users\Britod\.conda\envs\nlp\Lib\site-packages\sklearn\svm\_classes.py:32: FutureWarning: The default value of `dual` will change from `True` to `'auto'` in 1.5. Set the value of `dual` explicitly to suppress the warning.
  warnings.warn(
C:\Users\Britod\.conda\envs\nlp\Lib\site-packages\sklearn\svm\_classes.py:32: FutureWarning: The default value of `dual` will change from `True` to `'auto'` in 1.5. Set the value of `dual` explicitly to suppress the warning.
  warnings.warn(
C:\Users\Britod\.conda\envs\nlp\Lib\site-packages\sklearn\svm\_classes.py:32: FutureWarning: The default value of `dual` will change from `True` to `'auto'` in 1.5. Set the value of `dual` explicitly to suppress the warning.
  warnings.warn(
C:\Users\Britod\.conda\envs\nlp\Lib\site-packages\sklearn\svm\_classes.py:32: FutureWarning: The default value of `dual` will change from `True` to `'auto'` in 1.5. Set the value of `dual` explicitly to suppress the warning.
  warnings.warn(
C:\Users\Britod\.conda\envs\nlp\Lib\site-packages\sklearn\svm\_classes.py:32: FutureWarning: The default value of `dual` will change from `True` to `'auto'` in 1.5. Set the value of `dual` explicitly to suppress the warning.
  warnings.warn(
C:\Users\Britod\.conda\envs\nlp\Lib\site-packages\sklearn\svm\_classes.py:32: FutureWarning: The default value of `dual` will change from `True` to `'auto'` in 1.5. Set the value of `dual` explicitly to suppress the warning.
  warnings.warn(
C:\Users\Britod\.conda\envs\nlp\Lib\site-packages\sklearn\svm\_classes.py:32: FutureWarning: The default value of `dual` will change from `True` to `'auto'` in 1.5. Set the value of `dual` explicitly to suppress the warning.
  warnings.warn(
C:\Users\Britod\.conda\envs\nlp\Lib\site-packages\sklearn\svm\_classes.py:32: FutureWarning: The default value of `dual` will change from `True` to `'auto'` in 1.5. Set the value of `dual` explicitly to suppress the warning.
  warnings.warn(
C:\Users\Britod\.conda\envs\nlp\Lib\site-packages\sklearn\svm\_classes.py:32: FutureWarning: The default value of `dual` will change from `True` to `'auto'` in 1.5. Set the value of `dual` explicitly to suppress the warning.
  warnings.warn(
C:\Users\Britod\.conda\envs\nlp\Lib\site-packages\sklearn\svm\_classes.py:32: FutureWarning: The default value of `dual` will change from `True` to `'auto'` in 1.5. Set the value of `dual` explicitly to suppress the warning.
  warnings.warn(
C:\Users\Britod\.conda\envs\nlp\Lib\site-packages\sklearn\svm\_classes.py:32: FutureWarning: The default value of `dual` will change from `True` to `'auto'` in 1.5. Set the value of `dual` explicitly to suppress the warning.
  warnings.warn(
2026-06-20 19:58:22 | INFO | SVM | trial   7 | params={'C': 21.42302175774105} | train_F1=0.9987 | val_CV_F1=0.6906
[I 2026-06-20 19:58:22,187] Trial 7 finished with value: 0.690589319904554 and parameters: {'C': 21.42302175774105}. Best is trial 3 with value: 0.7037811380460038.
C:\Users\Britod\.conda\envs\nlp\Lib\site-packages\sklearn\svm\_classes.py:32: FutureWarning: The default value of `dual` will change from `True` to `'auto'` in 1.5. Set the value of `dual` explicitly to suppress the warning.
  warnings.warn(
C:\Users\Britod\.conda\envs\nlp\Lib\site-packages\sklearn\svm\_classes.py:32: FutureWarning: The default value of `dual` will change from `True` to `'auto'` in 1.5. Set the value of `dual` explicitly to suppress the warning.
  warnings.warn(
C:\Users\Britod\.conda\envs\nlp\Lib\site-packages\sklearn\svm\_classes.py:32: FutureWarning: The default value of `dual` will change from `True` to `'auto'` in 1.5. Set the value of `dual` explicitly to suppress the warning.
  warnings.warn(
C:\Users\Britod\.conda\envs\nlp\Lib\site-packages\sklearn\svm\_classes.py:32: FutureWarning: The default value of `dual` will change from `True` to `'auto'` in 1.5. Set the value of `dual` explicitly to suppress the warning.
  warnings.warn(
C:\Users\Britod\.conda\envs\nlp\Lib\site-packages\sklearn\svm\_classes.py:32: FutureWarning: The default value of `dual` will change from `True` to `'auto'` in 1.5. Set the value of `dual` explicitly to suppress the warning.
  warnings.warn(
C:\Users\Britod\.conda\envs\nlp\Lib\site-packages\sklearn\svm\_classes.py:32: FutureWarning: The default value of `dual` will change from `True` to `'auto'` in 1.5. Set the value of `dual` explicitly to suppress the warning.
  warnings.warn(
C:\Users\Britod\.conda\envs\nlp\Lib\site-packages\sklearn\svm\_classes.py:32: FutureWarning: The default value of `dual` will change from `True` to `'auto'` in 1.5. Set the value of `dual` explicitly to suppress the warning.
  warnings.warn(
C:\Users\Britod\.conda\envs\nlp\Lib\site-packages\sklearn\svm\_classes.py:32: FutureWarning: The default value of `dual` will change from `True` to `'auto'` in 1.5. Set the value of `dual` explicitly to suppress the warning.
  warnings.warn(
C:\Users\Britod\.conda\envs\nlp\Lib\site-packages\sklearn\svm\_classes.py:32: FutureWarning: The default value of `dual` will change from `True` to `'auto'` in 1.5. Set the value of `dual` explicitly to suppress the warning.
  warnings.warn(
C:\Users\Britod\.conda\envs\nlp\Lib\site-packages\sklearn\svm\_classes.py:32: FutureWarning: The default value of `dual` will change from `True` to `'auto'` in 1.5. Set the value of `dual` explicitly to suppress the warning.
  warnings.warn(
C:\Users\Britod\.conda\envs\nlp\Lib\site-packages\sklearn\svm\_classes.py:32: FutureWarning: The default value of `dual` will change from `True` to `'auto'` in 1.5. Set the value of `dual` explicitly to suppress the warning.
  warnings.warn(
C:\Users\Britod\.conda\envs\nlp\Lib\site-packages\sklearn\svm\_classes.py:32: FutureWarning: The default value of `dual` will change from `True` to `'auto'` in 1.5. Set the value of `dual` explicitly to suppress the warning.
  warnings.warn(
2026-06-20 19:58:22 | INFO | SVM | trial   8 | params={'C': 1.0129197956845732} | train_F1=0.9775 | val_CV_F1=0.7031
[I 2026-06-20 19:58:22,539] Trial 8 finished with value: 0.7030870268877302 and parameters: {'C': 1.0129197956845732}. Best is trial 3 with value: 0.7037811380460038.
C:\Users\Britod\.conda\envs\nlp\Lib\site-packages\sklearn\svm\_classes.py:32: FutureWarning: The default value of `dual` will change from `True` to `'auto'` in 1.5. Set the value of `dual` explicitly to suppress the warning.
  warnings.warn(
C:\Users\Britod\.conda\envs\nlp\Lib\site-packages\sklearn\svm\_classes.py:32: FutureWarning: The default value of `dual` will change from `True` to `'auto'` in 1.5. Set the value of `dual` explicitly to suppress the warning.
  warnings.warn(
C:\Users\Britod\.conda\envs\nlp\Lib\site-packages\sklearn\svm\_classes.py:32: FutureWarning: The default value of `dual` will change from `True` to `'auto'` in 1.5. Set the value of `dual` explicitly to suppress the warning.
  warnings.warn(
C:\Users\Britod\.conda\envs\nlp\Lib\site-packages\sklearn\svm\_classes.py:32: FutureWarning: The default value of `dual` will change from `True` to `'auto'` in 1.5. Set the value of `dual` explicitly to suppress the warning.
  warnings.warn(
C:\Users\Britod\.conda\envs\nlp\Lib\site-packages\sklearn\svm\_classes.py:32: FutureWarning: The default value of `dual` will change from `True` to `'auto'` in 1.5. Set the value of `dual` explicitly to suppress the warning.
  warnings.warn(
C:\Users\Britod\.conda\envs\nlp\Lib\site-packages\sklearn\svm\_classes.py:32: FutureWarning: The default value of `dual` will change from `True` to `'auto'` in 1.5. Set the value of `dual` explicitly to suppress the warning.
  warnings.warn(
C:\Users\Britod\.conda\envs\nlp\Lib\site-packages\sklearn\svm\_classes.py:32: FutureWarning: The default value of `dual` will change from `True` to `'auto'` in 1.5. Set the value of `dual` explicitly to suppress the warning.
  warnings.warn(
C:\Users\Britod\.conda\envs\nlp\Lib\site-packages\sklearn\svm\_classes.py:32: FutureWarning: The default value of `dual` will change from `True` to `'auto'` in 1.5. Set the value of `dual` explicitly to suppress the warning.
  warnings.warn(
C:\Users\Britod\.conda\envs\nlp\Lib\site-packages\sklearn\svm\_classes.py:32: FutureWarning: The default value of `dual` will change from `True` to `'auto'` in 1.5. Set the value of `dual` explicitly to suppress the warning.
  warnings.warn(
C:\Users\Britod\.conda\envs\nlp\Lib\site-packages\sklearn\svm\_classes.py:32: FutureWarning: The default value of `dual` will change from `True` to `'auto'` in 1.5. Set the value of `dual` explicitly to suppress the warning.
  warnings.warn(
C:\Users\Britod\.conda\envs\nlp\Lib\site-packages\sklearn\svm\_classes.py:32: FutureWarning: The default value of `dual` will change from `True` to `'auto'` in 1.5. Set the value of `dual` explicitly to suppress the warning.
  warnings.warn(
C:\Users\Britod\.conda\envs\nlp\Lib\site-packages\sklearn\svm\_classes.py:32: FutureWarning: The default value of `dual` will change from `True` to `'auto'` in 1.5. Set the value of `dual` explicitly to suppress the warning.
  warnings.warn(
2026-06-20 19:58:23 | INFO | SVM | trial   9 | params={'C': 3.4702669886504163} | train_F1=0.9947 | val_CV_F1=0.6949
[I 2026-06-20 19:58:23,112] Trial 9 finished with value: 0.6948567632351819 and parameters: {'C': 3.4702669886504163}. Best is trial 3 with value: 0.7037811380460038.
2026-06-20 19:58:23 | INFO | SVM BEST | params={'C': 0.9846738873614566} | val_CV_F1=0.7038
2026-06-20 19:58:23 | INFO | SVM: training final model with best params={'C': 0.9846738873614566}
C:\Users\Britod\.conda\envs\nlp\Lib\site-packages\sklearn\svm\_classes.py:32: FutureWarning: The default value of `dual` will change from `True` to `'auto'` in 1.5. Set the value of `dual` explicitly to suppress the warning.
  warnings.warn(
C:\Users\Britod\.conda\envs\nlp\Lib\site-packages\sklearn\svm\_classes.py:32: FutureWarning: The default value of `dual` will change from `True` to `'auto'` in 1.5. Set the value of `dual` explicitly to suppress the warning.
  warnings.warn(
C:\Users\Britod\.conda\envs\nlp\Lib\site-packages\sklearn\svm\_classes.py:32: FutureWarning: The default value of `dual` will change from `True` to `'auto'` in 1.5. Set the value of `dual` explicitly to suppress the warning.
  warnings.warn(
2026-06-20 19:58:23 | INFO | SVM | TRAIN | macro_F1=0.9768
2026-06-20 19:58:23 | INFO | SVM | TRAIN | classification report:
              precision    recall  f1-score   support

     Level 0       0.99      0.98      0.99       378
     Level 1       0.97      0.97      0.97       378
     Level 2       0.98      0.96      0.97       378
     Level 3       0.97      0.99      0.98       378

    accuracy                           0.98      1512
   macro avg       0.98      0.98      0.98      1512
weighted avg       0.98      0.98      0.98      1512

2026-06-20 19:58:23 | INFO | SVM | TEST | macro_F1=0.6532
2026-06-20 19:58:23 | INFO | SVM | TEST | classification report:
              precision    recall  f1-score   support

     Level 0       0.83      0.78      0.81       586
     Level 1       0.75      0.66      0.70       513
     Level 2       0.42      0.57      0.48       171
     Level 3       0.48      0.89      0.62        47

    accuracy                           0.71      1317
   macro avg       0.62      0.72      0.65      1317
weighted avg       0.73      0.71      0.72      1317

2026-06-20 19:58:23 | INFO | SVM SUMMARY | best_params={'C': 0.9846738873614566}
2026-06-20 19:58:23 | INFO | Models saved to D:\projects\nlp-swear_words_detector\saved_models/
2026-06-20 19:58:23 | INFO | ============================================================
2026-06-20 19:58:23 | INFO | Complete. Log: D:\projects\nlp-swear_words_detector\logs\classical_undersample.log
===== DONE  train_undersample.py rc=0 19:58:24 =====
===== START train_smoteenn_raw.py 19:58:24 =====
2026-06-20 19:58:26 | INFO | ============================================================
2026-06-20 19:58:26 | INFO | Strategy: SMOTEENN on raw TF-IDF (50k features) — expect slow ENN step
Regenerating BERT input:   0%|          | 0/13169 [00:00<?, ?it/s]Regenerating BERT input:  45%|####5     | 5931/13169 [00:00<00:00, 59012.90it/s]Regenerating BERT input:  90%|########9 | 11833/13169 [00:00<00:00, 58264.36it/s]Regenerating BERT input: 100%|##########| 13169/13169 [00:00<00:00, 58345.73it/s]
2026-06-20 19:58:26 | INFO | Data loaded | train=10,535 | val=1,317 | test=1,317
2026-06-20 20:17:28 | INFO | SMOTEENN applied | total=15,550
2026-06-20 20:42:34 | INFO | SMOTEENN applied | total=15,550
2026-06-20 20:42:34 | INFO | ============================================================
2026-06-20 20:42:34 | INFO | LR: training start
2026-06-20 20:42:34 | INFO | LR: starting hyperparameter tuning (10 trials)
[I 2026-06-20 20:42:34,554] A new study created in memory with name: no-name-c9972317-2759-445f-a2ed-9142494d30b2
2026-06-20 20:42:40 | INFO | LR | trial   0 | params={'C': 0.0745934328572655, 'solver': 'lbfgs'} | train_F1=0.8465 | val_CV_F1=0.8162
[I 2026-06-20 20:42:40,126] Trial 0 finished with value: 0.8162213155980774 and parameters: {'C': 0.0745934328572655, 'solver': 'lbfgs'}. Best is trial 0 with value: 0.8162213155980774.
2026-06-20 20:42:50 | INFO | LR | trial   1 | params={'C': 0.9846738873614566, 'solver': 'lbfgs'} | train_F1=0.9502 | val_CV_F1=0.9090
[I 2026-06-20 20:42:50,811] Trial 1 finished with value: 0.9090307044033512 and parameters: {'C': 0.9846738873614566, 'solver': 'lbfgs'}. Best is trial 1 with value: 0.9090307044033512.
2026-06-20 20:42:52 | INFO | LR | trial   2 | params={'C': 0.0019517224641449498, 'solver': 'lbfgs'} | train_F1=0.7000 | val_CV_F1=0.6866
[I 2026-06-20 20:42:52,944] Trial 2 finished with value: 0.6866452507768018 and parameters: {'C': 0.0019517224641449498, 'solver': 'lbfgs'}. Best is trial 1 with value: 0.9090307044033512.
2026-06-20 20:43:18 | INFO | LR | trial   3 | params={'C': 3.4702669886504163, 'solver': 'saga'} | train_F1=0.9805 | val_CV_F1=0.9353
[I 2026-06-20 20:43:18,977] Trial 3 finished with value: 0.935349241759511 and parameters: {'C': 3.4702669886504163, 'solver': 'saga'}. Best is trial 3 with value: 0.935349241759511.
2026-06-20 20:43:39 | INFO | LR | trial   4 | params={'C': 14.528246637516036, 'solver': 'lbfgs'} | train_F1=0.9956 | val_CV_F1=0.9446
[I 2026-06-20 20:43:39,369] Trial 4 finished with value: 0.9445602227788195 and parameters: {'C': 14.528246637516036, 'solver': 'lbfgs'}. Best is trial 4 with value: 0.9445602227788195.
2026-06-20 20:43:43 | INFO | LR | trial   5 | params={'C': 0.008260808399079604, 'solver': 'saga'} | train_F1=0.7494 | val_CV_F1=0.7261
[I 2026-06-20 20:43:43,331] Trial 5 finished with value: 0.7261456395138107 and parameters: {'C': 0.008260808399079604, 'solver': 'saga'}. Best is trial 4 with value: 0.9445602227788195.
2026-06-20 20:43:47 | INFO | LR | trial   6 | params={'C': 0.14445251022763064, 'solver': 'saga'} | train_F1=0.8795 | val_CV_F1=0.8447
[I 2026-06-20 20:43:47,005] Trial 6 finished with value: 0.8446904966509049 and parameters: {'C': 0.14445251022763064, 'solver': 'saga'}. Best is trial 4 with value: 0.9445602227788195.
2026-06-20 20:43:50 | INFO | LR | trial   7 | params={'C': 0.004982752357076452, 'solver': 'saga'} | train_F1=0.7288 | val_CV_F1=0.7071
[I 2026-06-20 20:43:50,331] Trial 7 finished with value: 0.7071400454810667 and parameters: {'C': 0.004982752357076452, 'solver': 'saga'}. Best is trial 4 with value: 0.9445602227788195.
2026-06-20 20:43:56 | INFO | LR | trial   8 | params={'C': 0.19069966103000435, 'solver': 'lbfgs'} | train_F1=0.8927 | val_CV_F1=0.8566
[I 2026-06-20 20:43:56,348] Trial 8 finished with value: 0.85656434407361 and parameters: {'C': 0.19069966103000435, 'solver': 'lbfgs'}. Best is trial 4 with value: 0.9445602227788195.
2026-06-20 20:44:04 | INFO | LR | trial   9 | params={'C': 0.37253938395788866, 'solver': 'lbfgs'} | train_F1=0.9173 | val_CV_F1=0.8824
[I 2026-06-20 20:44:04,304] Trial 9 finished with value: 0.8824422710435865 and parameters: {'C': 0.37253938395788866, 'solver': 'lbfgs'}. Best is trial 4 with value: 0.9445602227788195.
2026-06-20 20:44:04 | INFO | LR BEST | params={'C': 14.528246637516036, 'solver': 'lbfgs'} | val_CV_F1=0.9446
2026-06-20 20:44:04 | INFO | LR: training final model with best params={'C': 14.528246637516036, 'solver': 'lbfgs'}
2026-06-20 20:44:14 | INFO | LR | TRAIN | macro_F1=0.9956
2026-06-20 20:44:14 | INFO | LR | TRAIN | classification report:
              precision    recall  f1-score   support

     Level 0       1.00      0.99      0.99      4688
     Level 1       0.99      1.00      0.99      1769
     Level 2       0.99      1.00      0.99      4405
     Level 3       1.00      1.00      1.00      4688

    accuracy                           1.00     15550
   macro avg       0.99      1.00      1.00     15550
weighted avg       1.00      1.00      1.00     15550

2026-06-20 20:44:14 | INFO | LR | TEST | macro_F1=0.6980
2026-06-20 20:44:14 | INFO | LR | TEST | classification report:
              precision    recall  f1-score   support

     Level 0       0.75      0.90      0.82       586
     Level 1       0.87      0.53      0.66       513
     Level 2       0.47      0.67      0.55       171
     Level 3       0.72      0.81      0.76        47

    accuracy                           0.73      1317
   macro avg       0.70      0.73      0.70      1317
weighted avg       0.76      0.73      0.72      1317

2026-06-20 20:44:14 | INFO | LR SUMMARY | best_params={'C': 14.528246637516036, 'solver': 'lbfgs'}
2026-06-20 20:44:14 | INFO | ============================================================
2026-06-20 20:44:14 | INFO | NB: training start
2026-06-20 20:44:14 | INFO | NB: starting hyperparameter tuning (10 trials)
[I 2026-06-20 20:44:14,968] A new study created in memory with name: no-name-d16c4c40-b5f0-466d-b205-949b7bf444d8
2026-06-20 20:44:15 | INFO | NB | trial   0 | params={'alpha': 0.03148911647956861, 'norm': True} | train_F1=0.5953 | val_CV_F1=0.5813
[I 2026-06-20 20:44:15,401] Trial 0 finished with value: 0.5813058915906818 and parameters: {'alpha': 0.03148911647956861, 'norm': True}. Best is trial 0 with value: 0.5813058915906818.
2026-06-20 20:44:15 | INFO | NB | trial   1 | params={'alpha': 0.24810409748678125, 'norm': True} | train_F1=0.7255 | val_CV_F1=0.7165
[I 2026-06-20 20:44:15,829] Trial 1 finished with value: 0.7165193281804608 and parameters: {'alpha': 0.24810409748678125, 'norm': True}. Best is trial 1 with value: 0.7165193281804608.
2026-06-20 20:44:16 | INFO | NB | trial   2 | params={'alpha': 0.0017073967431528124, 'norm': True} | train_F1=0.5532 | val_CV_F1=0.5314
[I 2026-06-20 20:44:16,258] Trial 2 finished with value: 0.5314277439222139 and parameters: {'alpha': 0.0017073967431528124, 'norm': True}. Best is trial 1 with value: 0.7165193281804608.
2026-06-20 20:44:16 | INFO | NB | trial   3 | params={'alpha': 0.679657809075816, 'norm': False} | train_F1=0.8523 | val_CV_F1=0.8185
[I 2026-06-20 20:44:16,685] Trial 3 finished with value: 0.8184507982751827 and parameters: {'alpha': 0.679657809075816, 'norm': False}. Best is trial 3 with value: 0.8184507982751827.
2026-06-20 20:44:17 | INFO | NB | trial   4 | params={'alpha': 2.1368329072358767, 'norm': True} | train_F1=0.7570 | val_CV_F1=0.7196
[I 2026-06-20 20:44:17,121] Trial 4 finished with value: 0.719599389210838 and parameters: {'alpha': 2.1368329072358767, 'norm': True}. Best is trial 3 with value: 0.8184507982751827.
2026-06-20 20:44:17 | INFO | NB | trial   5 | params={'alpha': 0.00541524411940254, 'norm': False} | train_F1=0.8875 | val_CV_F1=0.8500
[I 2026-06-20 20:44:17,554] Trial 5 finished with value: 0.8499679040104113 and parameters: {'alpha': 0.00541524411940254, 'norm': False}. Best is trial 5 with value: 0.8499679040104113.
2026-06-20 20:44:17 | INFO | NB | trial   6 | params={'alpha': 0.05342937261279776, 'norm': False} | train_F1=0.8799 | val_CV_F1=0.8470
[I 2026-06-20 20:44:17,990] Trial 6 finished with value: 0.8469806956208205 and parameters: {'alpha': 0.05342937261279776, 'norm': False}. Best is trial 5 with value: 0.8499679040104113.
2026-06-20 20:44:18 | INFO | NB | trial   7 | params={'alpha': 0.003613894271216527, 'norm': False} | train_F1=0.8887 | val_CV_F1=0.8499
[I 2026-06-20 20:44:18,426] Trial 7 finished with value: 0.8499086531307597 and parameters: {'alpha': 0.003613894271216527, 'norm': False}. Best is trial 5 with value: 0.8499679040104113.
2026-06-20 20:44:18 | INFO | NB | trial   8 | params={'alpha': 0.06672367170464207, 'norm': True} | train_F1=0.6307 | val_CV_F1=0.6218
[I 2026-06-20 20:44:18,851] Trial 8 finished with value: 0.6218327405671312 and parameters: {'alpha': 0.06672367170464207, 'norm': True}. Best is trial 5 with value: 0.8499679040104113.
2026-06-20 20:44:19 | INFO | NB | trial   9 | params={'alpha': 0.11400863701127326, 'norm': True} | train_F1=0.6653 | val_CV_F1=0.6616
