[I 2026-06-20 20:45:10,934] Trial 4 finished with value: 0.792464774317585 and parameters: {'C': 0.006026889128682512}. Best is trial 2 with value: 0.9451084698063285.
C:\Users\Britod\.conda\envs\nlp\Lib\site-packages\sklearn\svm\_classes.py:32: FutureWarning: The default value of `dual` will change from `True` to `'auto'` in 1.5. Set the value of `dual` explicitly to suppress the warning.
  warnings.warn(
C:\Users\Britod\.conda\envs\nlp\Lib\site-packages\sklearn\svm\_classes.py:32: FutureWarning: The default value of `dual` will change from `True` to `'auto'` in 1.5. Set the value of `dual` explicitly to suppress the warning.
  warnings.warn(
C:\Users\Britod\.conda\envs\nlp\Lib\site-packages\sklearn\svm\_classes.py:32: FutureWarning: The default value of `dual` will change from `True` to `'auto'` in 1.5. Set the value of `dual` explicitly to suppress the warning.
  warnings.warn(
C:\Users\Britod\.conda\envs\nlp\Lib\site-packages\sklearn\svm\_classes.py:32: FutureWarning: The default value of `dual` will change from `True` to `'auto'` in 1.5. Set the value of `dual` explicitly to suppress the warning.
  warnings.warn(
C:\Users\Britod\.conda\envs\nlp\Lib\site-packages\sklearn\svm\_classes.py:32: FutureWarning: The default value of `dual` will change from `True` to `'auto'` in 1.5. Set the value of `dual` explicitly to suppress the warning.
  warnings.warn(
C:\Users\Britod\.conda\envs\nlp\Lib\site-packages\sklearn\svm\_classes.py:32: FutureWarning: The default value of `dual` will change from `True` to `'auto'` in 1.5. Set the value of `dual` explicitly to suppress the warning.
  warnings.warn(
C:\Users\Britod\.conda\envs\nlp\Lib\site-packages\sklearn\svm\_classes.py:32: FutureWarning: The default value of `dual` will change from `True` to `'auto'` in 1.5. Set the value of `dual` explicitly to suppress the warning.
  warnings.warn(
C:\Users\Britod\.conda\envs\nlp\Lib\site-packages\sklearn\svm\_classes.py:32: FutureWarning: The default value of `dual` will change from `True` to `'auto'` in 1.5. Set the value of `dual` explicitly to suppress the warning.
  warnings.warn(
C:\Users\Britod\.conda\envs\nlp\Lib\site-packages\sklearn\svm\_classes.py:32: FutureWarning: The default value of `dual` will change from `True` to `'auto'` in 1.5. Set the value of `dual` explicitly to suppress the warning.
  warnings.warn(
C:\Users\Britod\.conda\envs\nlp\Lib\site-packages\sklearn\svm\_classes.py:32: FutureWarning: The default value of `dual` will change from `True` to `'auto'` in 1.5. Set the value of `dual` explicitly to suppress the warning.
  warnings.warn(
C:\Users\Britod\.conda\envs\nlp\Lib\site-packages\sklearn\svm\_classes.py:32: FutureWarning: The default value of `dual` will change from `True` to `'auto'` in 1.5. Set the value of `dual` explicitly to suppress the warning.
  warnings.warn(
C:\Users\Britod\.conda\envs\nlp\Lib\site-packages\sklearn\svm\_classes.py:32: FutureWarning: The default value of `dual` will change from `True` to `'auto'` in 1.5. Set the value of `dual` explicitly to suppress the warning.
  warnings.warn(
2026-06-20 20:45:13 | INFO | SVM | trial   5 | params={'C': 0.0060252157362038605} | train_F1=0.8176 | val_CV_F1=0.7925
[I 2026-06-20 20:45:13,087] Trial 5 finished with value: 0.792464774317585 and parameters: {'C': 0.0060252157362038605}. Best is trial 2 with value: 0.9451084698063285.
C:\Users\Britod\.conda\envs\nlp\Lib\site-packages\sklearn\svm\_classes.py:32: FutureWarning: The default value of `dual` will change from `True` to `'auto'` in 1.5. Set the value of `dual` explicitly to suppress the warning.
  warnings.warn(
C:\Users\Britod\.conda\envs\nlp\Lib\site-packages\sklearn\svm\_classes.py:32: FutureWarning: The default value of `dual` will change from `True` to `'auto'` in 1.5. Set the value of `dual` explicitly to suppress the warning.
  warnings.warn(
C:\Users\Britod\.conda\envs\nlp\Lib\site-packages\sklearn\svm\_classes.py:32: FutureWarning: The default value of `dual` will change from `True` to `'auto'` in 1.5. Set the value of `dual` explicitly to suppress the warning.
  warnings.warn(
C:\Users\Britod\.conda\envs\nlp\Lib\site-packages\sklearn\svm\_classes.py:32: FutureWarning: The default value of `dual` will change from `True` to `'auto'` in 1.5. Set the value of `dual` explicitly to suppress the warning.
  warnings.warn(
C:\Users\Britod\.conda\envs\nlp\Lib\site-packages\sklearn\svm\_classes.py:32: FutureWarning: The default value of `dual` will change from `True` to `'auto'` in 1.5. Set the value of `dual` explicitly to suppress the warning.
  warnings.warn(
C:\Users\Britod\.conda\envs\nlp\Lib\site-packages\sklearn\svm\_classes.py:32: FutureWarning: The default value of `dual` will change from `True` to `'auto'` in 1.5. Set the value of `dual` explicitly to suppress the warning.
  warnings.warn(
C:\Users\Britod\.conda\envs\nlp\Lib\site-packages\sklearn\svm\_classes.py:32: FutureWarning: The default value of `dual` will change from `True` to `'auto'` in 1.5. Set the value of `dual` explicitly to suppress the warning.
  warnings.warn(
C:\Users\Britod\.conda\envs\nlp\Lib\site-packages\sklearn\svm\_classes.py:32: FutureWarning: The default value of `dual` will change from `True` to `'auto'` in 1.5. Set the value of `dual` explicitly to suppress the warning.
  warnings.warn(
C:\Users\Britod\.conda\envs\nlp\Lib\site-packages\sklearn\svm\_classes.py:32: FutureWarning: The default value of `dual` will change from `True` to `'auto'` in 1.5. Set the value of `dual` explicitly to suppress the warning.
  warnings.warn(
C:\Users\Britod\.conda\envs\nlp\Lib\site-packages\sklearn\svm\_classes.py:32: FutureWarning: The default value of `dual` will change from `True` to `'auto'` in 1.5. Set the value of `dual` explicitly to suppress the warning.
  warnings.warn(
C:\Users\Britod\.conda\envs\nlp\Lib\site-packages\sklearn\svm\_classes.py:32: FutureWarning: The default value of `dual` will change from `True` to `'auto'` in 1.5. Set the value of `dual` explicitly to suppress the warning.
  warnings.warn(
C:\Users\Britod\.conda\envs\nlp\Lib\site-packages\sklearn\svm\_classes.py:32: FutureWarning: The default value of `dual` will change from `True` to `'auto'` in 1.5. Set the value of `dual` explicitly to suppress the warning.
  warnings.warn(
2026-06-20 20:45:14 | INFO | SVM | trial   6 | params={'C': 0.0019517224641449498} | train_F1=0.7808 | val_CV_F1=0.7623
[I 2026-06-20 20:45:14,982] Trial 6 finished with value: 0.7623145085774515 and parameters: {'C': 0.0019517224641449498}. Best is trial 2 with value: 0.9451084698063285.
C:\Users\Britod\.conda\envs\nlp\Lib\site-packages\sklearn\svm\_classes.py:32: FutureWarning: The default value of `dual` will change from `True` to `'auto'` in 1.5. Set the value of `dual` explicitly to suppress the warning.
  warnings.warn(
C:\Users\Britod\.conda\envs\nlp\Lib\site-packages\sklearn\svm\_classes.py:32: FutureWarning: The default value of `dual` will change from `True` to `'auto'` in 1.5. Set the value of `dual` explicitly to suppress the warning.
  warnings.warn(
C:\Users\Britod\.conda\envs\nlp\Lib\site-packages\sklearn\svm\_classes.py:32: FutureWarning: The default value of `dual` will change from `True` to `'auto'` in 1.5. Set the value of `dual` explicitly to suppress the warning.
  warnings.warn(
C:\Users\Britod\.conda\envs\nlp\Lib\site-packages\sklearn\svm\_classes.py:32: FutureWarning: The default value of `dual` will change from `True` to `'auto'` in 1.5. Set the value of `dual` explicitly to suppress the warning.
  warnings.warn(
C:\Users\Britod\.conda\envs\nlp\Lib\site-packages\sklearn\svm\_classes.py:32: FutureWarning: The default value of `dual` will change from `True` to `'auto'` in 1.5. Set the value of `dual` explicitly to suppress the warning.
  warnings.warn(
C:\Users\Britod\.conda\envs\nlp\Lib\site-packages\sklearn\svm\_classes.py:32: FutureWarning: The default value of `dual` will change from `True` to `'auto'` in 1.5. Set the value of `dual` explicitly to suppress the warning.
  warnings.warn(
C:\Users\Britod\.conda\envs\nlp\Lib\site-packages\sklearn\svm\_classes.py:32: FutureWarning: The default value of `dual` will change from `True` to `'auto'` in 1.5. Set the value of `dual` explicitly to suppress the warning.
  warnings.warn(
C:\Users\Britod\.conda\envs\nlp\Lib\site-packages\sklearn\svm\_classes.py:32: FutureWarning: The default value of `dual` will change from `True` to `'auto'` in 1.5. Set the value of `dual` explicitly to suppress the warning.
  warnings.warn(
C:\Users\Britod\.conda\envs\nlp\Lib\site-packages\sklearn\svm\_classes.py:32: FutureWarning: The default value of `dual` will change from `True` to `'auto'` in 1.5. Set the value of `dual` explicitly to suppress the warning.
  warnings.warn(
C:\Users\Britod\.conda\envs\nlp\Lib\site-packages\sklearn\svm\_classes.py:32: FutureWarning: The default value of `dual` will change from `True` to `'auto'` in 1.5. Set the value of `dual` explicitly to suppress the warning.
  warnings.warn(
C:\Users\Britod\.conda\envs\nlp\Lib\site-packages\sklearn\svm\_classes.py:32: FutureWarning: The default value of `dual` will change from `True` to `'auto'` in 1.5. Set the value of `dual` explicitly to suppress the warning.
  warnings.warn(
C:\Users\Britod\.conda\envs\nlp\Lib\site-packages\sklearn\svm\_classes.py:32: FutureWarning: The default value of `dual` will change from `True` to `'auto'` in 1.5. Set the value of `dual` explicitly to suppress the warning.
  warnings.warn(
2026-06-20 20:45:33 | INFO | SVM | trial   7 | params={'C': 21.42302175774105} | train_F1=0.9995 | val_CV_F1=0.9438
[I 2026-06-20 20:45:33,629] Trial 7 finished with value: 0.9438159305279455 and parameters: {'C': 21.42302175774105}. Best is trial 2 with value: 0.9451084698063285.
C:\Users\Britod\.conda\envs\nlp\Lib\site-packages\sklearn\svm\_classes.py:32: FutureWarning: The default value of `dual` will change from `True` to `'auto'` in 1.5. Set the value of `dual` explicitly to suppress the warning.
  warnings.warn(
C:\Users\Britod\.conda\envs\nlp\Lib\site-packages\sklearn\svm\_classes.py:32: FutureWarning: The default value of `dual` will change from `True` to `'auto'` in 1.5. Set the value of `dual` explicitly to suppress the warning.
  warnings.warn(
C:\Users\Britod\.conda\envs\nlp\Lib\site-packages\sklearn\svm\_classes.py:32: FutureWarning: The default value of `dual` will change from `True` to `'auto'` in 1.5. Set the value of `dual` explicitly to suppress the warning.
  warnings.warn(
C:\Users\Britod\.conda\envs\nlp\Lib\site-packages\sklearn\svm\_classes.py:32: FutureWarning: The default value of `dual` will change from `True` to `'auto'` in 1.5. Set the value of `dual` explicitly to suppress the warning.
  warnings.warn(
C:\Users\Britod\.conda\envs\nlp\Lib\site-packages\sklearn\svm\_classes.py:32: FutureWarning: The default value of `dual` will change from `True` to `'auto'` in 1.5. Set the value of `dual` explicitly to suppress the warning.
  warnings.warn(
C:\Users\Britod\.conda\envs\nlp\Lib\site-packages\sklearn\svm\_classes.py:32: FutureWarning: The default value of `dual` will change from `True` to `'auto'` in 1.5. Set the value of `dual` explicitly to suppress the warning.
  warnings.warn(
C:\Users\Britod\.conda\envs\nlp\Lib\site-packages\sklearn\svm\_classes.py:32: FutureWarning: The default value of `dual` will change from `True` to `'auto'` in 1.5. Set the value of `dual` explicitly to suppress the warning.
  warnings.warn(
C:\Users\Britod\.conda\envs\nlp\Lib\site-packages\sklearn\svm\_classes.py:32: FutureWarning: The default value of `dual` will change from `True` to `'auto'` in 1.5. Set the value of `dual` explicitly to suppress the warning.
  warnings.warn(
C:\Users\Britod\.conda\envs\nlp\Lib\site-packages\sklearn\svm\_classes.py:32: FutureWarning: The default value of `dual` will change from `True` to `'auto'` in 1.5. Set the value of `dual` explicitly to suppress the warning.
  warnings.warn(
C:\Users\Britod\.conda\envs\nlp\Lib\site-packages\sklearn\svm\_classes.py:32: FutureWarning: The default value of `dual` will change from `True` to `'auto'` in 1.5. Set the value of `dual` explicitly to suppress the warning.
  warnings.warn(
C:\Users\Britod\.conda\envs\nlp\Lib\site-packages\sklearn\svm\_classes.py:32: FutureWarning: The default value of `dual` will change from `True` to `'auto'` in 1.5. Set the value of `dual` explicitly to suppress the warning.
  warnings.warn(
C:\Users\Britod\.conda\envs\nlp\Lib\site-packages\sklearn\svm\_classes.py:32: FutureWarning: The default value of `dual` will change from `True` to `'auto'` in 1.5. Set the value of `dual` explicitly to suppress the warning.
  warnings.warn(
2026-06-20 20:45:37 | INFO | SVM | trial   8 | params={'C': 1.0129197956845732} | train_F1=0.9841 | val_CV_F1=0.9376
[I 2026-06-20 20:45:37,116] Trial 8 finished with value: 0.9376346277486851 and parameters: {'C': 1.0129197956845732}. Best is trial 2 with value: 0.9451084698063285.
C:\Users\Britod\.conda\envs\nlp\Lib\site-packages\sklearn\svm\_classes.py:32: FutureWarning: The default value of `dual` will change from `True` to `'auto'` in 1.5. Set the value of `dual` explicitly to suppress the warning.
  warnings.warn(
C:\Users\Britod\.conda\envs\nlp\Lib\site-packages\sklearn\svm\_classes.py:32: FutureWarning: The default value of `dual` will change from `True` to `'auto'` in 1.5. Set the value of `dual` explicitly to suppress the warning.
  warnings.warn(
C:\Users\Britod\.conda\envs\nlp\Lib\site-packages\sklearn\svm\_classes.py:32: FutureWarning: The default value of `dual` will change from `True` to `'auto'` in 1.5. Set the value of `dual` explicitly to suppress the warning.
  warnings.warn(
C:\Users\Britod\.conda\envs\nlp\Lib\site-packages\sklearn\svm\_classes.py:32: FutureWarning: The default value of `dual` will change from `True` to `'auto'` in 1.5. Set the value of `dual` explicitly to suppress the warning.
  warnings.warn(
C:\Users\Britod\.conda\envs\nlp\Lib\site-packages\sklearn\svm\_classes.py:32: FutureWarning: The default value of `dual` will change from `True` to `'auto'` in 1.5. Set the value of `dual` explicitly to suppress the warning.
  warnings.warn(
C:\Users\Britod\.conda\envs\nlp\Lib\site-packages\sklearn\svm\_classes.py:32: FutureWarning: The default value of `dual` will change from `True` to `'auto'` in 1.5. Set the value of `dual` explicitly to suppress the warning.
  warnings.warn(
C:\Users\Britod\.conda\envs\nlp\Lib\site-packages\sklearn\svm\_classes.py:32: FutureWarning: The default value of `dual` will change from `True` to `'auto'` in 1.5. Set the value of `dual` explicitly to suppress the warning.
  warnings.warn(
C:\Users\Britod\.conda\envs\nlp\Lib\site-packages\sklearn\svm\_classes.py:32: FutureWarning: The default value of `dual` will change from `True` to `'auto'` in 1.5. Set the value of `dual` explicitly to suppress the warning.
  warnings.warn(
C:\Users\Britod\.conda\envs\nlp\Lib\site-packages\sklearn\svm\_classes.py:32: FutureWarning: The default value of `dual` will change from `True` to `'auto'` in 1.5. Set the value of `dual` explicitly to suppress the warning.
  warnings.warn(
C:\Users\Britod\.conda\envs\nlp\Lib\site-packages\sklearn\svm\_classes.py:32: FutureWarning: The default value of `dual` will change from `True` to `'auto'` in 1.5. Set the value of `dual` explicitly to suppress the warning.
  warnings.warn(
C:\Users\Britod\.conda\envs\nlp\Lib\site-packages\sklearn\svm\_classes.py:32: FutureWarning: The default value of `dual` will change from `True` to `'auto'` in 1.5. Set the value of `dual` explicitly to suppress the warning.
  warnings.warn(
C:\Users\Britod\.conda\envs\nlp\Lib\site-packages\sklearn\svm\_classes.py:32: FutureWarning: The default value of `dual` will change from `True` to `'auto'` in 1.5. Set the value of `dual` explicitly to suppress the warning.
  warnings.warn(
2026-06-20 20:45:42 | INFO | SVM | trial   9 | params={'C': 3.4702669886504163} | train_F1=0.9960 | val_CV_F1=0.9440
[I 2026-06-20 20:45:42,895] Trial 9 finished with value: 0.944008073153582 and parameters: {'C': 3.4702669886504163}. Best is trial 2 with value: 0.9451084698063285.
2026-06-20 20:45:42 | INFO | SVM BEST | params={'C': 4.5705630998014515} | val_CV_F1=0.9451
2026-06-20 20:45:42 | INFO | SVM: training final model with best params={'C': 4.5705630998014515}
C:\Users\Britod\.conda\envs\nlp\Lib\site-packages\sklearn\svm\_classes.py:32: FutureWarning: The default value of `dual` will change from `True` to `'auto'` in 1.5. Set the value of `dual` explicitly to suppress the warning.
  warnings.warn(
C:\Users\Britod\.conda\envs\nlp\Lib\site-packages\sklearn\svm\_classes.py:32: FutureWarning: The default value of `dual` will change from `True` to `'auto'` in 1.5. Set the value of `dual` explicitly to suppress the warning.
  warnings.warn(
C:\Users\Britod\.conda\envs\nlp\Lib\site-packages\sklearn\svm\_classes.py:32: FutureWarning: The default value of `dual` will change from `True` to `'auto'` in 1.5. Set the value of `dual` explicitly to suppress the warning.
  warnings.warn(
2026-06-20 20:45:46 | INFO | SVM | TRAIN | macro_F1=0.9969
2026-06-20 20:45:46 | INFO | SVM | TRAIN | classification report:
              precision    recall  f1-score   support

     Level 0       1.00      1.00      1.00      4688
     Level 1       1.00      0.99      1.00      1769
     Level 2       1.00      1.00      1.00      4405
     Level 3       1.00      1.00      1.00      4688

    accuracy                           1.00     15550
   macro avg       1.00      1.00      1.00     15550
weighted avg       1.00      1.00      1.00     15550

2026-06-20 20:45:46 | INFO | SVM | TEST | macro_F1=0.6857
2026-06-20 20:45:46 | INFO | SVM | TEST | classification report:
              precision    recall  f1-score   support

     Level 0       0.71      0.92      0.80       586
     Level 1       0.87      0.49      0.62       513
     Level 2       0.48      0.61      0.54       171
     Level 3       0.74      0.83      0.78        47

    accuracy                           0.71      1317
   macro avg       0.70      0.71      0.69      1317
weighted avg       0.74      0.71      0.70      1317

2026-06-20 20:45:46 | INFO | SVM SUMMARY | best_params={'C': 4.5705630998014515}
2026-06-20 20:45:46 | INFO | Models saved to D:\projects\nlp-swear_words_detector\saved_models/
2026-06-20 20:45:46 | INFO | ============================================================
2026-06-20 20:45:46 | INFO | Complete. Log: D:\projects\nlp-swear_words_detector\logs\classical_smoteenn_raw.log
===== DONE  train_smoteenn_raw.py rc=0 20:45:47 =====
===== ALL STRATEGIES FINISHED 20:45:47 =====
