[I 2026-06-20 20:44:19,273] Trial 9 finished with value: 0.6616046135563062 and parameters: {'alpha': 0.11400863701127326, 'norm': True}. Best is trial 5 with value: 0.8499679040104113.
2026-06-20 20:44:19 | INFO | NB BEST | params={'alpha': 0.00541524411940254, 'norm': False} | val_CV_F1=0.8500
2026-06-20 20:44:19 | INFO | NB: training final model with best params={'alpha': 0.00541524411940254, 'norm': False}
2026-06-20 20:44:19 | INFO | NB | TRAIN | macro_F1=0.8875
2026-06-20 20:44:19 | INFO | NB | TRAIN | classification report:
              precision    recall  f1-score   support

     Level 0       0.93      0.93      0.93      4688
     Level 1       0.90      0.83      0.86      1769
     Level 2       0.91      0.80      0.85      4405
     Level 3       0.85      0.98      0.91      4688

    accuracy                           0.89     15550
   macro avg       0.90      0.88      0.89     15550
weighted avg       0.90      0.89      0.89     15550

2026-06-20 20:44:19 | INFO | NB | TEST | macro_F1=0.5211
2026-06-20 20:44:19 | INFO | NB | TEST | classification report:
              precision    recall  f1-score   support

     Level 0       0.66      0.89      0.76       586
     Level 1       0.81      0.30      0.44       513
     Level 2       0.38      0.47      0.42       171
     Level 3       0.33      0.85      0.47        47

    accuracy                           0.60      1317
   macro avg       0.54      0.63      0.52      1317
weighted avg       0.67      0.60      0.58      1317

2026-06-20 20:44:19 | INFO | NB SUMMARY | best_params={'alpha': 0.00541524411940254, 'norm': False}
2026-06-20 20:44:19 | INFO | ============================================================
2026-06-20 20:44:19 | INFO | SVM: training start
2026-06-20 20:44:19 | INFO | SVM: starting hyperparameter tuning (10 trials)
[I 2026-06-20 20:44:19,325] A new study created in memory with name: no-name-63dbab07-f55a-448d-bccc-b1e39ea4fa54
C:\Users\Britod\.conda\envs\nlp\Lib\site-packages\sklearn\svm\_classes.py:32: FutureWarning: The default value of `dual` will change from `True` to `'auto'` in 1.5. Set the value of `dual` explicitly to suppress the warning.
  warnings.warn(
C:\Users\Britod\.conda\envs\nlp\Lib\site-packages\sklearn\svm\_classes.py:32: FutureWarning: The default value of `dual` will change from `True` to `'auto'` in 1.5. Set the value of `dual` explicitly to suppress the warning.
  warnings.warn(
C:\Users\Britod\.conda\envs\nlp\Lib\site-packages\sklearn\svm\_classes.py:32: FutureWarning: The default value of `dual` will change from `True` to `'auto'` in 1.5. Set the value of `dual` explicitly to suppress the warning.
  warnings.warn(
C:\Users\Britod\.conda\envs\nlp\Lib\site-packages\sklearn\svm\_classes.py:32: FutureWarning: The default value of `dual` will change from `True` to `'auto'` in 1.5. Set the value of `dual` explicitly to suppress the warning.
  warnings.warn(
C:\Users\Britod\.conda\envs\nlp\Lib\site-packages\sklearn\svm\_classes.py:32: FutureWarning: The default value of `dual` will change from `True` to `'auto'` in 1.5. Set the value of `dual` explicitly to suppress the warning.
  warnings.warn(
C:\Users\Britod\.conda\envs\nlp\Lib\site-packages\sklearn\svm\_classes.py:32: FutureWarning: The default value of `dual` will change from `True` to `'auto'` in 1.5. Set the value of `dual` explicitly to suppress the warning.
  warnings.warn(
C:\Users\Britod\.conda\envs\nlp\Lib\site-packages\sklearn\svm\_classes.py:32: FutureWarning: The default value of `dual` will change from `True` to `'auto'` in 1.5. Set the value of `dual` explicitly to suppress the warning.
  warnings.warn(
C:\Users\Britod\.conda\envs\nlp\Lib\site-packages\sklearn\svm\_classes.py:32: FutureWarning: The default value of `dual` will change from `True` to `'auto'` in 1.5. Set the value of `dual` explicitly to suppress the warning.
  warnings.warn(
C:\Users\Britod\.conda\envs\nlp\Lib\site-packages\sklearn\svm\_classes.py:32: FutureWarning: The default value of `dual` will change from `True` to `'auto'` in 1.5. Set the value of `dual` explicitly to suppress the warning.
  warnings.warn(
C:\Users\Britod\.conda\envs\nlp\Lib\site-packages\sklearn\svm\_classes.py:32: FutureWarning: The default value of `dual` will change from `True` to `'auto'` in 1.5. Set the value of `dual` explicitly to suppress the warning.
  warnings.warn(
C:\Users\Britod\.conda\envs\nlp\Lib\site-packages\sklearn\svm\_classes.py:32: FutureWarning: The default value of `dual` will change from `True` to `'auto'` in 1.5. Set the value of `dual` explicitly to suppress the warning.
  warnings.warn(
C:\Users\Britod\.conda\envs\nlp\Lib\site-packages\sklearn\svm\_classes.py:32: FutureWarning: The default value of `dual` will change from `True` to `'auto'` in 1.5. Set the value of `dual` explicitly to suppress the warning.
  warnings.warn(
2026-06-20 20:44:21 | INFO | SVM | trial   0 | params={'C': 0.0745934328572655} | train_F1=0.9188 | val_CV_F1=0.8828
[I 2026-06-20 20:44:21,456] Trial 0 finished with value: 0.8827693943918958 and parameters: {'C': 0.0745934328572655}. Best is trial 0 with value: 0.8827693943918958.
C:\Users\Britod\.conda\envs\nlp\Lib\site-packages\sklearn\svm\_classes.py:32: FutureWarning: The default value of `dual` will change from `True` to `'auto'` in 1.5. Set the value of `dual` explicitly to suppress the warning.
  warnings.warn(
C:\Users\Britod\.conda\envs\nlp\Lib\site-packages\sklearn\svm\_classes.py:32: FutureWarning: The default value of `dual` will change from `True` to `'auto'` in 1.5. Set the value of `dual` explicitly to suppress the warning.
  warnings.warn(
C:\Users\Britod\.conda\envs\nlp\Lib\site-packages\sklearn\svm\_classes.py:32: FutureWarning: The default value of `dual` will change from `True` to `'auto'` in 1.5. Set the value of `dual` explicitly to suppress the warning.
  warnings.warn(
C:\Users\Britod\.conda\envs\nlp\Lib\site-packages\sklearn\svm\_base.py:1242: ConvergenceWarning: Liblinear failed to converge, increase the number of iterations.
  warnings.warn(
C:\Users\Britod\.conda\envs\nlp\Lib\site-packages\sklearn\svm\_classes.py:32: FutureWarning: The default value of `dual` will change from `True` to `'auto'` in 1.5. Set the value of `dual` explicitly to suppress the warning.
  warnings.warn(
C:\Users\Britod\.conda\envs\nlp\Lib\site-packages\sklearn\svm\_base.py:1242: ConvergenceWarning: Liblinear failed to converge, increase the number of iterations.
  warnings.warn(
C:\Users\Britod\.conda\envs\nlp\Lib\site-packages\sklearn\svm\_classes.py:32: FutureWarning: The default value of `dual` will change from `True` to `'auto'` in 1.5. Set the value of `dual` explicitly to suppress the warning.
  warnings.warn(
C:\Users\Britod\.conda\envs\nlp\Lib\site-packages\sklearn\svm\_base.py:1242: ConvergenceWarning: Liblinear failed to converge, increase the number of iterations.
  warnings.warn(
C:\Users\Britod\.conda\envs\nlp\Lib\site-packages\sklearn\svm\_classes.py:32: FutureWarning: The default value of `dual` will change from `True` to `'auto'` in 1.5. Set the value of `dual` explicitly to suppress the warning.
  warnings.warn(
C:\Users\Britod\.conda\envs\nlp\Lib\site-packages\sklearn\svm\_base.py:1242: ConvergenceWarning: Liblinear failed to converge, increase the number of iterations.
  warnings.warn(
C:\Users\Britod\.conda\envs\nlp\Lib\site-packages\sklearn\svm\_classes.py:32: FutureWarning: The default value of `dual` will change from `True` to `'auto'` in 1.5. Set the value of `dual` explicitly to suppress the warning.
  warnings.warn(
C:\Users\Britod\.conda\envs\nlp\Lib\site-packages\sklearn\svm\_base.py:1242: ConvergenceWarning: Liblinear failed to converge, increase the number of iterations.
  warnings.warn(
C:\Users\Britod\.conda\envs\nlp\Lib\site-packages\sklearn\svm\_classes.py:32: FutureWarning: The default value of `dual` will change from `True` to `'auto'` in 1.5. Set the value of `dual` explicitly to suppress the warning.
  warnings.warn(
C:\Users\Britod\.conda\envs\nlp\Lib\site-packages\sklearn\svm\_base.py:1242: ConvergenceWarning: Liblinear failed to converge, increase the number of iterations.
  warnings.warn(
C:\Users\Britod\.conda\envs\nlp\Lib\site-packages\sklearn\svm\_classes.py:32: FutureWarning: The default value of `dual` will change from `True` to `'auto'` in 1.5. Set the value of `dual` explicitly to suppress the warning.
  warnings.warn(
C:\Users\Britod\.conda\envs\nlp\Lib\site-packages\sklearn\svm\_base.py:1242: ConvergenceWarning: Liblinear failed to converge, increase the number of iterations.
  warnings.warn(
C:\Users\Britod\.conda\envs\nlp\Lib\site-packages\sklearn\svm\_base.py:1242: ConvergenceWarning: Liblinear failed to converge, increase the number of iterations.
  warnings.warn(
C:\Users\Britod\.conda\envs\nlp\Lib\site-packages\sklearn\svm\_base.py:1242: ConvergenceWarning: Liblinear failed to converge, increase the number of iterations.
  warnings.warn(
C:\Users\Britod\.conda\envs\nlp\Lib\site-packages\sklearn\svm\_classes.py:32: FutureWarning: The default value of `dual` will change from `True` to `'auto'` in 1.5. Set the value of `dual` explicitly to suppress the warning.
  warnings.warn(
C:\Users\Britod\.conda\envs\nlp\Lib\site-packages\sklearn\svm\_base.py:1242: ConvergenceWarning: Liblinear failed to converge, increase the number of iterations.
  warnings.warn(
C:\Users\Britod\.conda\envs\nlp\Lib\site-packages\sklearn\svm\_classes.py:32: FutureWarning: The default value of `dual` will change from `True` to `'auto'` in 1.5. Set the value of `dual` explicitly to suppress the warning.
  warnings.warn(
C:\Users\Britod\.conda\envs\nlp\Lib\site-packages\sklearn\svm\_base.py:1242: ConvergenceWarning: Liblinear failed to converge, increase the number of iterations.
  warnings.warn(
C:\Users\Britod\.conda\envs\nlp\Lib\site-packages\sklearn\svm\_classes.py:32: FutureWarning: The default value of `dual` will change from `True` to `'auto'` in 1.5. Set the value of `dual` explicitly to suppress the warning.
  warnings.warn(
C:\Users\Britod\.conda\envs\nlp\Lib\site-packages\sklearn\svm\_base.py:1242: ConvergenceWarning: Liblinear failed to converge, increase the number of iterations.
  warnings.warn(
2026-06-20 20:44:58 | INFO | SVM | trial   1 | params={'C': 56.69849511478853} | train_F1=0.9999 | val_CV_F1=0.9419
[I 2026-06-20 20:44:58,403] Trial 1 finished with value: 0.9419004731389705 and parameters: {'C': 56.69849511478853}. Best is trial 1 with value: 0.9419004731389705.
C:\Users\Britod\.conda\envs\nlp\Lib\site-packages\sklearn\svm\_classes.py:32: FutureWarning: The default value of `dual` will change from `True` to `'auto'` in 1.5. Set the value of `dual` explicitly to suppress the warning.
  warnings.warn(
C:\Users\Britod\.conda\envs\nlp\Lib\site-packages\sklearn\svm\_classes.py:32: FutureWarning: The default value of `dual` will change from `True` to `'auto'` in 1.5. Set the value of `dual` explicitly to suppress the warning.
  warnings.warn(
C:\Users\Britod\.conda\envs\nlp\Lib\site-packages\sklearn\svm\_classes.py:32: FutureWarning: The default value of `dual` will change from `True` to `'auto'` in 1.5. Set the value of `dual` explicitly to suppress the warning.
  warnings.warn(
C:\Users\Britod\.conda\envs\nlp\Lib\site-packages\sklearn\svm\_classes.py:32: FutureWarning: The default value of `dual` will change from `True` to `'auto'` in 1.5. Set the value of `dual` explicitly to suppress the warning.
  warnings.warn(
C:\Users\Britod\.conda\envs\nlp\Lib\site-packages\sklearn\svm\_classes.py:32: FutureWarning: The default value of `dual` will change from `True` to `'auto'` in 1.5. Set the value of `dual` explicitly to suppress the warning.
  warnings.warn(
C:\Users\Britod\.conda\envs\nlp\Lib\site-packages\sklearn\svm\_classes.py:32: FutureWarning: The default value of `dual` will change from `True` to `'auto'` in 1.5. Set the value of `dual` explicitly to suppress the warning.
  warnings.warn(
C:\Users\Britod\.conda\envs\nlp\Lib\site-packages\sklearn\svm\_classes.py:32: FutureWarning: The default value of `dual` will change from `True` to `'auto'` in 1.5. Set the value of `dual` explicitly to suppress the warning.
  warnings.warn(
C:\Users\Britod\.conda\envs\nlp\Lib\site-packages\sklearn\svm\_classes.py:32: FutureWarning: The default value of `dual` will change from `True` to `'auto'` in 1.5. Set the value of `dual` explicitly to suppress the warning.
  warnings.warn(
C:\Users\Britod\.conda\envs\nlp\Lib\site-packages\sklearn\svm\_classes.py:32: FutureWarning: The default value of `dual` will change from `True` to `'auto'` in 1.5. Set the value of `dual` explicitly to suppress the warning.
  warnings.warn(
C:\Users\Britod\.conda\envs\nlp\Lib\site-packages\sklearn\svm\_classes.py:32: FutureWarning: The default value of `dual` will change from `True` to `'auto'` in 1.5. Set the value of `dual` explicitly to suppress the warning.
  warnings.warn(
C:\Users\Britod\.conda\envs\nlp\Lib\site-packages\sklearn\svm\_classes.py:32: FutureWarning: The default value of `dual` will change from `True` to `'auto'` in 1.5. Set the value of `dual` explicitly to suppress the warning.
  warnings.warn(
C:\Users\Britod\.conda\envs\nlp\Lib\site-packages\sklearn\svm\_classes.py:32: FutureWarning: The default value of `dual` will change from `True` to `'auto'` in 1.5. Set the value of `dual` explicitly to suppress the warning.
  warnings.warn(
2026-06-20 20:45:05 | INFO | SVM | trial   2 | params={'C': 4.5705630998014515} | train_F1=0.9969 | val_CV_F1=0.9451
[I 2026-06-20 20:45:05,245] Trial 2 finished with value: 0.9451084698063285 and parameters: {'C': 4.5705630998014515}. Best is trial 2 with value: 0.9451084698063285.
C:\Users\Britod\.conda\envs\nlp\Lib\site-packages\sklearn\svm\_classes.py:32: FutureWarning: The default value of `dual` will change from `True` to `'auto'` in 1.5. Set the value of `dual` explicitly to suppress the warning.
  warnings.warn(
C:\Users\Britod\.conda\envs\nlp\Lib\site-packages\sklearn\svm\_classes.py:32: FutureWarning: The default value of `dual` will change from `True` to `'auto'` in 1.5. Set the value of `dual` explicitly to suppress the warning.
  warnings.warn(
C:\Users\Britod\.conda\envs\nlp\Lib\site-packages\sklearn\svm\_classes.py:32: FutureWarning: The default value of `dual` will change from `True` to `'auto'` in 1.5. Set the value of `dual` explicitly to suppress the warning.
  warnings.warn(
C:\Users\Britod\.conda\envs\nlp\Lib\site-packages\sklearn\svm\_classes.py:32: FutureWarning: The default value of `dual` will change from `True` to `'auto'` in 1.5. Set the value of `dual` explicitly to suppress the warning.
  warnings.warn(
C:\Users\Britod\.conda\envs\nlp\Lib\site-packages\sklearn\svm\_classes.py:32: FutureWarning: The default value of `dual` will change from `True` to `'auto'` in 1.5. Set the value of `dual` explicitly to suppress the warning.
  warnings.warn(
C:\Users\Britod\.conda\envs\nlp\Lib\site-packages\sklearn\svm\_classes.py:32: FutureWarning: The default value of `dual` will change from `True` to `'auto'` in 1.5. Set the value of `dual` explicitly to suppress the warning.
  warnings.warn(
C:\Users\Britod\.conda\envs\nlp\Lib\site-packages\sklearn\svm\_classes.py:32: FutureWarning: The default value of `dual` will change from `True` to `'auto'` in 1.5. Set the value of `dual` explicitly to suppress the warning.
  warnings.warn(
C:\Users\Britod\.conda\envs\nlp\Lib\site-packages\sklearn\svm\_classes.py:32: FutureWarning: The default value of `dual` will change from `True` to `'auto'` in 1.5. Set the value of `dual` explicitly to suppress the warning.
  warnings.warn(
C:\Users\Britod\.conda\envs\nlp\Lib\site-packages\sklearn\svm\_classes.py:32: FutureWarning: The default value of `dual` will change from `True` to `'auto'` in 1.5. Set the value of `dual` explicitly to suppress the warning.
  warnings.warn(
C:\Users\Britod\.conda\envs\nlp\Lib\site-packages\sklearn\svm\_classes.py:32: FutureWarning: The default value of `dual` will change from `True` to `'auto'` in 1.5. Set the value of `dual` explicitly to suppress the warning.
  warnings.warn(
C:\Users\Britod\.conda\envs\nlp\Lib\site-packages\sklearn\svm\_classes.py:32: FutureWarning: The default value of `dual` will change from `True` to `'auto'` in 1.5. Set the value of `dual` explicitly to suppress the warning.
  warnings.warn(
C:\Users\Britod\.conda\envs\nlp\Lib\site-packages\sklearn\svm\_classes.py:32: FutureWarning: The default value of `dual` will change from `True` to `'auto'` in 1.5. Set the value of `dual` explicitly to suppress the warning.
  warnings.warn(
2026-06-20 20:45:08 | INFO | SVM | trial   3 | params={'C': 0.9846738873614566} | train_F1=0.9838 | val_CV_F1=0.9375
[I 2026-06-20 20:45:08,748] Trial 3 finished with value: 0.9375092987579752 and parameters: {'C': 0.9846738873614566}. Best is trial 2 with value: 0.9451084698063285.
C:\Users\Britod\.conda\envs\nlp\Lib\site-packages\sklearn\svm\_classes.py:32: FutureWarning: The default value of `dual` will change from `True` to `'auto'` in 1.5. Set the value of `dual` explicitly to suppress the warning.
  warnings.warn(
C:\Users\Britod\.conda\envs\nlp\Lib\site-packages\sklearn\svm\_classes.py:32: FutureWarning: The default value of `dual` will change from `True` to `'auto'` in 1.5. Set the value of `dual` explicitly to suppress the warning.
  warnings.warn(
C:\Users\Britod\.conda\envs\nlp\Lib\site-packages\sklearn\svm\_classes.py:32: FutureWarning: The default value of `dual` will change from `True` to `'auto'` in 1.5. Set the value of `dual` explicitly to suppress the warning.
  warnings.warn(
C:\Users\Britod\.conda\envs\nlp\Lib\site-packages\sklearn\svm\_classes.py:32: FutureWarning: The default value of `dual` will change from `True` to `'auto'` in 1.5. Set the value of `dual` explicitly to suppress the warning.
  warnings.warn(
C:\Users\Britod\.conda\envs\nlp\Lib\site-packages\sklearn\svm\_classes.py:32: FutureWarning: The default value of `dual` will change from `True` to `'auto'` in 1.5. Set the value of `dual` explicitly to suppress the warning.
  warnings.warn(
C:\Users\Britod\.conda\envs\nlp\Lib\site-packages\sklearn\svm\_classes.py:32: FutureWarning: The default value of `dual` will change from `True` to `'auto'` in 1.5. Set the value of `dual` explicitly to suppress the warning.
  warnings.warn(
C:\Users\Britod\.conda\envs\nlp\Lib\site-packages\sklearn\svm\_classes.py:32: FutureWarning: The default value of `dual` will change from `True` to `'auto'` in 1.5. Set the value of `dual` explicitly to suppress the warning.
  warnings.warn(
C:\Users\Britod\.conda\envs\nlp\Lib\site-packages\sklearn\svm\_classes.py:32: FutureWarning: The default value of `dual` will change from `True` to `'auto'` in 1.5. Set the value of `dual` explicitly to suppress the warning.
  warnings.warn(
C:\Users\Britod\.conda\envs\nlp\Lib\site-packages\sklearn\svm\_classes.py:32: FutureWarning: The default value of `dual` will change from `True` to `'auto'` in 1.5. Set the value of `dual` explicitly to suppress the warning.
  warnings.warn(
C:\Users\Britod\.conda\envs\nlp\Lib\site-packages\sklearn\svm\_classes.py:32: FutureWarning: The default value of `dual` will change from `True` to `'auto'` in 1.5. Set the value of `dual` explicitly to suppress the warning.
  warnings.warn(
C:\Users\Britod\.conda\envs\nlp\Lib\site-packages\sklearn\svm\_classes.py:32: FutureWarning: The default value of `dual` will change from `True` to `'auto'` in 1.5. Set the value of `dual` explicitly to suppress the warning.
  warnings.warn(
C:\Users\Britod\.conda\envs\nlp\Lib\site-packages\sklearn\svm\_classes.py:32: FutureWarning: The default value of `dual` will change from `True` to `'auto'` in 1.5. Set the value of `dual` explicitly to suppress the warning.
  warnings.warn(
2026-06-20 20:45:10 | INFO | SVM | trial   4 | params={'C': 0.006026889128682512} | train_F1=0.8176 | val_CV_F1=0.7925
