[I 2026-06-20 19:58:14,241] Trial 0 finished with value: 0.6914486168710096 and parameters: {'C': 0.0745934328572655}. Best is trial 0 with value: 0.6914486168710096.
C:\Users\Britod\.conda\envs\nlp\Lib\site-packages\sklearn\svm\_classes.py:32: FutureWarning: The default value of `dual` will change from `True` to `'auto'` in 1.5. Set the value of `dual` explicitly to suppress the warning.
  warnings.warn(
C:\Users\Britod\.conda\envs\nlp\Lib\site-packages\sklearn\svm\_classes.py:32: FutureWarning: The default value of `dual` will change from `True` to `'auto'` in 1.5. Set the value of `dual` explicitly to suppress the warning.
  warnings.warn(
C:\Users\Britod\.conda\envs\nlp\Lib\site-packages\sklearn\svm\_classes.py:32: FutureWarning: The default value of `dual` will change from `True` to `'auto'` in 1.5. Set the value of `dual` explicitly to suppress the warning.
  warnings.warn(
C:\Users\Britod\.conda\envs\nlp\Lib\site-packages\sklearn\svm\_classes.py:32: FutureWarning: The default value of `dual` will change from `True` to `'auto'` in 1.5. Set the value of `dual` explicitly to suppress the warning.
  warnings.warn(
C:\Users\Britod\.conda\envs\nlp\Lib\site-packages\sklearn\svm\_classes.py:32: FutureWarning: The default value of `dual` will change from `True` to `'auto'` in 1.5. Set the value of `dual` explicitly to suppress the warning.
  warnings.warn(
C:\Users\Britod\.conda\envs\nlp\Lib\site-packages\sklearn\svm\_classes.py:32: FutureWarning: The default value of `dual` will change from `True` to `'auto'` in 1.5. Set the value of `dual` explicitly to suppress the warning.
  warnings.warn(
C:\Users\Britod\.conda\envs\nlp\Lib\site-packages\sklearn\svm\_classes.py:32: FutureWarning: The default value of `dual` will change from `True` to `'auto'` in 1.5. Set the value of `dual` explicitly to suppress the warning.
  warnings.warn(
C:\Users\Britod\.conda\envs\nlp\Lib\site-packages\sklearn\svm\_classes.py:32: FutureWarning: The default value of `dual` will change from `True` to `'auto'` in 1.5. Set the value of `dual` explicitly to suppress the warning.
  warnings.warn(
C:\Users\Britod\.conda\envs\nlp\Lib\site-packages\sklearn\svm\_classes.py:32: FutureWarning: The default value of `dual` will change from `True` to `'auto'` in 1.5. Set the value of `dual` explicitly to suppress the warning.
  warnings.warn(
C:\Users\Britod\.conda\envs\nlp\Lib\site-packages\sklearn\svm\_base.py:1242: ConvergenceWarning: Liblinear failed to converge, increase the number of iterations.
  warnings.warn(
C:\Users\Britod\.conda\envs\nlp\Lib\site-packages\sklearn\svm\_classes.py:32: FutureWarning: The default value of `dual` will change from `True` to `'auto'` in 1.5. Set the value of `dual` explicitly to suppress the warning.
  warnings.warn(
C:\Users\Britod\.conda\envs\nlp\Lib\site-packages\sklearn\svm\_base.py:1242: ConvergenceWarning: Liblinear failed to converge, increase the number of iterations.
  warnings.warn(
C:\Users\Britod\.conda\envs\nlp\Lib\site-packages\sklearn\svm\_classes.py:32: FutureWarning: The default value of `dual` will change from `True` to `'auto'` in 1.5. Set the value of `dual` explicitly to suppress the warning.
  warnings.warn(
C:\Users\Britod\.conda\envs\nlp\Lib\site-packages\sklearn\svm\_base.py:1242: ConvergenceWarning: Liblinear failed to converge, increase the number of iterations.
  warnings.warn(
C:\Users\Britod\.conda\envs\nlp\Lib\site-packages\sklearn\svm\_classes.py:32: FutureWarning: The default value of `dual` will change from `True` to `'auto'` in 1.5. Set the value of `dual` explicitly to suppress the warning.
  warnings.warn(
C:\Users\Britod\.conda\envs\nlp\Lib\site-packages\sklearn\svm\_base.py:1242: ConvergenceWarning: Liblinear failed to converge, increase the number of iterations.
  warnings.warn(
2026-06-20 19:58:18 | INFO | SVM | trial   1 | params={'C': 56.69849511478853} | train_F1=0.9987 | val_CV_F1=0.6899
[I 2026-06-20 19:58:18,504] Trial 1 finished with value: 0.6899434326622588 and parameters: {'C': 56.69849511478853}. Best is trial 0 with value: 0.6914486168710096.
C:\Users\Britod\.conda\envs\nlp\Lib\site-packages\sklearn\svm\_classes.py:32: FutureWarning: The default value of `dual` will change from `True` to `'auto'` in 1.5. Set the value of `dual` explicitly to suppress the warning.
  warnings.warn(
C:\Users\Britod\.conda\envs\nlp\Lib\site-packages\sklearn\svm\_classes.py:32: FutureWarning: The default value of `dual` will change from `True` to `'auto'` in 1.5. Set the value of `dual` explicitly to suppress the warning.
  warnings.warn(
C:\Users\Britod\.conda\envs\nlp\Lib\site-packages\sklearn\svm\_classes.py:32: FutureWarning: The default value of `dual` will change from `True` to `'auto'` in 1.5. Set the value of `dual` explicitly to suppress the warning.
  warnings.warn(
C:\Users\Britod\.conda\envs\nlp\Lib\site-packages\sklearn\svm\_classes.py:32: FutureWarning: The default value of `dual` will change from `True` to `'auto'` in 1.5. Set the value of `dual` explicitly to suppress the warning.
  warnings.warn(
C:\Users\Britod\.conda\envs\nlp\Lib\site-packages\sklearn\svm\_classes.py:32: FutureWarning: The default value of `dual` will change from `True` to `'auto'` in 1.5. Set the value of `dual` explicitly to suppress the warning.
  warnings.warn(
C:\Users\Britod\.conda\envs\nlp\Lib\site-packages\sklearn\svm\_classes.py:32: FutureWarning: The default value of `dual` will change from `True` to `'auto'` in 1.5. Set the value of `dual` explicitly to suppress the warning.
  warnings.warn(
C:\Users\Britod\.conda\envs\nlp\Lib\site-packages\sklearn\svm\_classes.py:32: FutureWarning: The default value of `dual` will change from `True` to `'auto'` in 1.5. Set the value of `dual` explicitly to suppress the warning.
  warnings.warn(
C:\Users\Britod\.conda\envs\nlp\Lib\site-packages\sklearn\svm\_classes.py:32: FutureWarning: The default value of `dual` will change from `True` to `'auto'` in 1.5. Set the value of `dual` explicitly to suppress the warning.
  warnings.warn(
C:\Users\Britod\.conda\envs\nlp\Lib\site-packages\sklearn\svm\_classes.py:32: FutureWarning: The default value of `dual` will change from `True` to `'auto'` in 1.5. Set the value of `dual` explicitly to suppress the warning.
  warnings.warn(
C:\Users\Britod\.conda\envs\nlp\Lib\site-packages\sklearn\svm\_classes.py:32: FutureWarning: The default value of `dual` will change from `True` to `'auto'` in 1.5. Set the value of `dual` explicitly to suppress the warning.
  warnings.warn(
C:\Users\Britod\.conda\envs\nlp\Lib\site-packages\sklearn\svm\_classes.py:32: FutureWarning: The default value of `dual` will change from `True` to `'auto'` in 1.5. Set the value of `dual` explicitly to suppress the warning.
  warnings.warn(
C:\Users\Britod\.conda\envs\nlp\Lib\site-packages\sklearn\svm\_classes.py:32: FutureWarning: The default value of `dual` will change from `True` to `'auto'` in 1.5. Set the value of `dual` explicitly to suppress the warning.
  warnings.warn(
2026-06-20 19:58:19 | INFO | SVM | trial   2 | params={'C': 4.5705630998014515} | train_F1=0.9967 | val_CV_F1=0.6970
[I 2026-06-20 19:58:19,192] Trial 2 finished with value: 0.6970048185696514 and parameters: {'C': 4.5705630998014515}. Best is trial 2 with value: 0.6970048185696514.
C:\Users\Britod\.conda\envs\nlp\Lib\site-packages\sklearn\svm\_classes.py:32: FutureWarning: The default value of `dual` will change from `True` to `'auto'` in 1.5. Set the value of `dual` explicitly to suppress the warning.
  warnings.warn(
C:\Users\Britod\.conda\envs\nlp\Lib\site-packages\sklearn\svm\_classes.py:32: FutureWarning: The default value of `dual` will change from `True` to `'auto'` in 1.5. Set the value of `dual` explicitly to suppress the warning.
  warnings.warn(
C:\Users\Britod\.conda\envs\nlp\Lib\site-packages\sklearn\svm\_classes.py:32: FutureWarning: The default value of `dual` will change from `True` to `'auto'` in 1.5. Set the value of `dual` explicitly to suppress the warning.
  warnings.warn(
C:\Users\Britod\.conda\envs\nlp\Lib\site-packages\sklearn\svm\_classes.py:32: FutureWarning: The default value of `dual` will change from `True` to `'auto'` in 1.5. Set the value of `dual` explicitly to suppress the warning.
  warnings.warn(
C:\Users\Britod\.conda\envs\nlp\Lib\site-packages\sklearn\svm\_classes.py:32: FutureWarning: The default value of `dual` will change from `True` to `'auto'` in 1.5. Set the value of `dual` explicitly to suppress the warning.
  warnings.warn(
C:\Users\Britod\.conda\envs\nlp\Lib\site-packages\sklearn\svm\_classes.py:32: FutureWarning: The default value of `dual` will change from `True` to `'auto'` in 1.5. Set the value of `dual` explicitly to suppress the warning.
  warnings.warn(
C:\Users\Britod\.conda\envs\nlp\Lib\site-packages\sklearn\svm\_classes.py:32: FutureWarning: The default value of `dual` will change from `True` to `'auto'` in 1.5. Set the value of `dual` explicitly to suppress the warning.
  warnings.warn(
C:\Users\Britod\.conda\envs\nlp\Lib\site-packages\sklearn\svm\_classes.py:32: FutureWarning: The default value of `dual` will change from `True` to `'auto'` in 1.5. Set the value of `dual` explicitly to suppress the warning.
  warnings.warn(
C:\Users\Britod\.conda\envs\nlp\Lib\site-packages\sklearn\svm\_classes.py:32: FutureWarning: The default value of `dual` will change from `True` to `'auto'` in 1.5. Set the value of `dual` explicitly to suppress the warning.
  warnings.warn(
C:\Users\Britod\.conda\envs\nlp\Lib\site-packages\sklearn\svm\_classes.py:32: FutureWarning: The default value of `dual` will change from `True` to `'auto'` in 1.5. Set the value of `dual` explicitly to suppress the warning.
  warnings.warn(
C:\Users\Britod\.conda\envs\nlp\Lib\site-packages\sklearn\svm\_classes.py:32: FutureWarning: The default value of `dual` will change from `True` to `'auto'` in 1.5. Set the value of `dual` explicitly to suppress the warning.
  warnings.warn(
C:\Users\Britod\.conda\envs\nlp\Lib\site-packages\sklearn\svm\_classes.py:32: FutureWarning: The default value of `dual` will change from `True` to `'auto'` in 1.5. Set the value of `dual` explicitly to suppress the warning.
  warnings.warn(
2026-06-20 19:58:19 | INFO | SVM | trial   3 | params={'C': 0.9846738873614566} | train_F1=0.9768 | val_CV_F1=0.7038
[I 2026-06-20 19:58:19,541] Trial 3 finished with value: 0.7037811380460038 and parameters: {'C': 0.9846738873614566}. Best is trial 3 with value: 0.7037811380460038.
C:\Users\Britod\.conda\envs\nlp\Lib\site-packages\sklearn\svm\_classes.py:32: FutureWarning: The default value of `dual` will change from `True` to `'auto'` in 1.5. Set the value of `dual` explicitly to suppress the warning.
  warnings.warn(
C:\Users\Britod\.conda\envs\nlp\Lib\site-packages\sklearn\svm\_classes.py:32: FutureWarning: The default value of `dual` will change from `True` to `'auto'` in 1.5. Set the value of `dual` explicitly to suppress the warning.
  warnings.warn(
C:\Users\Britod\.conda\envs\nlp\Lib\site-packages\sklearn\svm\_classes.py:32: FutureWarning: The default value of `dual` will change from `True` to `'auto'` in 1.5. Set the value of `dual` explicitly to suppress the warning.
  warnings.warn(
C:\Users\Britod\.conda\envs\nlp\Lib\site-packages\sklearn\svm\_classes.py:32: FutureWarning: The default value of `dual` will change from `True` to `'auto'` in 1.5. Set the value of `dual` explicitly to suppress the warning.
  warnings.warn(
C:\Users\Britod\.conda\envs\nlp\Lib\site-packages\sklearn\svm\_classes.py:32: FutureWarning: The default value of `dual` will change from `True` to `'auto'` in 1.5. Set the value of `dual` explicitly to suppress the warning.
  warnings.warn(
C:\Users\Britod\.conda\envs\nlp\Lib\site-packages\sklearn\svm\_classes.py:32: FutureWarning: The default value of `dual` will change from `True` to `'auto'` in 1.5. Set the value of `dual` explicitly to suppress the warning.
  warnings.warn(
C:\Users\Britod\.conda\envs\nlp\Lib\site-packages\sklearn\svm\_classes.py:32: FutureWarning: The default value of `dual` will change from `True` to `'auto'` in 1.5. Set the value of `dual` explicitly to suppress the warning.
  warnings.warn(
C:\Users\Britod\.conda\envs\nlp\Lib\site-packages\sklearn\svm\_classes.py:32: FutureWarning: The default value of `dual` will change from `True` to `'auto'` in 1.5. Set the value of `dual` explicitly to suppress the warning.
  warnings.warn(
C:\Users\Britod\.conda\envs\nlp\Lib\site-packages\sklearn\svm\_classes.py:32: FutureWarning: The default value of `dual` will change from `True` to `'auto'` in 1.5. Set the value of `dual` explicitly to suppress the warning.
  warnings.warn(
C:\Users\Britod\.conda\envs\nlp\Lib\site-packages\sklearn\svm\_classes.py:32: FutureWarning: The default value of `dual` will change from `True` to `'auto'` in 1.5. Set the value of `dual` explicitly to suppress the warning.
  warnings.warn(
C:\Users\Britod\.conda\envs\nlp\Lib\site-packages\sklearn\svm\_classes.py:32: FutureWarning: The default value of `dual` will change from `True` to `'auto'` in 1.5. Set the value of `dual` explicitly to suppress the warning.
  warnings.warn(
C:\Users\Britod\.conda\envs\nlp\Lib\site-packages\sklearn\svm\_classes.py:32: FutureWarning: The default value of `dual` will change from `True` to `'auto'` in 1.5. Set the value of `dual` explicitly to suppress the warning.
  warnings.warn(
2026-06-20 19:58:19 | INFO | SVM | trial   4 | params={'C': 0.006026889128682512} | train_F1=0.7548 | val_CV_F1=0.6534
[I 2026-06-20 19:58:19,768] Trial 4 finished with value: 0.6533954209919436 and parameters: {'C': 0.006026889128682512}. Best is trial 3 with value: 0.7037811380460038.
C:\Users\Britod\.conda\envs\nlp\Lib\site-packages\sklearn\svm\_classes.py:32: FutureWarning: The default value of `dual` will change from `True` to `'auto'` in 1.5. Set the value of `dual` explicitly to suppress the warning.
  warnings.warn(
C:\Users\Britod\.conda\envs\nlp\Lib\site-packages\sklearn\svm\_classes.py:32: FutureWarning: The default value of `dual` will change from `True` to `'auto'` in 1.5. Set the value of `dual` explicitly to suppress the warning.
  warnings.warn(
C:\Users\Britod\.conda\envs\nlp\Lib\site-packages\sklearn\svm\_classes.py:32: FutureWarning: The default value of `dual` will change from `True` to `'auto'` in 1.5. Set the value of `dual` explicitly to suppress the warning.
  warnings.warn(
C:\Users\Britod\.conda\envs\nlp\Lib\site-packages\sklearn\svm\_classes.py:32: FutureWarning: The default value of `dual` will change from `True` to `'auto'` in 1.5. Set the value of `dual` explicitly to suppress the warning.
  warnings.warn(
C:\Users\Britod\.conda\envs\nlp\Lib\site-packages\sklearn\svm\_classes.py:32: FutureWarning: The default value of `dual` will change from `True` to `'auto'` in 1.5. Set the value of `dual` explicitly to suppress the warning.
  warnings.warn(
C:\Users\Britod\.conda\envs\nlp\Lib\site-packages\sklearn\svm\_classes.py:32: FutureWarning: The default value of `dual` will change from `True` to `'auto'` in 1.5. Set the value of `dual` explicitly to suppress the warning.
  warnings.warn(
C:\Users\Britod\.conda\envs\nlp\Lib\site-packages\sklearn\svm\_classes.py:32: FutureWarning: The default value of `dual` will change from `True` to `'auto'` in 1.5. Set the value of `dual` explicitly to suppress the warning.
  warnings.warn(
C:\Users\Britod\.conda\envs\nlp\Lib\site-packages\sklearn\svm\_classes.py:32: FutureWarning: The default value of `dual` will change from `True` to `'auto'` in 1.5. Set the value of `dual` explicitly to suppress the warning.
  warnings.warn(
C:\Users\Britod\.conda\envs\nlp\Lib\site-packages\sklearn\svm\_classes.py:32: FutureWarning: The default value of `dual` will change from `True` to `'auto'` in 1.5. Set the value of `dual` explicitly to suppress the warning.
  warnings.warn(
C:\Users\Britod\.conda\envs\nlp\Lib\site-packages\sklearn\svm\_classes.py:32: FutureWarning: The default value of `dual` will change from `True` to `'auto'` in 1.5. Set the value of `dual` explicitly to suppress the warning.
  warnings.warn(
C:\Users\Britod\.conda\envs\nlp\Lib\site-packages\sklearn\svm\_classes.py:32: FutureWarning: The default value of `dual` will change from `True` to `'auto'` in 1.5. Set the value of `dual` explicitly to suppress the warning.
  warnings.warn(
C:\Users\Britod\.conda\envs\nlp\Lib\site-packages\sklearn\svm\_classes.py:32: FutureWarning: The default value of `dual` will change from `True` to `'auto'` in 1.5. Set the value of `dual` explicitly to suppress the warning.
  warnings.warn(
2026-06-20 19:58:19 | INFO | SVM | trial   5 | params={'C': 0.0060252157362038605} | train_F1=0.7548 | val_CV_F1=0.6534
[I 2026-06-20 19:58:19,989] Trial 5 finished with value: 0.6533954209919436 and parameters: {'C': 0.0060252157362038605}. Best is trial 3 with value: 0.7037811380460038.
C:\Users\Britod\.conda\envs\nlp\Lib\site-packages\sklearn\svm\_classes.py:32: FutureWarning: The default value of `dual` will change from `True` to `'auto'` in 1.5. Set the value of `dual` explicitly to suppress the warning.
  warnings.warn(
C:\Users\Britod\.conda\envs\nlp\Lib\site-packages\sklearn\svm\_classes.py:32: FutureWarning: The default value of `dual` will change from `True` to `'auto'` in 1.5. Set the value of `dual` explicitly to suppress the warning.
  warnings.warn(
C:\Users\Britod\.conda\envs\nlp\Lib\site-packages\sklearn\svm\_classes.py:32: FutureWarning: The default value of `dual` will change from `True` to `'auto'` in 1.5. Set the value of `dual` explicitly to suppress the warning.
  warnings.warn(
C:\Users\Britod\.conda\envs\nlp\Lib\site-packages\sklearn\svm\_classes.py:32: FutureWarning: The default value of `dual` will change from `True` to `'auto'` in 1.5. Set the value of `dual` explicitly to suppress the warning.
  warnings.warn(
C:\Users\Britod\.conda\envs\nlp\Lib\site-packages\sklearn\svm\_classes.py:32: FutureWarning: The default value of `dual` will change from `True` to `'auto'` in 1.5. Set the value of `dual` explicitly to suppress the warning.
  warnings.warn(
C:\Users\Britod\.conda\envs\nlp\Lib\site-packages\sklearn\svm\_classes.py:32: FutureWarning: The default value of `dual` will change from `True` to `'auto'` in 1.5. Set the value of `dual` explicitly to suppress the warning.
  warnings.warn(
C:\Users\Britod\.conda\envs\nlp\Lib\site-packages\sklearn\svm\_classes.py:32: FutureWarning: The default value of `dual` will change from `True` to `'auto'` in 1.5. Set the value of `dual` explicitly to suppress the warning.
  warnings.warn(
C:\Users\Britod\.conda\envs\nlp\Lib\site-packages\sklearn\svm\_classes.py:32: FutureWarning: The default value of `dual` will change from `True` to `'auto'` in 1.5. Set the value of `dual` explicitly to suppress the warning.
  warnings.warn(
C:\Users\Britod\.conda\envs\nlp\Lib\site-packages\sklearn\svm\_classes.py:32: FutureWarning: The default value of `dual` will change from `True` to `'auto'` in 1.5. Set the value of `dual` explicitly to suppress the warning.
  warnings.warn(
C:\Users\Britod\.conda\envs\nlp\Lib\site-packages\sklearn\svm\_classes.py:32: FutureWarning: The default value of `dual` will change from `True` to `'auto'` in 1.5. Set the value of `dual` explicitly to suppress the warning.
  warnings.warn(
C:\Users\Britod\.conda\envs\nlp\Lib\site-packages\sklearn\svm\_classes.py:32: FutureWarning: The default value of `dual` will change from `True` to `'auto'` in 1.5. Set the value of `dual` explicitly to suppress the warning.
  warnings.warn(
C:\Users\Britod\.conda\envs\nlp\Lib\site-packages\sklearn\svm\_classes.py:32: FutureWarning: The default value of `dual` will change from `True` to `'auto'` in 1.5. Set the value of `dual` explicitly to suppress the warning.
  warnings.warn(
2026-06-20 19:58:20 | INFO | SVM | trial   6 | params={'C': 0.0019517224641449498} | train_F1=0.7450 | val_CV_F1=0.6379
