[I 2026-06-20 19:46:54,529] Trial 7 finished with value: 0.6807191841006066 and parameters: {'C': 21.42302175774105}. Best is trial 3 with value: 0.7149343371812168.
C:\Users\Britod\.conda\envs\nlp\Lib\site-packages\sklearn\svm\_classes.py:32: FutureWarning: The default value of `dual` will change from `True` to `'auto'` in 1.5. Set the value of `dual` explicitly to suppress the warning.
  warnings.warn(
C:\Users\Britod\.conda\envs\nlp\Lib\site-packages\sklearn\svm\_classes.py:32: FutureWarning: The default value of `dual` will change from `True` to `'auto'` in 1.5. Set the value of `dual` explicitly to suppress the warning.
  warnings.warn(
C:\Users\Britod\.conda\envs\nlp\Lib\site-packages\sklearn\svm\_classes.py:32: FutureWarning: The default value of `dual` will change from `True` to `'auto'` in 1.5. Set the value of `dual` explicitly to suppress the warning.
  warnings.warn(
C:\Users\Britod\.conda\envs\nlp\Lib\site-packages\sklearn\svm\_classes.py:32: FutureWarning: The default value of `dual` will change from `True` to `'auto'` in 1.5. Set the value of `dual` explicitly to suppress the warning.
  warnings.warn(
C:\Users\Britod\.conda\envs\nlp\Lib\site-packages\sklearn\svm\_classes.py:32: FutureWarning: The default value of `dual` will change from `True` to `'auto'` in 1.5. Set the value of `dual` explicitly to suppress the warning.
  warnings.warn(
C:\Users\Britod\.conda\envs\nlp\Lib\site-packages\sklearn\svm\_classes.py:32: FutureWarning: The default value of `dual` will change from `True` to `'auto'` in 1.5. Set the value of `dual` explicitly to suppress the warning.
  warnings.warn(
C:\Users\Britod\.conda\envs\nlp\Lib\site-packages\sklearn\svm\_classes.py:32: FutureWarning: The default value of `dual` will change from `True` to `'auto'` in 1.5. Set the value of `dual` explicitly to suppress the warning.
  warnings.warn(
C:\Users\Britod\.conda\envs\nlp\Lib\site-packages\sklearn\svm\_classes.py:32: FutureWarning: The default value of `dual` will change from `True` to `'auto'` in 1.5. Set the value of `dual` explicitly to suppress the warning.
  warnings.warn(
C:\Users\Britod\.conda\envs\nlp\Lib\site-packages\sklearn\svm\_classes.py:32: FutureWarning: The default value of `dual` will change from `True` to `'auto'` in 1.5. Set the value of `dual` explicitly to suppress the warning.
  warnings.warn(
C:\Users\Britod\.conda\envs\nlp\Lib\site-packages\sklearn\svm\_classes.py:32: FutureWarning: The default value of `dual` will change from `True` to `'auto'` in 1.5. Set the value of `dual` explicitly to suppress the warning.
  warnings.warn(
C:\Users\Britod\.conda\envs\nlp\Lib\site-packages\sklearn\svm\_classes.py:32: FutureWarning: The default value of `dual` will change from `True` to `'auto'` in 1.5. Set the value of `dual` explicitly to suppress the warning.
  warnings.warn(
C:\Users\Britod\.conda\envs\nlp\Lib\site-packages\sklearn\svm\_classes.py:32: FutureWarning: The default value of `dual` will change from `True` to `'auto'` in 1.5. Set the value of `dual` explicitly to suppress the warning.
  warnings.warn(
2026-06-20 19:46:56 | INFO | SVM | trial   8 | params={'C': 1.0129197956845732} | train_F1=0.8986 | val_CV_F1=0.7148
[I 2026-06-20 19:46:56,911] Trial 8 finished with value: 0.7147784580601394 and parameters: {'C': 1.0129197956845732}. Best is trial 3 with value: 0.7149343371812168.
C:\Users\Britod\.conda\envs\nlp\Lib\site-packages\sklearn\svm\_classes.py:32: FutureWarning: The default value of `dual` will change from `True` to `'auto'` in 1.5. Set the value of `dual` explicitly to suppress the warning.
  warnings.warn(
C:\Users\Britod\.conda\envs\nlp\Lib\site-packages\sklearn\svm\_classes.py:32: FutureWarning: The default value of `dual` will change from `True` to `'auto'` in 1.5. Set the value of `dual` explicitly to suppress the warning.
  warnings.warn(
C:\Users\Britod\.conda\envs\nlp\Lib\site-packages\sklearn\svm\_classes.py:32: FutureWarning: The default value of `dual` will change from `True` to `'auto'` in 1.5. Set the value of `dual` explicitly to suppress the warning.
  warnings.warn(
C:\Users\Britod\.conda\envs\nlp\Lib\site-packages\sklearn\svm\_classes.py:32: FutureWarning: The default value of `dual` will change from `True` to `'auto'` in 1.5. Set the value of `dual` explicitly to suppress the warning.
  warnings.warn(
C:\Users\Britod\.conda\envs\nlp\Lib\site-packages\sklearn\svm\_classes.py:32: FutureWarning: The default value of `dual` will change from `True` to `'auto'` in 1.5. Set the value of `dual` explicitly to suppress the warning.
  warnings.warn(
C:\Users\Britod\.conda\envs\nlp\Lib\site-packages\sklearn\svm\_classes.py:32: FutureWarning: The default value of `dual` will change from `True` to `'auto'` in 1.5. Set the value of `dual` explicitly to suppress the warning.
  warnings.warn(
C:\Users\Britod\.conda\envs\nlp\Lib\site-packages\sklearn\svm\_classes.py:32: FutureWarning: The default value of `dual` will change from `True` to `'auto'` in 1.5. Set the value of `dual` explicitly to suppress the warning.
  warnings.warn(
C:\Users\Britod\.conda\envs\nlp\Lib\site-packages\sklearn\svm\_classes.py:32: FutureWarning: The default value of `dual` will change from `True` to `'auto'` in 1.5. Set the value of `dual` explicitly to suppress the warning.
  warnings.warn(
C:\Users\Britod\.conda\envs\nlp\Lib\site-packages\sklearn\svm\_classes.py:32: FutureWarning: The default value of `dual` will change from `True` to `'auto'` in 1.5. Set the value of `dual` explicitly to suppress the warning.
  warnings.warn(
C:\Users\Britod\.conda\envs\nlp\Lib\site-packages\sklearn\svm\_classes.py:32: FutureWarning: The default value of `dual` will change from `True` to `'auto'` in 1.5. Set the value of `dual` explicitly to suppress the warning.
  warnings.warn(
C:\Users\Britod\.conda\envs\nlp\Lib\site-packages\sklearn\svm\_classes.py:32: FutureWarning: The default value of `dual` will change from `True` to `'auto'` in 1.5. Set the value of `dual` explicitly to suppress the warning.
  warnings.warn(
C:\Users\Britod\.conda\envs\nlp\Lib\site-packages\sklearn\svm\_classes.py:32: FutureWarning: The default value of `dual` will change from `True` to `'auto'` in 1.5. Set the value of `dual` explicitly to suppress the warning.
  warnings.warn(
2026-06-20 19:47:01 | INFO | SVM | trial   9 | params={'C': 3.4702669886504163} | train_F1=0.9406 | val_CV_F1=0.7023
[I 2026-06-20 19:47:01,418] Trial 9 finished with value: 0.7022608232480172 and parameters: {'C': 3.4702669886504163}. Best is trial 3 with value: 0.7149343371812168.
2026-06-20 19:47:01 | INFO | SVM BEST | params={'C': 0.9846738873614566} | val_CV_F1=0.7149
2026-06-20 19:47:01 | INFO | SVM: training final model with best params={'C': 0.9846738873614566}
C:\Users\Britod\.conda\envs\nlp\Lib\site-packages\sklearn\svm\_classes.py:32: FutureWarning: The default value of `dual` will change from `True` to `'auto'` in 1.5. Set the value of `dual` explicitly to suppress the warning.
  warnings.warn(
C:\Users\Britod\.conda\envs\nlp\Lib\site-packages\sklearn\svm\_classes.py:32: FutureWarning: The default value of `dual` will change from `True` to `'auto'` in 1.5. Set the value of `dual` explicitly to suppress the warning.
  warnings.warn(
C:\Users\Britod\.conda\envs\nlp\Lib\site-packages\sklearn\svm\_classes.py:32: FutureWarning: The default value of `dual` will change from `True` to `'auto'` in 1.5. Set the value of `dual` explicitly to suppress the warning.
  warnings.warn(
2026-06-20 19:47:02 | INFO | SVM | TRAIN | macro_F1=0.8973
2026-06-20 19:47:02 | INFO | SVM | TRAIN | classification report:
              precision    recall  f1-score   support

     Level 0       0.93      0.96      0.94      4688
     Level 1       0.90      0.93      0.91      4105
     Level 2       0.92      0.71      0.80      1364
     Level 3       0.92      0.94      0.93       378

    accuracy                           0.91     10535
   macro avg       0.92      0.89      0.90     10535
weighted avg       0.92      0.91      0.91     10535

2026-06-20 19:47:02 | INFO | SVM | TEST | macro_F1=0.7177
2026-06-20 19:47:02 | INFO | SVM | TEST | classification report:
              precision    recall  f1-score   support

     Level 0       0.85      0.89      0.87       586
     Level 1       0.76      0.82      0.79       513
     Level 2       0.65      0.39      0.48       171
     Level 3       0.78      0.68      0.73        47

    accuracy                           0.79      1317
   macro avg       0.76      0.70      0.72      1317
weighted avg       0.78      0.79      0.78      1317

2026-06-20 19:47:02 | INFO | SVM SUMMARY | best_params={'C': 0.9846738873614566}
2026-06-20 19:47:02 | INFO | Models saved to D:\projects\nlp-swear_words_detector\saved_models/
2026-06-20 19:47:02 | INFO | ============================================================
2026-06-20 19:47:02 | INFO | Complete. Log: D:\projects\nlp-swear_words_detector\logs\classical_no_resample.log
===== DONE  train_no_resample.py rc=0 19:47:03 =====
===== START train_random_oversample.py 19:47:03 =====
2026-06-20 19:47:05 | INFO | ============================================================
2026-06-20 19:47:05 | INFO | Strategy: random oversampling on raw text
2026-06-20 19:47:05 | INFO | Data loaded | train=18,752 (after oversampling) | test=2,634
2026-06-20 19:47:09 | INFO | ============================================================
2026-06-20 19:47:09 | INFO | LR: training start
2026-06-20 19:47:09 | INFO | LR: starting hyperparameter tuning (10 trials)
[I 2026-06-20 19:47:09,744] A new study created in memory with name: no-name-a49fd141-6138-4110-b738-09f2b0e1d809
2026-06-20 19:47:15 | INFO | LR | trial   0 | params={'C': 0.0745934328572655, 'solver': 'lbfgs'} | train_F1=0.8004 | val_CV_F1=0.7611
[I 2026-06-20 19:47:15,210] Trial 0 finished with value: 0.7611165506486636 and parameters: {'C': 0.0745934328572655, 'solver': 'lbfgs'}. Best is trial 0 with value: 0.7611165506486636.
2026-06-20 19:47:25 | INFO | LR | trial   1 | params={'C': 0.9846738873614566, 'solver': 'lbfgs'} | train_F1=0.9233 | val_CV_F1=0.8617
[I 2026-06-20 19:47:25,809] Trial 1 finished with value: 0.8617015545151601 and parameters: {'C': 0.9846738873614566, 'solver': 'lbfgs'}. Best is trial 1 with value: 0.8617015545151601.
2026-06-20 19:47:27 | INFO | LR | trial   2 | params={'C': 0.0019517224641449498, 'solver': 'lbfgs'} | train_F1=0.6538 | val_CV_F1=0.6377
[I 2026-06-20 19:47:27,664] Trial 2 finished with value: 0.6377178490372631 and parameters: {'C': 0.0019517224641449498, 'solver': 'lbfgs'}. Best is trial 1 with value: 0.8617015545151601.
2026-06-20 19:47:50 | INFO | LR | trial   3 | params={'C': 3.4702669886504163, 'solver': 'saga'} | train_F1=0.9661 | val_CV_F1=0.8962
[I 2026-06-20 19:47:50,999] Trial 3 finished with value: 0.8961837084361955 and parameters: {'C': 3.4702669886504163, 'solver': 'saga'}. Best is trial 3 with value: 0.8961837084361955.
2026-06-20 19:48:16 | INFO | LR | trial   4 | params={'C': 14.528246637516036, 'solver': 'lbfgs'} | train_F1=0.9887 | val_CV_F1=0.9132
[I 2026-06-20 19:48:16,193] Trial 4 finished with value: 0.9132235286423763 and parameters: {'C': 14.528246637516036, 'solver': 'lbfgs'}. Best is trial 4 with value: 0.9132235286423763.
2026-06-20 19:48:19 | INFO | LR | trial   5 | params={'C': 0.008260808399079604, 'solver': 'saga'} | train_F1=0.6959 | val_CV_F1=0.6680
[I 2026-06-20 19:48:19,787] Trial 5 finished with value: 0.6679605191980497 and parameters: {'C': 0.008260808399079604, 'solver': 'saga'}. Best is trial 4 with value: 0.9132235286423763.
2026-06-20 19:48:22 | INFO | LR | trial   6 | params={'C': 0.14445251022763064, 'solver': 'saga'} | train_F1=0.8344 | val_CV_F1=0.7905
[I 2026-06-20 19:48:22,661] Trial 6 finished with value: 0.7904722390203354 and parameters: {'C': 0.14445251022763064, 'solver': 'saga'}. Best is trial 4 with value: 0.9132235286423763.
2026-06-20 19:48:25 | INFO | LR | trial   7 | params={'C': 0.004982752357076452, 'solver': 'saga'} | train_F1=0.6761 | val_CV_F1=0.6533
[I 2026-06-20 19:48:25,654] Trial 7 finished with value: 0.6533496046567105 and parameters: {'C': 0.004982752357076452, 'solver': 'saga'}. Best is trial 4 with value: 0.9132235286423763.
2026-06-20 19:48:31 | INFO | LR | trial   8 | params={'C': 0.19069966103000435, 'solver': 'lbfgs'} | train_F1=0.8496 | val_CV_F1=0.8014
[I 2026-06-20 19:48:31,725] Trial 8 finished with value: 0.8014293196642011 and parameters: {'C': 0.19069966103000435, 'solver': 'lbfgs'}. Best is trial 4 with value: 0.9132235286423763.
2026-06-20 19:48:39 | INFO | LR | trial   9 | params={'C': 0.37253938395788866, 'solver': 'lbfgs'} | train_F1=0.8805 | val_CV_F1=0.8307
[I 2026-06-20 19:48:39,218] Trial 9 finished with value: 0.8307155496015808 and parameters: {'C': 0.37253938395788866, 'solver': 'lbfgs'}. Best is trial 4 with value: 0.9132235286423763.
2026-06-20 19:48:39 | INFO | LR BEST | params={'C': 14.528246637516036, 'solver': 'lbfgs'} | val_CV_F1=0.9132
2026-06-20 19:48:39 | INFO | LR: training final model with best params={'C': 14.528246637516036, 'solver': 'lbfgs'}
2026-06-20 19:48:53 | INFO | LR | TRAIN | macro_F1=0.9887
2026-06-20 19:48:53 | INFO | LR | TRAIN | classification report:
              precision    recall  f1-score   support

     Level 0       0.99      0.98      0.99      4688
     Level 1       0.98      0.98      0.98      4688
     Level 2       0.98      0.99      0.99      4688
     Level 3       1.00      1.00      1.00      4688

    accuracy                           0.99     18752
   macro avg       0.99      0.99      0.99     18752
weighted avg       0.99      0.99      0.99     18752

2026-06-20 19:48:53 | INFO | LR | TEST | macro_F1=0.7101
2026-06-20 19:48:53 | INFO | LR | TEST | classification report:
              precision    recall  f1-score   support

     Level 0       0.84      0.87      0.86      1172
     Level 1       0.80      0.73      0.76      1026
     Level 2       0.49      0.56      0.52       341
     Level 3       0.68      0.73      0.70        95

    accuracy                           0.77      2634
   macro avg       0.70      0.72      0.71      2634
weighted avg       0.77      0.77      0.77      2634

2026-06-20 19:48:53 | INFO | LR SUMMARY | best_params={'C': 14.528246637516036, 'solver': 'lbfgs'}
2026-06-20 19:48:53 | INFO | ============================================================
2026-06-20 19:48:53 | INFO | NB: training start
2026-06-20 19:48:53 | INFO | NB: starting hyperparameter tuning (10 trials)
[I 2026-06-20 19:48:53,362] A new study created in memory with name: no-name-f67a5a02-5e06-4a41-9c34-7a452f520593
2026-06-20 19:48:53 | INFO | NB | trial   0 | params={'alpha': 0.03148911647956861, 'norm': True} | train_F1=0.5881 | val_CV_F1=0.5590
[I 2026-06-20 19:48:53,801] Trial 0 finished with value: 0.5589733927310411 and parameters: {'alpha': 0.03148911647956861, 'norm': True}. Best is trial 0 with value: 0.5589733927310411.
2026-06-20 19:48:54 | INFO | NB | trial   1 | params={'alpha': 0.24810409748678125, 'norm': True} | train_F1=0.7104 | val_CV_F1=0.6841
[I 2026-06-20 19:48:54,228] Trial 1 finished with value: 0.6840667971514326 and parameters: {'alpha': 0.24810409748678125, 'norm': True}. Best is trial 1 with value: 0.6840667971514326.
2026-06-20 19:48:54 | INFO | NB | trial   2 | params={'alpha': 0.0017073967431528124, 'norm': True} | train_F1=0.4603 | val_CV_F1=0.4276
[I 2026-06-20 19:48:54,656] Trial 2 finished with value: 0.4275771874879344 and parameters: {'alpha': 0.0017073967431528124, 'norm': True}. Best is trial 1 with value: 0.6840667971514326.
2026-06-20 19:48:55 | INFO | NB | trial   3 | params={'alpha': 0.679657809075816, 'norm': False} | train_F1=0.8084 | val_CV_F1=0.7641
[I 2026-06-20 19:48:55,080] Trial 3 finished with value: 0.7641027353009014 and parameters: {'alpha': 0.679657809075816, 'norm': False}. Best is trial 3 with value: 0.7641027353009014.
2026-06-20 19:48:55 | INFO | NB | trial   4 | params={'alpha': 2.1368329072358767, 'norm': True} | train_F1=0.7440 | val_CV_F1=0.7123
[I 2026-06-20 19:48:55,501] Trial 4 finished with value: 0.7123137815537414 and parameters: {'alpha': 2.1368329072358767, 'norm': True}. Best is trial 3 with value: 0.7641027353009014.
2026-06-20 19:48:55 | INFO | NB | trial   5 | params={'alpha': 0.00541524411940254, 'norm': False} | train_F1=0.8641 | val_CV_F1=0.8078
[I 2026-06-20 19:48:55,924] Trial 5 finished with value: 0.807839825522875 and parameters: {'alpha': 0.00541524411940254, 'norm': False}. Best is trial 5 with value: 0.807839825522875.
2026-06-20 19:48:56 | INFO | NB | trial   6 | params={'alpha': 0.05342937261279776, 'norm': False} | train_F1=0.8502 | val_CV_F1=0.8009
[I 2026-06-20 19:48:56,345] Trial 6 finished with value: 0.8008935879736084 and parameters: {'alpha': 0.05342937261279776, 'norm': False}. Best is trial 5 with value: 0.807839825522875.
2026-06-20 19:48:56 | INFO | NB | trial   7 | params={'alpha': 0.003613894271216527, 'norm': False} | train_F1=0.8650 | val_CV_F1=0.8089
[I 2026-06-20 19:48:56,769] Trial 7 finished with value: 0.8089379235765293 and parameters: {'alpha': 0.003613894271216527, 'norm': False}. Best is trial 7 with value: 0.8089379235765293.
2026-06-20 19:48:57 | INFO | NB | trial   8 | params={'alpha': 0.06672367170464207, 'norm': True} | train_F1=0.6290 | val_CV_F1=0.6067
[I 2026-06-20 19:48:57,096] Trial 8 finished with value: 0.6066939587822728 and parameters: {'alpha': 0.06672367170464207, 'norm': True}. Best is trial 7 with value: 0.8089379235765293.
2026-06-20 19:48:57 | INFO | NB | trial   9 | params={'alpha': 0.11400863701127326, 'norm': True} | train_F1=0.6662 | val_CV_F1=0.6440
