[I 2026-06-20 19:57:23,653] Trial 8 finished with value: 0.8889727325096509 and parameters: {'C': 1.0129197956845732}. Best is trial 7 with value: 0.9023071282137177.
C:\Users\Britod\.conda\envs\nlp\Lib\site-packages\sklearn\svm\_classes.py:32: FutureWarning: The default value of `dual` will change from `True` to `'auto'` in 1.5. Set the value of `dual` explicitly to suppress the warning.
  warnings.warn(
C:\Users\Britod\.conda\envs\nlp\Lib\site-packages\sklearn\svm\_classes.py:32: FutureWarning: The default value of `dual` will change from `True` to `'auto'` in 1.5. Set the value of `dual` explicitly to suppress the warning.
  warnings.warn(
C:\Users\Britod\.conda\envs\nlp\Lib\site-packages\sklearn\svm\_classes.py:32: FutureWarning: The default value of `dual` will change from `True` to `'auto'` in 1.5. Set the value of `dual` explicitly to suppress the warning.
  warnings.warn(
C:\Users\Britod\.conda\envs\nlp\Lib\site-packages\sklearn\svm\_classes.py:32: FutureWarning: The default value of `dual` will change from `True` to `'auto'` in 1.5. Set the value of `dual` explicitly to suppress the warning.
  warnings.warn(
C:\Users\Britod\.conda\envs\nlp\Lib\site-packages\sklearn\svm\_classes.py:32: FutureWarning: The default value of `dual` will change from `True` to `'auto'` in 1.5. Set the value of `dual` explicitly to suppress the warning.
  warnings.warn(
C:\Users\Britod\.conda\envs\nlp\Lib\site-packages\sklearn\svm\_classes.py:32: FutureWarning: The default value of `dual` will change from `True` to `'auto'` in 1.5. Set the value of `dual` explicitly to suppress the warning.
  warnings.warn(
C:\Users\Britod\.conda\envs\nlp\Lib\site-packages\sklearn\svm\_classes.py:32: FutureWarning: The default value of `dual` will change from `True` to `'auto'` in 1.5. Set the value of `dual` explicitly to suppress the warning.
  warnings.warn(
C:\Users\Britod\.conda\envs\nlp\Lib\site-packages\sklearn\svm\_classes.py:32: FutureWarning: The default value of `dual` will change from `True` to `'auto'` in 1.5. Set the value of `dual` explicitly to suppress the warning.
  warnings.warn(
C:\Users\Britod\.conda\envs\nlp\Lib\site-packages\sklearn\svm\_classes.py:32: FutureWarning: The default value of `dual` will change from `True` to `'auto'` in 1.5. Set the value of `dual` explicitly to suppress the warning.
  warnings.warn(
C:\Users\Britod\.conda\envs\nlp\Lib\site-packages\sklearn\svm\_classes.py:32: FutureWarning: The default value of `dual` will change from `True` to `'auto'` in 1.5. Set the value of `dual` explicitly to suppress the warning.
  warnings.warn(
C:\Users\Britod\.conda\envs\nlp\Lib\site-packages\sklearn\svm\_classes.py:32: FutureWarning: The default value of `dual` will change from `True` to `'auto'` in 1.5. Set the value of `dual` explicitly to suppress the warning.
  warnings.warn(
C:\Users\Britod\.conda\envs\nlp\Lib\site-packages\sklearn\svm\_classes.py:32: FutureWarning: The default value of `dual` will change from `True` to `'auto'` in 1.5. Set the value of `dual` explicitly to suppress the warning.
  warnings.warn(
2026-06-20 19:57:31 | INFO | SVM | trial   9 | params={'C': 3.4702669886504163} | train_F1=0.9830 | val_CV_F1=0.8983
[I 2026-06-20 19:57:31,810] Trial 9 finished with value: 0.8982738330843363 and parameters: {'C': 3.4702669886504163}. Best is trial 7 with value: 0.9023071282137177.
2026-06-20 19:57:31 | INFO | SVM BEST | params={'C': 21.42302175774105} | val_CV_F1=0.9023
2026-06-20 19:57:31 | INFO | SVM: training final model with best params={'C': 21.42302175774105}
C:\Users\Britod\.conda\envs\nlp\Lib\site-packages\sklearn\svm\_classes.py:32: FutureWarning: The default value of `dual` will change from `True` to `'auto'` in 1.5. Set the value of `dual` explicitly to suppress the warning.
  warnings.warn(
C:\Users\Britod\.conda\envs\nlp\Lib\site-packages\sklearn\svm\_classes.py:32: FutureWarning: The default value of `dual` will change from `True` to `'auto'` in 1.5. Set the value of `dual` explicitly to suppress the warning.
  warnings.warn(
C:\Users\Britod\.conda\envs\nlp\Lib\site-packages\sklearn\svm\_classes.py:32: FutureWarning: The default value of `dual` will change from `True` to `'auto'` in 1.5. Set the value of `dual` explicitly to suppress the warning.
  warnings.warn(
2026-06-20 19:57:50 | INFO | SVM | TRAIN | macro_F1=0.9955
2026-06-20 19:57:50 | INFO | SVM | TRAIN | classification report:
              precision    recall  f1-score   support

     Level 0       0.99      0.99      0.99      4688
     Level 1       0.99      0.99      0.99      4688
     Level 2       1.00      1.00      1.00      4688
     Level 3       1.00      1.00      1.00      4688

    accuracy                           1.00     18752
   macro avg       1.00      1.00      1.00     18752
weighted avg       1.00      1.00      1.00     18752

2026-06-20 19:57:50 | INFO | SVM | TEST | macro_F1=0.7015
2026-06-20 19:57:50 | INFO | SVM | TEST | classification report:
              precision    recall  f1-score   support

     Level 0       0.81      0.87      0.84       586
     Level 1       0.77      0.76      0.77       513
     Level 2       0.52      0.44      0.48       171
     Level 3       0.79      0.66      0.72        47

    accuracy                           0.76      1317
   macro avg       0.72      0.68      0.70      1317
weighted avg       0.76      0.76      0.76      1317

2026-06-20 19:57:50 | INFO | SVM SUMMARY | best_params={'C': 21.42302175774105}
2026-06-20 19:57:50 | INFO | Models saved to D:\projects\nlp-swear_words_detector\saved_models/
2026-06-20 19:57:50 | INFO | ============================================================
2026-06-20 19:57:50 | INFO | Complete. Log: D:\projects\nlp-swear_words_detector\logs\classical_smote.log
===== DONE  train_smote.py rc=0 19:57:51 =====
===== START train_undersample.py 19:57:51 =====
2026-06-20 19:57:53 | INFO | ============================================================
2026-06-20 19:57:53 | INFO | Strategy: random undersampling on TF-IDF features
Regenerating BERT input:   0%|          | 0/13169 [00:00<?, ?it/s]Regenerating BERT input:  44%|####4     | 5845/13169 [00:00<00:00, 58156.93it/s]Regenerating BERT input:  89%|########8 | 11661/13169 [00:00<00:00, 58066.04it/s]Regenerating BERT input: 100%|##########| 13169/13169 [00:00<00:00, 57815.50it/s]
2026-06-20 19:57:54 | INFO | Data loaded | train=10,535 | val=1,317 | test=1,317
2026-06-20 19:57:56 | INFO | Undersampling applied | total=1,512
2026-06-20 19:57:56 | INFO | Undersampling applied | total=1,512
2026-06-20 19:57:56 | INFO | ============================================================
2026-06-20 19:57:56 | INFO | LR: training start
2026-06-20 19:57:56 | INFO | LR: starting hyperparameter tuning (10 trials)
[I 2026-06-20 19:57:56,827] A new study created in memory with name: no-name-63e466b1-70b4-48ab-a183-a03d0d4bad78
2026-06-20 19:57:58 | INFO | LR | trial   0 | params={'C': 0.0745934328572655, 'solver': 'lbfgs'} | train_F1=0.7707 | val_CV_F1=0.6489
[I 2026-06-20 19:57:58,600] Trial 0 finished with value: 0.6489212656805942 and parameters: {'C': 0.0745934328572655, 'solver': 'lbfgs'}. Best is trial 0 with value: 0.6489212656805942.
2026-06-20 19:58:00 | INFO | LR | trial   1 | params={'C': 0.9846738873614566, 'solver': 'lbfgs'} | train_F1=0.9086 | val_CV_F1=0.7025
[I 2026-06-20 19:58:00,925] Trial 1 finished with value: 0.7024703677639613 and parameters: {'C': 0.9846738873614566, 'solver': 'lbfgs'}. Best is trial 1 with value: 0.7024703677639613.
2026-06-20 19:58:01 | INFO | LR | trial   2 | params={'C': 0.0019517224641449498, 'solver': 'lbfgs'} | train_F1=0.7243 | val_CV_F1=0.6350
[I 2026-06-20 19:58:01,976] Trial 2 finished with value: 0.6349684225661166 and parameters: {'C': 0.0019517224641449498, 'solver': 'lbfgs'}. Best is trial 1 with value: 0.7024703677639613.
2026-06-20 19:58:04 | INFO | LR | trial   3 | params={'C': 3.4702669886504163, 'solver': 'saga'} | train_F1=0.9696 | val_CV_F1=0.7090
[I 2026-06-20 19:58:04,210] Trial 3 finished with value: 0.7090124393613398 and parameters: {'C': 3.4702669886504163, 'solver': 'saga'}. Best is trial 3 with value: 0.7090124393613398.
2026-06-20 19:58:08 | INFO | LR | trial   4 | params={'C': 14.528246637516036, 'solver': 'lbfgs'} | train_F1=0.9967 | val_CV_F1=0.6971
[I 2026-06-20 19:58:08,169] Trial 4 finished with value: 0.6971183404869775 and parameters: {'C': 14.528246637516036, 'solver': 'lbfgs'}. Best is trial 3 with value: 0.7090124393613398.
2026-06-20 19:58:09 | INFO | LR | trial   5 | params={'C': 0.008260808399079604, 'solver': 'saga'} | train_F1=0.7334 | val_CV_F1=0.6488
[I 2026-06-20 19:58:09,180] Trial 5 finished with value: 0.6488401610432512 and parameters: {'C': 0.008260808399079604, 'solver': 'saga'}. Best is trial 3 with value: 0.7090124393613398.
2026-06-20 19:58:09 | INFO | LR | trial   6 | params={'C': 0.14445251022763064, 'solver': 'saga'} | train_F1=0.7932 | val_CV_F1=0.6641
[I 2026-06-20 19:58:09,520] Trial 6 finished with value: 0.6640611230352839 and parameters: {'C': 0.14445251022763064, 'solver': 'saga'}. Best is trial 3 with value: 0.7090124393613398.
2026-06-20 19:58:09 | INFO | LR | trial   7 | params={'C': 0.004982752357076452, 'solver': 'saga'} | train_F1=0.7326 | val_CV_F1=0.6557
[I 2026-06-20 19:58:09,897] Trial 7 finished with value: 0.6556772323232115 and parameters: {'C': 0.004982752357076452, 'solver': 'saga'}. Best is trial 3 with value: 0.7090124393613398.
2026-06-20 19:58:10 | INFO | LR | trial   8 | params={'C': 0.19069966103000435, 'solver': 'lbfgs'} | train_F1=0.8060 | val_CV_F1=0.6686
[I 2026-06-20 19:58:10,745] Trial 8 finished with value: 0.6686453065058716 and parameters: {'C': 0.19069966103000435, 'solver': 'lbfgs'}. Best is trial 3 with value: 0.7090124393613398.
2026-06-20 19:58:11 | INFO | LR | trial   9 | params={'C': 0.37253938395788866, 'solver': 'lbfgs'} | train_F1=0.8453 | val_CV_F1=0.6902
[I 2026-06-20 19:58:11,849] Trial 9 finished with value: 0.6901533719093221 and parameters: {'C': 0.37253938395788866, 'solver': 'lbfgs'}. Best is trial 3 with value: 0.7090124393613398.
2026-06-20 19:58:11 | INFO | LR BEST | params={'C': 3.4702669886504163, 'solver': 'saga'} | val_CV_F1=0.7090
2026-06-20 19:58:11 | INFO | LR: training final model with best params={'C': 3.4702669886504163, 'solver': 'saga'}
2026-06-20 19:58:12 | INFO | LR | TRAIN | macro_F1=0.9696
2026-06-20 19:58:12 | INFO | LR | TRAIN | classification report:
              precision    recall  f1-score   support

     Level 0       0.99      0.97      0.98       378
     Level 1       0.95      0.97      0.96       378
     Level 2       0.97      0.96      0.97       378
     Level 3       0.97      0.98      0.97       378

    accuracy                           0.97      1512
   macro avg       0.97      0.97      0.97      1512
weighted avg       0.97      0.97      0.97      1512

2026-06-20 19:58:12 | INFO | LR | TEST | macro_F1=0.6480
2026-06-20 19:58:12 | INFO | LR | TEST | classification report:
              precision    recall  f1-score   support

     Level 0       0.84      0.76      0.80       586
     Level 1       0.74      0.65      0.69       513
     Level 2       0.39      0.56      0.46       171
     Level 3       0.49      0.89      0.64        47

    accuracy                           0.70      1317
   macro avg       0.62      0.72      0.65      1317
weighted avg       0.73      0.70      0.71      1317

2026-06-20 19:58:12 | INFO | LR SUMMARY | best_params={'C': 3.4702669886504163, 'solver': 'saga'}
2026-06-20 19:58:12 | INFO | ============================================================
2026-06-20 19:58:12 | INFO | NB: training start
2026-06-20 19:58:12 | INFO | NB: starting hyperparameter tuning (10 trials)
[I 2026-06-20 19:58:12,645] A new study created in memory with name: no-name-cf686f63-5771-4497-891e-f8f436c82005
2026-06-20 19:58:12 | INFO | NB | trial   0 | params={'alpha': 0.03148911647956861, 'norm': True} | train_F1=0.8977 | val_CV_F1=0.6135
[I 2026-06-20 19:58:12,784] Trial 0 finished with value: 0.6134516542489233 and parameters: {'alpha': 0.03148911647956861, 'norm': True}. Best is trial 0 with value: 0.6134516542489233.
2026-06-20 19:58:12 | INFO | NB | trial   1 | params={'alpha': 0.24810409748678125, 'norm': True} | train_F1=0.8633 | val_CV_F1=0.6481
[I 2026-06-20 19:58:12,919] Trial 1 finished with value: 0.6480842121883429 and parameters: {'alpha': 0.24810409748678125, 'norm': True}. Best is trial 1 with value: 0.6480842121883429.
2026-06-20 19:58:13 | INFO | NB | trial   2 | params={'alpha': 0.0017073967431528124, 'norm': True} | train_F1=0.8859 | val_CV_F1=0.5395
[I 2026-06-20 19:58:13,052] Trial 2 finished with value: 0.5395125692618382 and parameters: {'alpha': 0.0017073967431528124, 'norm': True}. Best is trial 1 with value: 0.6480842121883429.
2026-06-20 19:58:13 | INFO | NB | trial   3 | params={'alpha': 0.679657809075816, 'norm': False} | train_F1=0.8377 | val_CV_F1=0.6619
[I 2026-06-20 19:58:13,186] Trial 3 finished with value: 0.6619273576497388 and parameters: {'alpha': 0.679657809075816, 'norm': False}. Best is trial 3 with value: 0.6619273576497388.
2026-06-20 19:58:13 | INFO | NB | trial   4 | params={'alpha': 2.1368329072358767, 'norm': True} | train_F1=0.7881 | val_CV_F1=0.6453
[I 2026-06-20 19:58:13,321] Trial 4 finished with value: 0.645251002890639 and parameters: {'alpha': 2.1368329072358767, 'norm': True}. Best is trial 3 with value: 0.6619273576497388.
2026-06-20 19:58:13 | INFO | NB | trial   5 | params={'alpha': 0.00541524411940254, 'norm': False} | train_F1=0.9313 | val_CV_F1=0.6453
[I 2026-06-20 19:58:13,455] Trial 5 finished with value: 0.645331202722978 and parameters: {'alpha': 0.00541524411940254, 'norm': False}. Best is trial 3 with value: 0.6619273576497388.
2026-06-20 19:58:13 | INFO | NB | trial   6 | params={'alpha': 0.05342937261279776, 'norm': False} | train_F1=0.9135 | val_CV_F1=0.6597
[I 2026-06-20 19:58:13,588] Trial 6 finished with value: 0.6597466098448684 and parameters: {'alpha': 0.05342937261279776, 'norm': False}. Best is trial 3 with value: 0.6619273576497388.
2026-06-20 19:58:13 | INFO | NB | trial   7 | params={'alpha': 0.003613894271216527, 'norm': False} | train_F1=0.9339 | val_CV_F1=0.6329
[I 2026-06-20 19:58:13,720] Trial 7 finished with value: 0.6328953777590717 and parameters: {'alpha': 0.003613894271216527, 'norm': False}. Best is trial 3 with value: 0.6619273576497388.
2026-06-20 19:58:13 | INFO | NB | trial   8 | params={'alpha': 0.06672367170464207, 'norm': True} | train_F1=0.8963 | val_CV_F1=0.6314
[I 2026-06-20 19:58:13,851] Trial 8 finished with value: 0.631399962641278 and parameters: {'alpha': 0.06672367170464207, 'norm': True}. Best is trial 3 with value: 0.6619273576497388.
2026-06-20 19:58:13 | INFO | NB | trial   9 | params={'alpha': 0.11400863701127326, 'norm': True} | train_F1=0.8818 | val_CV_F1=0.6391
[I 2026-06-20 19:58:13,984] Trial 9 finished with value: 0.6391350541752093 and parameters: {'alpha': 0.11400863701127326, 'norm': True}. Best is trial 3 with value: 0.6619273576497388.
2026-06-20 19:58:13 | INFO | NB BEST | params={'alpha': 0.679657809075816, 'norm': False} | val_CV_F1=0.6619
2026-06-20 19:58:13 | INFO | NB: training final model with best params={'alpha': 0.679657809075816, 'norm': False}
2026-06-20 19:58:13 | INFO | NB | TRAIN | macro_F1=0.8377
2026-06-20 19:58:13 | INFO | NB | TRAIN | classification report:
              precision    recall  f1-score   support

     Level 0       0.92      0.83      0.87       378
     Level 1       0.87      0.82      0.84       378
     Level 2       0.88      0.75      0.81       378
     Level 3       0.73      0.95      0.83       378

    accuracy                           0.84      1512
   macro avg       0.85      0.84      0.84      1512
weighted avg       0.85      0.84      0.84      1512

2026-06-20 19:58:13 | INFO | NB | TEST | macro_F1=0.5309
2026-06-20 19:58:13 | INFO | NB | TEST | classification report:
              precision    recall  f1-score   support

     Level 0       0.86      0.67      0.75       586
     Level 1       0.76      0.58      0.66       513
     Level 2       0.36      0.46      0.40       171
     Level 3       0.19      0.96      0.31        47

    accuracy                           0.62      1317
   macro avg       0.54      0.67      0.53      1317
weighted avg       0.73      0.62      0.65      1317

2026-06-20 19:58:13 | INFO | NB SUMMARY | best_params={'alpha': 0.679657809075816, 'norm': False}
2026-06-20 19:58:13 | INFO | ============================================================
2026-06-20 19:58:13 | INFO | SVM: training start
2026-06-20 19:58:13 | INFO | SVM: starting hyperparameter tuning (10 trials)
[I 2026-06-20 19:58:13,999] A new study created in memory with name: no-name-1913ed45-307c-4278-8451-2366e8128309
C:\Users\Britod\.conda\envs\nlp\Lib\site-packages\sklearn\svm\_classes.py:32: FutureWarning: The default value of `dual` will change from `True` to `'auto'` in 1.5. Set the value of `dual` explicitly to suppress the warning.
  warnings.warn(
C:\Users\Britod\.conda\envs\nlp\Lib\site-packages\sklearn\svm\_classes.py:32: FutureWarning: The default value of `dual` will change from `True` to `'auto'` in 1.5. Set the value of `dual` explicitly to suppress the warning.
  warnings.warn(
C:\Users\Britod\.conda\envs\nlp\Lib\site-packages\sklearn\svm\_classes.py:32: FutureWarning: The default value of `dual` will change from `True` to `'auto'` in 1.5. Set the value of `dual` explicitly to suppress the warning.
  warnings.warn(
C:\Users\Britod\.conda\envs\nlp\Lib\site-packages\sklearn\svm\_classes.py:32: FutureWarning: The default value of `dual` will change from `True` to `'auto'` in 1.5. Set the value of `dual` explicitly to suppress the warning.
  warnings.warn(
C:\Users\Britod\.conda\envs\nlp\Lib\site-packages\sklearn\svm\_classes.py:32: FutureWarning: The default value of `dual` will change from `True` to `'auto'` in 1.5. Set the value of `dual` explicitly to suppress the warning.
  warnings.warn(
C:\Users\Britod\.conda\envs\nlp\Lib\site-packages\sklearn\svm\_classes.py:32: FutureWarning: The default value of `dual` will change from `True` to `'auto'` in 1.5. Set the value of `dual` explicitly to suppress the warning.
  warnings.warn(
C:\Users\Britod\.conda\envs\nlp\Lib\site-packages\sklearn\svm\_classes.py:32: FutureWarning: The default value of `dual` will change from `True` to `'auto'` in 1.5. Set the value of `dual` explicitly to suppress the warning.
  warnings.warn(
C:\Users\Britod\.conda\envs\nlp\Lib\site-packages\sklearn\svm\_classes.py:32: FutureWarning: The default value of `dual` will change from `True` to `'auto'` in 1.5. Set the value of `dual` explicitly to suppress the warning.
  warnings.warn(
C:\Users\Britod\.conda\envs\nlp\Lib\site-packages\sklearn\svm\_classes.py:32: FutureWarning: The default value of `dual` will change from `True` to `'auto'` in 1.5. Set the value of `dual` explicitly to suppress the warning.
  warnings.warn(
C:\Users\Britod\.conda\envs\nlp\Lib\site-packages\sklearn\svm\_classes.py:32: FutureWarning: The default value of `dual` will change from `True` to `'auto'` in 1.5. Set the value of `dual` explicitly to suppress the warning.
  warnings.warn(
C:\Users\Britod\.conda\envs\nlp\Lib\site-packages\sklearn\svm\_classes.py:32: FutureWarning: The default value of `dual` will change from `True` to `'auto'` in 1.5. Set the value of `dual` explicitly to suppress the warning.
  warnings.warn(
C:\Users\Britod\.conda\envs\nlp\Lib\site-packages\sklearn\svm\_classes.py:32: FutureWarning: The default value of `dual` will change from `True` to `'auto'` in 1.5. Set the value of `dual` explicitly to suppress the warning.
  warnings.warn(
2026-06-20 19:58:14 | INFO | SVM | trial   0 | params={'C': 0.0745934328572655} | train_F1=0.8470 | val_CV_F1=0.6914
